,Date,Title,Introduction
2783,2023-10-08,丞磊痛失艺名,导语：丞磊录制《王牌对王牌》痛失艺名
2784,2023-10-08,刘耀文 小狗之歌,
2785,2023-10-08,孙颖莎3比2王曼昱,导语：🏓️#WTT球星挑战赛兰州站2023#女单半决赛，孙颖莎3-2战胜王曼昱【10-12、11-3、5-11、11-9、11-8】
2786,2023-10-08,李健 希望大家少经受挫折磨难,
2787,2023-10-08,他们离镜头最近却很少出现在镜头里,
2788,2023-10-08,被全红婵的i人属性迷住了,
2789,2023-10-08,烬相思定档,
2790,2023-10-08,朱一龙为角色增重减重50斤,导语：朱一龙为角色增重减重50斤
2791,2023-10-08,任嘉伦诉网友侵权案将开庭,导语：企查查APP显示，任嘉伦（本名 任国超）诉黄某某网络侵权纠纷案计划将于10月11日，在山东省青岛市市南区人民法院开庭审理。
2792,2023-10-08,更适合中国人味蕾的拿铁,
2793,2023-10-08,pdf写罪状录,
2794,2023-10-08,宋亚轩美拉德初秋穿搭,导语：宋亚轩王牌对王牌上班路透来了，美拉德初秋穿搭真的太帅了！
2795,2023-10-08,李梦回应带妆比赛,
2796,2023-10-08,iPhone15Pro蓝色钛金属价格暴跌,导语：自从iPhone 15 Pro系列上市后，蓝色钛金属版本在市场上遇冷，第三方店铺价格一直在下跌。
2797,2023-10-08,蓝天救援队否认中止搜救4岁女童,导语：10月8日，媒体报道，“上海蓝天应急救援服务中心”发布声明称#4岁女童搜救因外部原因中止#。蓝天救援队相关工作人员表示“上海的蓝天救援一直在搜索，该声明是另一拨人擅自发布，不代表蓝天救援队官方态度，搜救行动未中止，目前多名队员携带设备还在持续搜救。
2798,2023-10-08,王楚钦晋级男单决赛,导语：🏓#WTT球星挑战赛兰州站2023#男单半决赛，王楚钦3-0战胜林高远【12-10、11-3、11-3】
2799,2023-10-08,林俊杰画画竟然这么好,导语：林俊杰不仅唱功好，连画画水平都这么高！
2800,2023-10-08,S13赛前垃圾话,
2801,2023-10-08,千万不要穿抹胸去吃火锅,
2802,2023-10-08,海事部门已对走失女童开展搜救,
2803,2023-10-08,你有年轻人的秋天三件套吗,
2804,2023-10-08,王栎鑫是这个游戏的神吧,导语：《你好星期六》王栎鑫是这个游戏的神吧反应好快攻击自如
2805,2023-10-08,孙颖莎vs王曼昱,
2806,2023-10-08,沉浸式感受古人的秋日浪漫,导语：赏秋景、吃炒栗子，沉浸式感受古人的秋日浪漫。
2807,2023-10-08,网曝高校女生被要求抽签进男生宿舍搞卫生,导语：近日，有网友爆料湖北武昌首义学院一名女辅导员要求女生“群策群力助力男生宿舍卫生”，甚至抽签“统一一天进男生宿舍”，引发网友热议。
2808,2023-10-08,肖战演出作品表,导语：肖战演出作品表汇总🈶
2809,2023-10-08,原来男友身高会影响女友颜值,
2810,2023-10-08,亚运闭幕式大莲花变身大花园,导语：闭幕式将打造一个“大花园”，数控草坪将亮相，里面藏着4万个灯珠，当音乐响起，变幻无穷。期待！
2811,2023-10-08,谁还记得小耳朵时期的陈都灵,导语：真的好喜欢陈都灵对生活小美的见解，当年可爱的小耳朵已经成长为发现小美的优雅嘟嘟了～也更加从容去感受生活的每一刻美好啦
2812,2023-10-08,陈梦晋级女单决赛,导语：陈梦3-2战胜陈幸同，晋级WTT兰州站女单决赛！ ​​​5局比分分别是11-7、4-11、11-9、7-11、11-8。 ​
2813,2023-10-08,于适坐到车上衬衫被撑爆了,
2814,2023-10-08,巴以冲突动态,
2815,2023-10-08,狗子误食3斤泡酒杨梅醉倒后死亡,导语：10月6日，河南三门峡。一只拉布拉多犬误食大量泡酒的杨梅，醉晕后死亡。
2816,2023-10-08,张桂梅高速上将40余名学生护在身后,导语：10月6日，云南楚雄，大巴车意外故障，交警上前询问，得知车上载满40余名师生时，及时进行路面疏导，张桂梅也在此行师生中，张老师站在了队伍最外围指挥学生疏导至安全地带。现场工作人员也让张老师随同学们先行撤离，张老师直言：我不是最重要的。
2817,2023-10-08,李盈莹这一幕太让人心疼了,导语：看到李盈莹这一幕真的太让人心疼了！！
2818,2023-10-08,张彬彬孙珍妮新剧双A造型,导语：张彬彬孙珍妮新剧《千朵桃花一世开》双A造型
2819,2023-10-08,海底捞开到大学里了,导语：近日，陕西西安。有网友发帖称，海底捞火锅在自己就读的大学食堂二楼开了门店。
2820,2023-10-08,朱一龙过上了余华小说里的生活,导语：好消息：朱一龙过上了小说里的生活[抱一抱] 坏消息：是余华的小说，主打一个“活着”就好！
2821,2023-10-08,THE9演唱会抢票,导语：THE9演唱会抢票即将开始刘雨昕 虞书欣欣 许佳琪 喻言 谢可寅 安崎 赵小棠  孔雪儿 陆柯燃
2822,2023-10-08,文俊辉出席釜山电影节,导语：8日上午，文俊辉凭借《独家童话》出席釜山国际电影节行程，经由金浦机场前往釜山[抱一抱]
2823,2023-10-08,小小时代不是林萧顾里她们唱的,
2824,2023-10-08,王阳体重只有130斤,导语：王阳在节目中透露，体重只有130斤！
2825,2023-10-08,欧阳娜娜美拉德穿搭,导语：欧阳娜娜美拉德穿搭，娜比又去追星啦
2826,2023-10-08,泽连斯基发文声援以色列,
2827,2023-10-08,10种病会在夫妻间传染,导语：两个人结婚久了，会出现夫妻相，其实除了夫妻相，还会有“夫妻病”。越来越多研究发现，失眠、糖尿病、高血压、胃溃疡，甚至癌症，都会在夫妻间“传染”，只是很多人还没意识到。
2828,2023-10-08,上海女童失联监护人是否担刑责,
2829,2023-10-08,丞磊王牌对王牌上班,导语：丞磊王牌对王牌上班
2830,2023-10-08,心心相融爱达未来,导语：杭州第19届亚运会很快就要闭幕了，#心心相融爱达未来#，祝福亚运健儿，祝福亚洲，祝福每一个拼搏的你！
2831,2023-10-08,江歌妈妈直播带货,导语：10月7日，江歌妈妈发布视频称将直播带货，她表示：“直播带货的目的同样是为了赚钱，但我会把选品和服务放在第一位，把赚钱放在第二位。我更希望您不仅仅是因为我的遭遇，而是因为我推荐给您的商品好才下单。
2832,2023-10-08,冰岛偶遇迪丽热巴超市买菜,
2833,2023-10-08,田嘉瑞决定当演员的原因,
2834,2023-10-08,清华本硕博放弃北京中产去往非洲,导语：清华本硕博放弃北京中产去往非洲。
2835,2023-10-08,拜登准备为以色列提供一切支持手段,导语：美国总统拜登表示，美国明确谴责哈马斯从加沙对以色列发动袭击。拜登已明确向以色列总理内塔尼亚胡表示，准备为以色列政府和人民提供一切适当的支持手段。
2836,2023-10-08,在成都失联超半月女子遗体被找到,导语：10月7日，李女士表示，表姐的遗体从河中打捞起来后，家人已完成DNA比对。
2837,2023-10-08,周柯宇经纪公司声明,
2838,2023-10-08,侧躺玩手机 斜视,
2839,2023-10-08,张远试图聪明但失败了,导语：张远试图聪明但失败了哈哈哈哈哈
2840,2023-10-08,公交车里都是汉服公主是什么场面,导语：看到汉服热的苗头，洛阳推出了“穿汉服免费坐公交、进景区”等活动，“把整个城市当作一个场景来打造”。
2841,2023-10-08,外公查寄宿孙女饭卡记录担心吃不好,导语：近日，福建宁德。外孙女国庆回家，7旬外公查看其校园卡消费记录，看到花钱少就皱眉，担心其在校不好好吃饭。
2842,2023-10-08,韩国人不睡觉的标签可以撤了,
2843,2023-10-08,西安重大刑案嫌疑人被抓获,导语：据西安警方：西安西咸新区发生一起重大刑事案件，今天（10月8日）凌晨犯罪嫌疑人已被警方抓获。
2844,2023-10-08,女记者直播时身后大楼被以军夷为平地,导语：据半岛电视台10月7日报道，当天该媒体一名女记者在加沙报道巴以冲突时，其身后大楼遭到以色列战机空袭。
2845,2023-10-08,挖呀挖黄老师5场直播销售额超百万,导语：近日，网红鹿哈自曝带货7个月挣3500万，引发网友热议。因“挖呀挖呀挖”儿歌走红的武汉幼师黄老师，最近也开启了直播带货。数据显示，黄老师近30天内共开播5场，场均观看人次582.3万，最高观看人次814.8万，直播销售额100万-250万。
2846,2023-10-08,IVE小学生统领,导语：Ive演唱会场馆外都是家长
2847,2023-10-08,巴以冲突双方死亡人数已超400,导语：以军继续空袭加沙地带哈马斯目标 双方死亡人数已超400
2848,2023-10-08,秀动,
2849,2023-10-08,李子柒或将复出,导语：10月7日，在一段官方宣传片，停更多日的李子柒现身其中，网友猜测李子柒有可能于抖音正式复出。
2850,2023-10-08,成毅张予曦付辛博豪门秋日大片,
2851,2023-10-08,研究称人造子宫人体试验或很快会启动,导语：10月3日，日本《朝日新闻》播放了几条特殊鲨鱼在水箱中游动的画面。
2852,2023-10-08,杜华都接代言了,
2853,2023-10-08,上海4岁女童搜索区域已到浙江舟山,导语：10月4日，一名4岁女童在上海市浦东新区南汇新城海滩走失，此消息引发网友关注。
2854,2023-10-08,张彬彬是和桃花过不去了吗,导语：张彬彬是和桃花过不去了吗，时隔6年再接新剧还是桃花
2855,2023-10-08,终于知道为什么手术线会消失了,
2856,2023-10-08,中国队杭州亚运会201金收官,导语：杭州亚运会今日收官，中国队一共获得201枚金牌、111枚银牌、71枚铜牌！
2857,2023-10-08,以色列总理强硬表态,
2858,2023-10-08,你那不叫勇敢叫家里有钱,
2859,2023-10-08,林俊杰没有一首一千年以后是一样的,导语：林俊杰没有一首一千年以后是一样的
2861,2023-10-08,高圆圆今天穿的好温柔,导语：今日，高圆圆机场照新鲜出炉，这状态真的没谁了，皮肤好细腻，本人实名羡慕了!
2862,2023-10-08,杜华首谈章昊的实力和出道,
2863,2023-10-08,SMTOWN虚拟偶像Naevis明年出道,
2865,2023-10-08,4岁女童搜救因外部原因中止,导语：蓝天救援队否认搜救4岁女童工作结束：消息系另一拨人擅自发布
2866,2023-10-08,老乡鸡免费,导语：不走寻常路的“咯咯哒”又来整活，听说这次又要请吃饭了？吃货们速速集合，一起来干饭！
2868,2023-10-08,勇士战胜湖人,导语：勇士季前赛逆转战胜湖人
2869,2023-10-08,我国约2.45亿人患高血压,
2870,2023-10-08,王传君江疏影银幕饭搭子,
2871,2023-10-08,朱一龙新片形象灵感原型是余华,
2872,2023-10-08,奥特曼婚纱,
2874,2023-10-08,杭州亚运会临别礼物太暖了,
2875,2023-10-08,赵今麦8岁到21岁荧幕变化,
2876,2023-10-08,王楚钦是怎么夸队友的,导语：谈及队友，王楚钦说，他从樊振东身上学习沉稳与思考；马龙细腻、正直、极度自律且热爱乒乓，也是他的榜样；孙颖莎是天才，因她的思想和天赋。
2877,2023-10-08,粉笔模考,
2878,2023-10-08,陈雨菲父母说只要闺女开心打球就好,导语：杭州亚运会羽毛球女单决赛，陈雨菲不敌韩国选手安洗莹摘得银牌。陈雨菲父母对媒体表示，“我们家闺女，只要健健康康、开心打球就好！”
2880,2023-10-08,蜜雪冰城称将偷餐者绑天桥示众8小时,导语：近日，广东广州。有网友发现蜜雪冰城某门店手写偷餐警告，称偷餐者要被“绑到天桥上示众8小时”，“头上浇十桶奶茶”，偷餐视频还会被发布在网上。
2881,2023-10-08,国羽高燃4金收官,导语：国羽杭州亚运最终4金收官，超过上届一枚金牌。一起来欣赏国羽高燃4金庆祝时刻！
2882,2023-10-08,iPhone15美国市场销量或陷入停滞,
2883,2023-10-08,电影河边的错误定档,
2884,2023-10-08,陈飞宇爆料健身最卷的是魏晨,
2885,2023-10-08,原来困成狗是这么来的,导语：近日，广西一只中华田园犬用一狗之力告诉世人：原来困成狗是这么来的......
2886,2023-10-08,中国最好的博物馆排名,
2887,2023-10-08,叙利亚霍姆斯军事学院发生自杀式无人机袭击,导语：10月5日，叙利亚霍姆斯军事学院发生自杀式无人机袭击，截至目前已造成80余人死亡，200余人受伤。
2888,2023-10-08,专家建议增加学生春假,
2889,2023-10-08,我国发现战略性金属矿物,导语：近日，我国科学家发现了一种新矿物——铌（ní）包头矿，这是一种富含战略性金属的新矿物，富含的元素铌在我国核工业系统等领域具有重要用途。
2890,2023-10-08,孙燕姿麦克风失灵的四分钟,导语：意外造就的神仙大合唱！
2891,2023-10-08,林家栋重返TVB,
2892,2023-10-08,于文文好像难搞而不自知的甲方,导语：于文文好像难搞而不自知的甲方哈哈哈哈哈
2893,2023-10-08,婚礼上新娘穿校服入场新郎泪奔,导语：近日，安徽，婚礼上新娘穿校服入场，两人从校园到婚礼经历了11年爱情长跑，当新郎回过头那一刻激动哭了。
2894,2023-10-08,为什么工作之后一定要交社保,
2895,2023-10-08,37岁的他用自己的身体搅拌泥浆,导语：1960年，面对国家建设急需石油的燃眉之急，铁人王进喜率领“1205”钻井队开赴大庆参加石油大会战。在打第二口井时，发生了井喷，王进喜顾不上腿伤，跳进齐腰深的泥浆池，37岁的他用自己的身体搅拌泥浆，最终他和队友们合力制服了井喷。今天是铁人王进喜诞辰100周年，纪念！
2896,2023-10-08,她怎么躺在Windows桌面啊,
2897,2023-10-08,毛晓彤甜妹,导语：《问心》中，毛晓彤甜妹好甜！
2898,2023-10-08,一米五大叔27年跳水救起数十人,导语：安徽合肥，一米五大叔27年跳水救起数十人。
2899,2023-10-08,金秋天I want it I got it,
2900,2023-10-08,奶奶执意要种地全家借农具帮忙,导语：10月6日（发布时间），安徽宿州，女子晒出假期回家视频，称奶奶执意要种地，七八名家人一起帮忙翻地，调侃：全村抓钩子都被借来喽。
2901,2023-10-08,封神台词之活字乱刷术,导语：封神台词之活字乱刷术 ​​​
2902,2023-10-08,张艺兴问贝壳们请假理由,
2903,2023-10-08,现在流行线上出道,
2904,2023-10-08,官方通报防火指挥中心大屏播放不雅画面,导语：常熟市人民政府虞山街道办事处通报：经查，10月5日17时许，虞山森林防火队员林某在值班期间，违规拍摄不雅监控画面并转发，造成不良社会影响。目前，林某已被公安机关依法行政拘留。当值其他三名队员未对林某拍摄传播行为劝导制止，虞山街道已对三人进行停职处理，由街道纪工委进一步调查。
2905,2023-10-08,有人没听车银优这一声笑我都会伤心的,
2906,2023-10-08,北京奥运外套再现杭州亚运还很新,
2907,2023-10-08,2024年考研报名正式开启,导语：祝考生们逢考必过，一战成硕！加油！
2909,2023-10-08,杭州亚运会今天闭幕,导语：这个金秋，感谢你们带来的感动。 ​​​
2910,2023-10-08,梅西复出替补,导语：美职联常规赛，迈阿密国际主场0-1不敌辛辛那提，提前2轮无缘季后赛！梅西复出替补登场！
2911,2023-10-08,歌迷看薛之谦演唱会被抬出送医,导语：10月6日，河北石家庄，薛之谦演唱会歌迷突发不适，被多名安保人员担架抬出。安保公司称，事发突然，第一时间联系医疗部门并上报情况及时处理，目前此事由医疗部门跟进。
2912,2023-10-08,侯明昊的骨相,导语：侯明昊真的长开了，现在的骨相真的太绝啦，棱角分明。
2913,2023-10-08,千朵桃花一世开,
2914,2023-10-08,小沈阳满脸写着我想逃,导语：小沈阳满脸写着我想逃！
2915,2023-10-08,苏醒还想淘汰蔡国庆,导语：苏醒紧急撤回蔡国庆老师的名字
2916,2023-10-08,侯明昊头发竟然没有散下来,导语：​侯明昊《大梦归离》路透差点痛失发簪，头发竟然没有散下来，他拿伞当兵器，好期待!
2917,2023-10-08,魏大勋新角色也太惨了吧,导语：黄子诚@魏大勋 的遭遇何止一个“惨”字了得！被胁迫偷取父亲的资料、多次惨遭背刺，被电击、刺伤、丢下海...全程遭受来自身体和精神的双重打击，心疼子诚饱饱！
2918,2023-10-08,地铁好像成了打工人的休息室,导语：地铁好像成了打工人的休息室
2919,2023-10-08,范志毅送林雨薇127根发带,导语：范志毅送林雨薇127根发带
2921,2023-10-08,寒露,导语：寒露时节，秋深露重，层林尽染，快带话题#寒露#分享你身边的斑斓秋色吧～
2922,2023-10-08,湖人vs勇士,导语：NBA焦点大战，湖人vs勇士。
2923,2023-10-08,民警凌晨救下轻生男子后说睡不着了,导语：10月6日凌晨，长沙岳麓区，一名男子喝酒后情绪激动，站在桥栏杆上欲轻生。54岁民警杨志清赶到边安慰边找路人帮忙打掩护，随后他翻过栏杆一把将人救下，并带回派出所抱着安慰了一个多小时。
2924,2023-10-08,lofter,
2925,2023-10-08,母亲去世5年全家瞒着98岁外婆,导语：近日，山东烟台，当事人张女士介绍，2018年母亲因突发疾病离世，家里人一直瞒着98岁的外婆，骗她说妈妈出国打工了。每次去看外婆，外婆都会问什么时候回来。家里人也因此陷入两难境地，说出事实担心高龄外婆身体情况，不说又怕有遗憾，外婆不知道永远等不到她女儿回娘家
2926,2023-10-08,我国航天事业创建67周年,导语：1956年10月8日，国防部第五研究院正式组建，我国航天事业从此诞生。这一天刚好是钱学森回国一周年。
2927,2023-10-08,86版西游记部分取景地,
2928,2023-10-08,谭爷爷亲自示范教花花滑滑梯,
2931,2023-10-08,吉鲁扑单刀,导语：米兰vs热那亚，迈尼昂红牌被罚下，米兰没换人名额了，吉鲁客串门将并在补时扑出对方单刀球！
2932,2023-10-08,迷笛音乐节要反思的不是当地群众,
2933,2023-10-08,夫妻吵架后第二天的便当,
2934,2023-10-08,这些食物不要放在冰箱里保鲜,
2935,2023-10-08,不会剥柚子的人有福了,导语：不会剥柚子的人有福了
2936,2023-10-08,巴以冲突,
2939,2023-10-08,黄渤去了张艺兴演唱会,导语：黄渤去了张艺兴演唱会
2941,2023-10-08,黄景瑜张婧仪张凌赫笑点好密集,
2942,2023-10-08,美国众议院陷入一片混乱,导语：美国国会众议院10月3日投票通过了一项撤换共和党籍众议长麦卡锡的决议，使其成为了美国历史上首位被投票罢免的在任众议院议长。
2943,2023-10-08,气血不足先学会忌口,导语：人体气血充足时，神清气爽、思维敏捷、面色红润、皮肤光滑、毛发润泽、关节灵活，反之容易出现精神恍惚、心悸不安、关节疼痛、消瘦或肥胖等问题。气血不足的人应注意调整饮食、养好脾胃。
2944,2023-10-08,陈楚生阿璞反差感版光明,导语：你懂什么是强强联合～
2947,2023-10-08,班主任自费千元组织学生看电影志愿军,导语：“观影的时候，很多孩子泪流满面，哭得泣不成声。”
2948,2023-10-08,从今天起就是深秋了,导语：寒露至。天冷加衣，照顾好自己。
2951,2023-10-08,中国队在国际警察射击比赛中夺冠,导语：9月30日至10月2日，第四届国际警察射击比赛在匈牙利首都布达佩斯举行。中国警察射击代表团有8名队员参赛，斩获多个团体、单项桂冠。这是中国警察参加该项赛事以来，在国外取得的历史最好成绩。安仔：为梦想而战，为祖国争光！
2952,2023-10-08,台风小犬,导语：9月30日早晨，今年第14号台风“小犬（Koinu，名字源自日本）”在距离菲律宾马尼拉以东约1200公里的太平洋洋面上生成。
2955,2023-10-08,黄子诚夜闯被抓,导语：黄子诚晚上乔装进周哲一办公室，想要找到他与夜雾有联系的证明，却不幸被抓
2960,2023-10-08,黄景瑜是会安慰张凌赫的,导语：张凌赫：景瑜哥你人还怪好的嘞
2962,2023-10-08,安洗莹让陈雨菲展示我姓石,
2964,2023-10-08,曼联,
2968,2023-10-08,0713全员演技在线,导语：点击解锁，《你好，星期六》音乐卧底游戏0713版！第一回合只见苏醒一顿分析排除王铮亮、张远功成身退，却遭王栎鑫质疑律动，据理力争“我年纪到了”！ 陆虎律动和卧底歌曲适配度拉满～ 第二回合大家警惕感拉满，苏醒再度清醒分析，卧底是王栎鑫和自己二选一！
2970,2023-10-08,中国女排夺冠后小青荷求合影,导语：中国女排夺冠后，小青荷把女排包围纷纷求合影。致敬梦想，致敬拼搏！我们是冠军！
2973,2023-10-08,亚运闭幕式门票,导语：亚运闭幕式门票
2974,2023-10-08,张雨霏亚运女子MVP,导语：本届亚运会上，张雨霏共夺得了6枚金牌。
2975,2023-10-08,以色列遭袭后炮击加沙地带,导语：综合外媒报道，巴以局势7日再次升级，以色列军队开始对加沙地带的巴勒斯坦伊斯兰抵抗运动(哈马斯)目标发起袭击，以回应其稍早前对以色列发起的火箭弹袭击。
2976,2023-10-08,印度小哥送英文锦旗感谢民警,导语：近日，上海。青村派出所收到了一面英文锦旗。一位印度国际友人刚到上海准备入住酒店时，发现行李丢了，酒店经理了解情况后，向社区民警求助。
2977,2023-10-08,诛仙世界抽疯了,
2980,2023-10-08,98名浙江运动员已获50块金牌,导语：首金“联袂夺得”、泳军“半壁江山”、射击“小鬼当家”…… 98名浙江参赛运动员，已经获得50块金牌
2982,2023-10-08,陈都灵吃饭也走流程,导语：陈都灵吃饭也走流程，相机先吃然后自己再吃，哈哈哈。
2985,2023-10-08,杨幂若把你直拍,
2991,2023-10-08,kpop组合专辑总销量TOP9,导语：kpop爱豆专辑总销量top9
2992,2023-10-08,虞书欣你怎么骗人啊,
2993,2023-10-08,亚运会羽毛球,
2996,2023-10-08,2023F1卡塔尔大奖赛,导语：2023F1卡塔尔大奖赛将于当地时间10月6日-8日举行。
2997,2023-10-08,阿彩婚礼,导语：太美了！又是泪流的一天👰🏼
3002,2023-10-08,罗云熙早秋棕色系奶茶穿搭,导语：罗云熙早秋棕色系奶茶穿搭
3005,2023-10-08,伯恩利vs切尔西,
3006,2023-10-08,孟鹤堂你就宠郑恺吧,
3007,2023-10-09,中国工会第十八次全国代表大会在京开幕,导语：中国工会第十八次全国代表大会9日上午在人民大会堂开幕。习近平、赵乐际、王沪宁、丁薛祥、李希等党和国家领导人到会祝贺，蔡奇代表党中央致词。
3008,2023-10-09,Z先生到底是谁,
3009,2023-10-09,老两口退休工资1万2被女儿送养老院,导语：近日，重庆的陈大爷称，自己的女儿强迫他和老伴住养老院，如今住不惯，想搬出去，却遭到女儿拒绝。陈大爷说，自己的退休工资加上老伴的，1个月有12000元，原来有一栋房子，住进养老院后所有的财产都给了女儿。
3010,2023-10-09,中国申办亚运时的承诺都做到了,
3011,2023-10-09,陈奕迅在美吐槽旧金山街头吸毒泛滥,
3012,2023-10-09,蟹老板的女儿为什么是个抹香鲸,
3013,2023-10-09,以色列宣布全面封锁加沙地带,导语：以色列国防部长加兰特9日说，他已指示以军“全面封锁”巴勒斯坦加沙地带。
3014,2023-10-09,微信内存从126G到75G,
3015,2023-10-09,张真源 跑男,
3016,2023-10-09,美国同意三星和SK海力士向其中国工厂提供设备,
3017,2023-10-09,有人自林中坠落,导语：蒲熠星的第一本科幻悬疑小说《有人自林中坠落》揭示了人性中的复杂和自然界的神秘力量，读者可以从中感受到作者对于人性的思考以及对社会的深刻洞察力
3018,2023-10-09,Angelababy喂范丞丞吃葡萄主打避嫌,
3019,2023-10-09,嗯哼甜馨一起郊游,导语：嗯哼甜馨一起郊游被偶遇
3020,2023-10-09,赵露思晒了童年照,导语：赵露思晒了童年照
3021,2023-10-09,巴以本轮冲突双方伤亡人数已超6000,
3022,2023-10-09,中国女运动员摘金108枚,导语：中国代表团共获得201金111银71铜，其中女运动员共摘得108金，男女混合项目获11金。中国体坛巾帼，真是好生了得！再次祝贺姑娘们！
3023,2023-10-09,秋天就要听那英肖战恼人的秋风,
3024,2023-10-09,宫脇咲良发文道歉,导语：LESSERAFIM目前已经回到韩国，宫脇咲良又发文道歉了
3025,2023-10-09,非自然死亡 翻拍,
3026,2023-10-09,金智秀问是谁说冷的,导语：穿羽绒服回来的智秀被粉丝问热吗，智秀“谁说的！到底是谁说冷的！”
3027,2023-10-09,中国男子水球队主教练去世,导语：据上海水球消息，中国男子水球队主教练Petar Porobic因心脏病不幸离世，享年67岁。
3028,2023-10-09,建议1周换1次床上用品,导语：你们都是多久换一次床上用品！
3029,2023-10-09,女子PPT举报前夫婚内出轨博士造假,导语：10月9日，一女子以PPT形式公开举报合肥市城乡建设局二级主任科员刘晨洁。举报材料显示，刘晨洁系举报者前夫。PPT列举了刘晨洁作风问题十四宗罪，其与曹姓女子长期存在不正当关系，且存在拒付生活费，转移财产，博士造假违规入读等行为。
