,Date,Title,Introduction
0,2023-01-31,强信心开新局,导语：航班高铁飞驰穿梭，热门景点人头攒动，网红餐厅千人等号，影院剧场座位爆满……红红火火的节日盛景向世界展现了一个充满生机、蓬勃向上的中国。全球第二大经济体持续释放发展潜能，为低迷的世界经济注入动力、信心和确定性。
1,2023-01-31,黄瑶 卧底,
2,2023-01-31,刘德华说嗑到了,导语：《流浪地球》剧组好会刘德华说嗑到了哈哈哈哈哈哈哈
3,2023-01-31,1月份制造业PMI升至50.1%,
4,2023-01-31,杭州电梯坠亡案女童姥姥去世,
5,2023-01-31,京海唯一纯白的茉莉花,导语：安欣是京海唯一纯白的茉莉花
6,2023-01-31,胡鑫宇购买录音笔数据删除后无法恢复,
7,2023-01-31,狂飙,
8,2023-01-31,杜海涛撑起了吴昕的朋友圈,导语：《半熟恋人2》吴昕爆料自己五六年前的朋友圈全都是杜海涛的搞笑事迹连载，被好友圈天天催更😂
9,2023-01-31,狂飙大结局预告,
10,2023-01-31,结婚该不该考虑另一半的家境,导语：你觉得结婚该不该考虑另一半的家境呢？你会在意另一半的家境吗？
11,2023-01-31,胡歌 我当爸爸啦,
12,2023-01-31,唐小虎下线,导语：《狂飙》唐小虎下线。
13,2023-01-31,想减肥的有福了,导语：想减肥的有福了！好坚持快乐的刷脂减肥操安排了！
14,2023-01-31,唐嫣说小姐姐可以陪妹妹玩啦,导语：唐嫣恭喜胡歌当爸“小姐姐可以陪妹妹玩啦”
15,2023-01-31,男孩撸猫后发烧12天腋下长鸡蛋大肿块,导语：近日，浙江杭州。十多岁的少年聪聪发现右腋下淋巴结肿大12天，伴压痛，病初伴高热2天，最高39.2℃。
16,2023-01-31,律师谈12.4万保时捷遭抢购后下架,导语：周兆成律师表示，商家单方面取消订单，既不符合法律规定，又违背诚实信用的原则，侵害了消费者的合法权益，应承担相应法律责任。
17,2023-01-31,压力给到彭于晏,导语：胡歌官宣已婚生女，网友调侃：压力给到彭于晏了
18,2023-01-31,遭辱骂女子被对方举报要求视频下架,导语：女游客制止6岁男孩上女厕遭其母辱骂：对方举报要求视频下架
19,2023-01-31,如何看待脱口秀春晚收视率第一,导语：1月30日，中国视听大数据发布了“2023年春节主题晚会收视”情况。
20,2023-01-31,原来小狗喝多了是这样的,
21,2023-01-31,胡鑫宇外婆是从老伴手机上得知噩耗,
22,2023-01-31,胡鑫宇哥哥正在北京全程见证录音笔的鉴定,导语：1月31日下午1点多，大皖新闻记者联系上胡鑫宇的哥哥胡杰。胡杰说，他是录音笔鉴定的见证人，全程见证录音笔的鉴定。胡杰告诉大皖新闻记者，该录音笔是1月29日凌晨开始送去鉴定，目前他正在北京等待鉴定结果。
23,2023-01-31,张云雷开箱,
24,2023-01-31,任嘉伦找兜,导语：任嘉伦找兜真的看一次笑一次！咱就是说这衣服兜到底在哪里？
25,2023-01-31,闪耀暖暖,
26,2023-01-31,张译竟然这么会亲,导语：谁能想到外表看起来这么正直的张译，私底下这么会亲啊！！
27,2023-01-31,肖战任敏玉骨遥暂定43集,导语：肖战任敏主演的《玉骨遥》暂定43集
28,2023-01-31,郭帆证实流浪地球3会有图恒宇,
29,2023-01-31,三体叶文洁被PUA,导语：《三体》雷志成一边肯定叶文洁的工作能力，一边又反复强调这份信任只是出自他个人，雷志成这算是职场pua大师吧！
30,2023-01-31,母子围炉煮茶一氧化碳中毒身亡,导语：50多岁的儿子和70多岁的母亲在家中用铸铁炭火炉围炉煮茶，因天冷关闭门窗，导致两人一氧化碳中毒。急救人员赶到现场时，母子二人已没了心跳。
31,2023-01-31,秦霄贤新发色,
32,2023-01-31,变成电子宠物有多可怕,导语：存在于计算机中的自我意识在外界看来只是一串代码罢了
33,2023-01-31,fgo,导语：《Fate/Grand Order》是TYPE-MOON发行的角色扮演类手机游戏，为Fate系列的续作！
34,2023-01-31,赵露思神隐捂嘴笑路透,导语：赵露思《神隐》捂嘴笑路透
35,2023-01-31,彭于晏你着急吗,导语：胡歌官宣结婚当爸，压力给到彭于晏，彭于晏你着急吗？
36,2023-01-31,运气比努力重要吗,导语：在漫长的人生中究竟运气重要，还是努力重要？来北京卫视《大先生》，听听周忠和院士怎么说！
37,2023-01-31,Doggo 泽丽,
38,2023-01-31,要和腰间赘肉说拜拜了,导语：脂肪最容易堆积的就是腰部啦！快来一起进行下腹部训练，和腰间赘肉说拜拜！！
39,2023-01-31,武林外传预言流浪地球2,导语：《武林外传》预言《流浪地球2》永远可以相信武林外传 ​​​
40,2023-01-31,一九七五九六 你生日,
41,2023-01-31,狗狗的小碎步有多可爱,导语：刚学会走路的小奶狗走的摇摇晃晃的，好可爱呀！
42,2023-01-31,宋祖儿小乔开机照两宫格,导语：宋祖儿《折腰》小乔开机照两宫格~梳妆已毕，即刻开启联姻新旅程
43,2023-01-31,情侣婚前是否有必要同居,导语：中国青年网校园通讯社针对“情侣恋爱阶段可不可以同居”的话题，面向全国1264名大学生展开问卷调查，结果显示644名大学生认为可以，占比51%。
44,2023-01-31,苏州坐地铁可直达上海,导语：据嘉定区新闻办介绍，与上海轨交11号线相接的苏州轨交11号线（原名S1线）目前正全力冲刺，预计今年3月1日试运行。苏州轨交11号线可与上海轨交11号线在花桥站实现换乘，而上海地铁11号线的终点站即为迪士尼。
45,2023-01-31,女生过年回家一开门来了十几个相亲,导语：河南郑州一女生回家被长辈安排相亲，没想到一开门来了十几个，这让女生有点措手不及，网友纷纷表示：现在男的压力都这么大了吗？
46,2023-01-31,自动续费忘记关闭怎么办,导语：不要再做大怨种啦！
47,2023-01-31,丁程鑫点脸,导语：丁程鑫《孤独怪物》直拍点脸好苏~
48,2023-01-31,相亲到什么程度可以结婚,导语：你觉得相亲到什么程度可以结婚呢？
49,2023-01-31,原来红岸是研究外星文明的,导语：好奇已久的答案《三体》电视剧终于揭晓了！红岸竟然是用来探索外星文明的，你猜到了吗？
50,2023-01-31,父母帮小男孩抓海鸥强行塞进塑料瓶,
53,2023-01-31,高启强女儿被绑架,导语：《狂飙》39集预告高启强女儿被绑架
54,2023-01-31,湖南一网吧凌晨变狂飙专场,导语：1月29日，湖南娄底。男子去网吧呆到凌晨，起身上厕所时发现好多人都在看《狂飙》。
59,2023-01-31,保时捷官网12.4万元帕纳梅拉遭抢购,导语：1月30日，银川保时捷中心上线了12.4万一辆的Panamera，首付低至3万，博主@叨哥胡侃 支付了911元的订金抢购，随后保时捷下架此车，并将911元订金退回。据了解，截至1月30日22点41分，该链接共有598个预订单。
69,2023-01-31,LNG海报,导语：LNG发布预热海报
73,2023-01-31,介意对象有很好的异性朋友吗,导语：你介意你的另一半有关系很好的异性朋友吗？
74,2023-01-31,李现回母校被偶遇,导语：偶遇李现回母校，羡慕荆州中学的同学们 ​​​
77,2023-01-31,Angelababy说君绮罗今日启程,导语：Angelababy说君绮罗今日启程
78,2023-01-31,杭州中考取消外籍华人的子女加分,导语：今天，杭州市教育局发布《关于进一步完善杭州市区普通高中名额分配招生工作的通知》（征求意见稿）。
82,2023-01-31,女生和离异带娃男相亲被其前妻劝退,导语：近日，一名25岁女子的朋友，给她介绍了个相亲对象。然而到场后她才发现，对方离异不说而且还带着6岁的女儿。
83,2023-01-31,狗子的心思都写在了脸上,
84,2023-01-31,吴京战狼系列收视登顶,
85,2023-01-31,安欣没提挽留但处处都在挽留,导语：《狂飙》开始乱飙了，呜呜呜，要不要这样啊，安欣没提挽留但处处都在挽留，还是希望可以在一起啊！！
86,2023-01-31,仙剑留守儿童,导语：不催不催，老胡坚守阵地。
87,2023-01-31,原来黎族服饰也能很时尚,导语：近日，海南保亭的一场村民时尚非遗走秀受到关注。返乡青年、本地村民、六旬阿姨作模特，身着树皮衣、黎锦、藤编等具有黎族特色的非遗服饰在乡村大秀场上展示非遗文化之美。据悉，全场服饰由海南小伙龙龙不时尚改良创作。
88,2023-01-31,台湾2月7日起取消大陆赴台旅客核酸检测,导语：据台湾《联合报》报道，台湾地区流行疫情指挥中心指挥官王必胜今日（31日）宣布，自2月7日起取消大陆赴台旅客唾液PCR核酸筛检措施；另外也取消自大陆启程经港澳转机赴台旅客需持有48小时内PCR检验报告或24小时内抗原快筛检验报告的措施。 ​
89,2023-01-31,总书记的兔年奋斗寄语,导语：新征程是充满光荣和梦想的远征，没有捷径，唯有实干。新春开工，一起重温习近平总书记的奋斗寄语，汲取奋斗力量，一道加油努力！ ​​​
117,2023-01-31,蒋天的普通话,
120,2023-01-31,李一桐曾被韩国星探选中两次,导语：原来李一桐曾经被sm星探选中两次！一次是还在中学读艺术学校，一次是已经上大学读舞蹈学院的时候。能被同一个星探选中两次，看来姐姐真得很有星相啊，现在的演员路走得也很稳当～
122,2023-01-31,看到猫挑衅鸟的样子,导语：猫学鸟走路，看到猫挑衅鸟的样子也太好笑了！
124,2023-01-31,初四相亲初八订婚算闪婚吗,
125,2023-01-31,高启兰怀疑高启强,
126,2023-01-31,相思令阵容官宣,
128,2023-01-31,少年江湖首支预告,导语：由敖瑞鹏邓超元宗元圆主演的电视剧《我才不要当盟主》更名为《少年江湖》并首次发布预告片
129,2023-01-31,蔡徐坤徐江同款穿搭,导语：蔡徐坤和《狂飙》里的徐江同款穿搭
131,2023-01-31,叶文洁重返红岸基地,导语：在《三体》电视剧中时隔30年重返红岸基地的叶文洁跨时空和另一个自己相逢，封存多年的秘密即将揭晓，对即将到来的真相期待吗？
132,2023-01-31,杨紫199爱穿校服做广播体操路透,
134,2023-01-31,一批新规2月开始施行,导语：兔年新春伊始，一批新规自2月起施行：试点恢复出境团队旅游业务、#烈士褒扬政策制度进一步完善#、加强城镇水污染防治、推广疼痛综合管理……看一看哪一条你最关心？
145,2023-01-31,王鹤棣手电筒亮了变装视频,导语：王鹤棣手电筒亮了变装视频来了，好帅啊，一个手电筒把我拿捏了
153,2023-01-31,记汪峰旷工一天,导语：胡歌当爸爸，记汪峰旷工一天！ ​
158,2023-01-31,初三男生打水漂画面犹如特效,导语：初三男生沈丹瑶从小喜欢打水漂，多年练习下，他从“一发双漂”练到可以“一发四漂”，花样不断。
159,2023-01-31,张颂文眼技,导语：张颂文眼神戏好强啊！脸部满满的情绪！
162,2023-01-31,南柱赫确定3月20日入伍,导语：据韩媒，南柱赫3月20日入伍，加入韩国首都防卫司令部。 ​​​​
164,2023-01-31,强盛集团旗下公司因未缴社保被罚,导语：风险信息显示，该公司曾因未为叶某缴纳社会保险费4.82万元，经北海市社会保险经办中心责令为其补缴，当事人逾期仍不缴纳，被罚4.82万元。
166,2023-01-31,中国人对喝热水有多执着,导语：记得多喝热水
167,2023-01-31,陈飞宇片场帮张婧仪戴口罩,导语：《点燃我温暖你》陈飞宇片场帮张婧仪戴口罩
168,2023-01-31,半熟入住前,
169,2023-01-31,杜华说王一博无法被复制,导语：杜华说王一博无法复制，也不会复制 ​​​~
170,2023-01-31,优酷回应1元会员取消续费被扣24元,导语：优酷向@凤凰网科技 表示：“1元会员”指的是优酷VIP月月省活动，这是优酷推出的会员优惠产品，相关页面已对活动规则进行明确告知：首月1元，后11个月12元/月，若提前退出，需按会员费25元/月退回已享优惠。
171,2023-01-31,银川保时捷中心涉多起合同纠纷,导语：据媒体报道，1月30日，宁夏银川保时捷中心上线了12.4万一辆的Panamera，首付低至3万，随后保时捷下架此车。 ​​​​​​天眼查App显示，宁夏银川保时捷中心关联公司为宁夏新丰泰信捷汽车销售服务有限公司。风险信息显示，该公司存在多起买卖合同纠纷。
172,2023-01-31,中方回应美将禁止向华为提供任何产品,导语：中方坚决反对美方泛化国家安全概念，滥用国家力量，无底线、无理打压中国企业。
173,2023-01-31,宫脇咲良说因为我们是世界巨星,导语：宫脇咲良说因为我们是世界巨星，好帅呀我们的小樱花
174,2023-01-31,仙剑3主演都有孩子了,导语：仙剑3主演全员有孩子了，我的青春结束了
175,2023-01-31,犯错之后很紧张的狗狗,导语：犯错之后很紧张的狗狗，一副小心翼翼又颤颤巍巍的样子，太可爱啦！
190,2023-01-31,白鹿二月九宫格营业照,
196,2023-01-31,胡彦斌 满江红制作成本1000万重要吗,
202,2023-01-31,杨幂张大大什刹海滑冰合照,导语：杨幂张大大什刹海游玩合照🈶️
204,2023-01-31,外交部回应对韩国旅客全员核酸传言,导语：“令人遗憾的是，个别国家仍然执意针对中国采取歧视性入境限制措施，对此中方坚决反对，并有理由采取必要的对等措施。”
205,2023-01-31,优酷回应1元会员退费争议,导语：针对优酷1元会员因退费续订问题引争议，优酷回应称：“1元会员”指的是优酷VIP月月省活动，这是优酷推出的会员优惠产品，相关页面已对活动规则进行明确告知：首月1元，后11个月12元/月，若提前退出，需按会员费25元/月退回已享优惠。
206,2023-01-31,虞书欣的二月行程图,
207,2023-01-31,当代年轻人的厨房现状,导语：当代年轻人下厨房让人这么惊奇，这一根饺子有点厉害了，哈哈哈
208,2023-01-31,狂飙爆火谁是最大赢家,导语：据中国新闻网消息，“《孙子兵法》卖断货”“大嫂烫发争相模仿”“咖啡不用冲”……随着电视剧《狂飙》的热播，意外带火了的还有相关商品，《狂飙》的出品方也引发关注。
209,2023-01-31,当刘德华的女儿是什么感受,
212,2023-01-31,WE战胜TT,导语：2023LPL春季赛，WE直落两盘击败TT，中单Shanks发挥出色，拿下两局MVP！
213,2023-01-31,张婉婷说没怀孕不会跟宋宁峰在一起,导语：《再见爱人》36问被问到如果没怀孕两人是否还会在一起时，宋宁峰说还是会在一起，张婉婷却直言没怀孕不会在一起。
214,2023-01-31,谭松韵的四篇plog,导语：谭松韵的四篇plog，美食篇 花花篇 风景篇 我篇~
216,2023-01-31,赵丽颖给2022年的自己打90分,导语：赵丽颖✖️星映话2022年度面孔专访花絮：赵丽颖给2022年的自己打90分！
217,2023-01-31,太突然了,
218,2023-01-31,宋亚轩新歌舞台个人直拍,导语：宋亚轩新歌舞台个人直拍
219,2023-01-31,王一博王传君无名未曝光跳舞片段,
220,2023-01-31,TT对战WE,
221,2023-01-31,女子回应制止男童上女厕所被骂,
243,2023-01-31,胡鑫宇家人决定暂不火化遗体,导语：1月30日，红星新闻记者专程来到铅山县永平镇陈家寨，胡鑫宇的母亲李连英告诉红星新闻记者，目前家属尚未看到法医鉴定报告。他们决定暂不火化胡鑫宇的遗体，等待真相到来。
248,2023-01-31,一家人在耳聋爷爷面前商量买墓地,导语：近日，安徽。一女子晒视频称爷爷最近生了场大病，大年初一晚上，姑父们的聊天让她五味杂陈。
249,2023-01-31,男生和女生初四相亲初八直接订婚,导语：1月29日，广西，一名男生和女生初四相亲见面，不料初八就直接打算订婚。
250,2023-01-31,胡鑫宇,
254,2023-01-31,没人忍得住不暗戳戳的秀,
256,2023-01-31,狂飙一下子变乱飙,导语：让你狂飙，没让你乱飙
258,2023-01-31,2023电影票房破100亿,
259,2023-01-31,美国将禁止供应商向华为提供产品,导语：据美国彭博社报道，知情人士透露，美国政府正在考虑切断美国供应商与中国华为公司之间的所有联系，禁止包括英特尔和高通在内的美国供应商向华为提供任何产品。
262,2023-01-31,女子应对亲戚催婚舌战群儒,导语：1月28日，浙江杭州。女子过年聚餐遇到亲戚狂催婚，她舌战群儒，坚定自己的婚姻不能将就。
264,2023-01-31,有点大聪明的小猫咪,导语：看起来不聪明，因为我是大聪明～
265,2023-01-31,小伙捡路边喝剩饮料瓶拍打卡照,导语：小伙捡路边喝剩饮料瓶拍打卡照
292,2023-01-31,导演说狂飙的结局是惨胜,导语：导演说《狂飙》的结局是惨胜~~
294,2023-01-31,狂飙剧情 指导组被实名举报受贿,
295,2023-01-31,5岁男童抗癌3年体重仅剩10公斤,导语：日前，云南省昭通市，小杰被确诊为急性巨核细胞白血病(M7型)。三年来，经历化疗、移植、排异等治疗家里花费超过百万元，且接下来的抗排异治疗费用缺口保守估计要30万元。
296,2023-01-31,阴阳师,
297,2023-01-31,北京WB新春大片,导语：北京WB新春大片上线～帅气猴崽来拜年，祝大家新年快乐！
298,2023-01-31,当我养了四只社恐猫咪,导语：朋友：心理问题，幻想自己养了四只猫
299,2023-01-31,再见爱人,导语：《再见爱人》第三季定档，9月4日中午12点，先导片上线；9月5日起，每周二中午12点上线！一起来看！
300,2023-01-31,海军万吨大驱第一视角太震撼,导语：近年来，多艘055型驱逐舰陆续入列，人民海军“万吨大驱”家族不断壮大。一起随“万吨大驱” 乘风破浪！
301,2023-01-31,父母该不该带孩子进异性厕所,
302,2023-01-31,李健早期微博,导语：考古李健早期微博，响哥也太搞笑太中二了哈哈哈
303,2023-01-31,南京大屠杀幸存者周湘萍去世,导语：据@侵华日军南京大屠杀遇难同胞纪念馆 消息，南京大屠杀幸存者周湘萍于1月30日去世，享年94岁。
304,2023-01-31,看完满江红留下的后遗症,导语：看完满江红眼神都坚定了许多～
305,2023-01-31,狂飙 正面人物,
306,2023-01-31,节后为了搞钱能有多拼,导语：节后的年轻人搞钱技能增加了
307,2023-01-31,这鱼是我的打工嘴替吧,导语：这哪是采访鱼啊，这是采访我的打工嘴替吧，《次元，破了！》替所有打工人说出真实想法
308,2023-01-31,开局之年共奋进,导语：开局关乎全局，起步决定后程。2023年是全面贯彻落实党的二十大精神的开局之年。让我们一起凝心聚力、勇毅前行，以斗争精神迎接挑战，以奋进拼搏开辟未来。
309,2023-01-31,一句话总结2023第1个月,导语：一句话总结2023第1个月！为自己发条微博，愿明天会更好！
312,2023-01-31,人民日报评刘亦菲李现去有风的地方,导语：人民日报评价刘亦菲李现去有风的地方一部剧带火一座城，没错！
318,2023-01-31,薛之谦的第一场线上演唱会,导语：薛之谦的第一场线上演唱会，2月3日晚8点，等你来听~
331,2023-01-31,张颂文旧照,导语：张颂文旧照来了，奶帅奶帅的，这气场是与生俱来的没错了[酷]
337,2023-01-31,强盛集团旗下公司年终奖现金堆成山,导语：电视剧《狂飙》带火山东强盛集团，该集团在广西北海的海产品加工基地所发放的年终奖，现金堆成山。
339,2023-01-31,Angelababy相思令开机造型,导语：Angelababy新剧今日开机，baby的古装适配度太高了！
340,2023-01-31,世界上最大的百年古堂灯亮了,导语：浙江东阳亮起了世界上最大的堂灯，美出天际。冷知识：这盏灯逢闰年才会悬挂，快来接好运！
341,2023-01-31,田亮女儿网球职业赛首秀告捷,导语：新加坡J30女单首轮，田雨橙6-3/6-1战胜对手，取得青少年赛开门红。
343,2023-01-31,保时捷回应12.4万保时捷遭抢购,导语：保时捷回应12.4万保时捷遭抢购：情况属实，已与首单用户达成协议
344,2023-01-31,狂飙高启强表情包,导语：狂飙高启强表情包
345,2023-01-31,录音笔在胡鑫宇遗体旁边墙洞,导语：胡鑫宇遗体发现过程更多细节：位于粮库竹林处，录音笔在旁边墙洞
346,2023-01-31,第三卫生间,导语：如公共区域，因身体欠佳或因年龄大，出现女儿想要协助老父亲、儿子想协助老母亲、父母想要协助孩子上厕所怎么办？为解决特殊游客群体如厕需求，黑龙江省旅游委要求本省5A级景区在2017年年底前，必须具备“第三卫生间”。
348,2023-01-31,这猫咪是被点穴了吗,导语：好家伙，这小猫是被点穴了吗，一动不动。
350,2023-01-31,地铁回应女子不让男童上女厕所遭骂,导语：1月31日，黑龙江哈尔滨。女子不让6岁男童上女厕所遭痛骂，地铁客服回应称，暂未接到相关反馈。
356,2023-01-31,郭敬明回复吐槽虞书欣云为衫发饰评论,导语：郭敬明回复吐槽虞书欣云为衫发饰评论
360,2023-01-31,于正 男人涂脂抹粉最恶心,
364,2023-01-31,公子贵姓开播,导语：《公子贵姓》今日开播，刚大婚就白头？这剧情有点子高能在身上~
370,2023-01-31,校方曾派老师和胡鑫宇家属共同进粮库找人,
371,2023-01-31,胡鑫宇父亲称未到达遗体发现点,导语：1月30日下午，记者从胡鑫宇父亲处获悉，此前搜救人员曾进入过粮库搜寻，但并未到达胡鑫宇遗体的发现点。目前他们暂未收到有关录音笔中的信息。
372,2023-01-31,高启兰等了安欣20年,
373,2023-01-31,宋祖儿乔家女小乔这厢有礼,导语：《折腰》宋祖儿说 乔家女小乔，这厢有礼~
375,2023-01-31,顾客偶遇卖鱼老板研读孙子兵法,导语：1月30日，新疆阿克苏市，顾客在买鱼时偶然看见鱼店老板正在仔细研读孙子兵法
381,2023-01-31,井柏然谭松韵归路雪景预告,导语：井柏然，谭松韵《归路》预告
383,2023-01-31,沙溢片场打赌输了请全剧组喝饮料,
385,2023-01-31,张颂文曾给赵露思颁奖,导语：张颂文曾给赵露思颁奖
386,2023-01-31,揭秘满江红出品方羊踯躅传媒公司,导语：天眼查App显示，北京羊踯躅文化传媒有限公司成立于2021年6月，该公司共对外投资1家公司，为北京羊角屯文化传媒有限公司。
387,2023-01-31,女子不让6岁男童上女厕所遭痛骂,导语：1月30日，哈尔滨。地铁站女厕所内，一女子发现有个男童站在里面，于是对孩子说：这里是女厕所，男孩不能进来。
389,2023-01-31,胡鑫宇遗体在粮库废弃区域无监控,导语：金鸡山粮库一位前工作人员称，胡鑫宇遗体发现处系粮库废弃区域，周边没有监控。因粮库面积较大，还养有两条狗防范。
390,2023-01-31,2023春晚收视率,导语：2023春晚收视率
392,2023-01-31,小狗吵架要有距离感,导语：哈哈哈哈，他们俩之间究竟发生了什么
393,2023-01-31,中核喊话流浪地球,导语：@中核集团 ：你们尽管想象，我们负责实现。
394,2023-01-31,今天有两部古偶开机,导语：《折腰》《相思令》两部古偶今日开机
395,2023-01-31,建议不因钱选工作专家实控多家公司,导语：天眼查App显示，3HFIT关联公司上海宁志企业管理咨询股份有限公司的疑似实际控制人、最终受益人为姚宁。
396,2023-01-31,终于知道女生买衣服好看的定律了,导语：学会买衣服真的很重要啦！
397,2023-01-31,曾舜晞田曦薇田耕纪cp感,导语：《田耕纪》 官宣杀青，期待沈诺@曾舜晞Joseph 连蔓儿@田曦薇 ！
398,2023-01-31,澳大利亚一枚恐致癌放射性胶囊丢失,
429,2023-01-31,高启强狂飙倒放镜头,导语：高启强《狂飙》倒放镜头才是正片吧，这也太有感觉了！
430,2023-01-31,认识2周的前同事向女生借钱买房,导语：殷女士的前同事给其借钱称凑婚房首付。殷女士介绍，这位同事是她离职前两周认识的，如今离职有半年多，前同事突然给她发消息借5万，房子首付是110万，前同事自己总共想出5万。殷女士称，不明白为什么她会把所有金钱的压力都寄托在一个只认识两周的人身上，感觉她的语气也不是很好，就直接拒绝了。
431,2023-01-31,医院回应女子取牙模时被呛身亡传言,导语：日前，一段“新乡一女子躺着取牙模时身亡”的视频在网上流传。30日下午，涉事医院回应称，死因并非网传所说。
433,2023-01-31,敖子逸折腰演宋祖儿弟弟,导语：《折腰》今日官宣阵容，敖子逸演乔慈，在剧中是小乔宋祖儿的弟弟。
434,2023-01-31,干娘是石头是什么体验,导语：山东网友向网友们介绍了自己的“干娘”——一块石头。这是小时候认的干娘，每到逢年过节就要去磕头上香。
436,2023-01-31,专家称应增设更多家庭厕所,导语：有专家认为要关注孩子的性别教育，同时，公共场所应当增设家庭厕所以及男性不应在育儿中缺位。
437,2023-01-31,道明寺今天46岁了,导语：今天是道明寺46岁生日啦
