,Date,Title,Introduction
5416,2023-02-06,朴彩英和VOGUE主编合照,导语：朴彩英和vogue主编合照
5417,2023-02-06,你理想的结婚年龄是多少岁,导语：你理想中的结婚年龄是多少岁？
5418,2023-02-06,贾冰说我都这么狠了你们还想笑,
5422,2023-02-06,流动的中国活力,导语：深港陆路口岸2月6日全面恢复内地与香港人员正常往来，不再实施出入境预约机制。6日恢复运行的口岸包括皇岗口岸、罗湖口岸、莲塘口岸。位于深圳罗湖区的罗湖口岸，是连接香港与内地的第一口岸，请看记者从深圳罗湖口岸和香港罗湖管制站带来的现场报道。
5431,2023-02-06,地震已致土耳其912人遇难,导语：土耳其总统埃尔多安证实，#地震已致土耳其912人遇难#，此外还有5383人受伤。
5447,2023-02-06,学校组织学生徒步自费看满江红,导语：学校组织学生徒步自费看满江红，校方：活动是自愿，属于户外教学实践活动
5450,2023-02-06,现场看林孝埈夺冠太燃了,导语：[星星]这个角度重温@林孝埈Lin_xiaojun 500米夺金！DNA又燃起来了，场边女队队员兴奋的全跳起来了，小林和教练紧紧相拥。
5453,2023-02-06,言承旭吐烟圈,导语：《夏花》要来了，言承旭吐烟圈可以有啊，还得是你，简直了，好想说言承旭吐烟圈好帅！
5454,2023-02-06,连体女婴分离14年后长成健康少女,导语：湖南长沙，14年前一位妈妈生下一对心包、肝脏相连的双胞胎女婴，两周后她们接受分离手术并双双成活。从那以后，负责手术的医生们一直坚持追踪关注她们14年，如今两姐妹身高都长到了163厘米，爱跑爱跳也爱笑，跟同龄人一样健康，妹妹还把长大当医生当成自己的梦想，正朝着目标努力。
5456,2023-02-06,李泳知快嘴rap,导语：李泳知的rap听爽了，让人头皮发麻！
5457,2023-02-06,王俊凯晒下班夕阳随拍,
5458,2023-02-06,妻子拍下老公准备吵架的表情包,导语：2月5日，江苏泰州。一男子在辅导孩子写作业时训斥了儿子，妻子听到后说了老公几句，结果老公立马站出来就是一副准备吵架的表情，但刚好岳母出来站在背后，男子听到岳母说话声音后，脸上表情瞬间由剑拔弩张切换到忍气吞声。
5460,2023-02-06,戴尔将裁员6650人,导语：戴尔将裁员约6650人，公司发言人称，裁员人数约占全球员工总数的5％。 ​
5461,2023-02-06,哪本小说你想安利全世界,导语：分享你的top小说书单
5462,2023-02-06,BSS回归,
5463,2023-02-06,哪些人群不建议打九价疫苗,导语：宫颈癌可是目前全球唯一能用疫苗预防的癌症，那有哪些人群并不适合接种疫苗呢？听听北京大学第一医院魏子医生的科普。
5464,2023-02-06,杨超越的择偶标准,
5465,2023-02-06,当流浪小狗变成了我的小狗,导语：狗狗的脸上开始出现笑容了，可以看得出小家伙是真的很安心
5466,2023-02-06,土耳其发生7.8级地震,导语：中国地震台网正式测定：02月06日09时17分在土耳其（北纬37.15度，东经36.95度）发生7.8级地震，震源深度20千米。
5468,2023-02-06,春来中国万象更新,导语：人勤春来早，站上新的起点，开足马力，一起奔向更美的明天，活出自己的精彩！
5472,2023-02-06,月收入5千以下占总人口95%,
5490,2023-02-06,杭州烟花大会应急玫瑰走红,导语：2月5日元宵夜，时隔11年的杭州烟花大会回来了，当晚不少情侣一起来观看。现场玫瑰花需求激增，有市民紧急通过网上下单鲜花，在震撼又浪漫的烟花下表白。
5491,2023-02-06,九价HPV疫苗现捆绑销售,导语：随着HPV疫苗热度不断升高，媒体注意到，民营医院接种九价HPV疫苗，出现了捆绑销售“体检套餐”的乱象，普遍溢价约2000元，体检项目部分“可以放弃，但是不可以退款”。
5496,2023-02-06,林志颖违规停车被罚款,导语：近日，台媒拍到林志颖驾驶电动车外出时，因违规停车被罚款。
5498,2023-02-06,WBG战胜FPX,导语：2023LPL春季赛WBG 2-0战胜FPX
5501,2023-02-06,FPX对战WBG,
5505,2023-02-06,YSKM入院检查,导语：YSKM熬夜练英雄被抬去医院做了检查
5507,2023-02-06,流浪地球2图丫丫房间美术设定,导语：电影《流浪地球2》图丫丫数字房间的美术设定解析来啦！
5508,2023-02-06,鹿晗五哈疯狂炫醋,导语：《哈哈哈哈哈》第三季，录制路透使出，鹿晗在视频里疯狂炫醋
5510,2023-02-06,倪妮消失的她短发机车造型,导语：倪妮《消失的她》短发机车造型，又酷又飒，想坐姐姐后座
5511,2023-02-06,66岁大叔和女友买新房名字没自己,
5512,2023-02-06,外交部回应拉美上空也发现中国无人飞艇,导语：毛宁表示，经了解核实，有关无人飞艇来自中国，属民用性质，用于飞行试验。受气候影响，而且自身控制能力有限，这一飞艇严重偏离了预定路线，误入拉美和加勒比上空。
5513,2023-02-06,肖战盛阳片场休息路透,导语：肖战盛阳《骄阳伴我》片场休息路透~
5514,2023-02-06,4岁血癌娃术后重度感染每天便血270次,导语：日前，山西晋中，骞骞患急性淋巴细胞白血病。漫长化疗之下不幸复发，不得已骞骞只能进行骨髓移植手术。
5515,2023-02-06,葛优诉B站侵权案将开庭,导语：天眼查App显示，2月4日，北京互联网法院向B站关联公司上海幻电信息科技有限公司公告送达起诉状副本、开庭传票等，关联案件为葛优与该公司网络侵权责任纠纷，原告为葛优。
5516,2023-02-06,NCTDREAM日专预告视频,导语：NCT DREAM日专预告视频公开！
5541,2023-02-06,土耳其地震已致土叙300余人死亡,导语：土耳其灾难和应急管理署6日发布最新消息说，土耳其南部靠近叙利亚边境地区6日凌晨发生的强烈地震已在土耳其造成76人死亡、440人受伤。中国驻土耳其大使馆向新华社记者确认，目前暂无在土中国公民在地震中伤亡。
5544,2023-02-06,谁家小狗这样贱嗖嗖的,导语：大家的狗狗都会是这样的吗？
5547,2023-02-06,路人视角下的唐嫣状态,导语：唐嫣我们的客栈玩游戏最新路透，路人视角下的唐嫣状态真好
5548,2023-02-06,专家提醒提前还贷不可盲目跟风,导语：日前，随着多地房贷政策调整，想要通过提前还款降低贷款成本的购房者增多，提前还款排长队现象普遍存在。专家提醒，是否提前还款应因人因城而异，不可盲目跟风。
5552,2023-02-06,职场人高情商话术,导语：以后在职场上再也不怕拒绝别人了
5553,2023-02-06,雷霆杯,
5554,2023-02-06,言承旭问什么是下海,导语：言承旭问什么是下海
5555,2023-02-06,夫硕顺新歌上线,导语：SEVENTEEN夫硕顺小分队迷你一辑主打曲《要加油呀》公开！
5557,2023-02-06,赵露思晒抱玩偶回眸随拍,导语：赵露思晒抱玩偶回眸随拍，我们露思好可爱~~
5558,2023-02-06,贾冰说你还有存酒咋的,导语：要被@贾冰先生 的回复笑疯哈哈哈哈！网友问：“徐总，白金瀚没啦[泪]”贾冰：“你还有存酒咋的。”你看《狂飙》了吗？
5559,2023-02-06,狂飙反派演员心中的正义,
5561,2023-02-06,1个动作增强心肺功能,导语：一个动作“坐姿开合跳”，可以调动核心和四肢力量，促进血液循环，增强心肺功能。
5563,2023-02-06,伊拉克女网红被父亲荣誉处决,
5564,2023-02-06,小学生背满江红获寒假作业免检红包,导语：在一所小学门口，同学们排着队争相背诵《满江红》给校长听，背完后还会收到“寒假作业免检”惊喜红包和书籍一本。
5577,2023-02-06,王智流浪地球2路演状态,导语：王智《流浪地球2》路演造型，白色卫衣搭配短发简约清爽，连跑了11天，状态还是很棒！
5592,2023-02-06,海底捞很关心久龙,导语：是什么引来了海底捞霸霸的关心，一切都要从@LGD大鹅-久龙 发了条微博开始说起~
5593,2023-02-06,母亲回应儿子被邻居放炮炸伤致截肢,导语：2月5日，江西上饶，6岁多男孩被邻居放炮炸伤导致右臂截肢一事让人心痛不已。
5594,2023-02-06,无名可以线上预约了,导语：电影无名可以线上预约了
5595,2023-02-06,李小冉新剧人设,导语：李小冉在新剧《我们的日子》中饰演的刘淑霞是可爱的小作精，也是爱喝咖啡爱念诗的精致文艺女青年
5598,2023-02-06,年龄差距很大的婚姻会幸福吗,导语：年龄差距很大的婚姻真的会幸福吗？带话题发微博一起来聊聊。
5600,2023-02-06,为什么现在都盛行打九价,导语：为什么现在都第一选择打九价而不是预防率相差无几的四价？
5601,2023-02-06,图丫丫的房间壁纸条形码被解码了,导语：流浪地球真的是细节怪
5602,2023-02-06,何广智打算换了72平的大房子,导语：@何广智- 在《开工了新生活》中提到，今年新生活想回到自己的舒适圈，首先先换掉现在72平的房子。
5605,2023-02-06,满江红实时票房破40亿,导语：电影《满江红》上映16天，累计票房突破40亿。
5606,2023-02-06,在北京月收入过万算高吗,导语：在北京月入过万很普遍吗？在北京算高吗？带话题发微博一起来聊聊。
5607,2023-02-06,陈书婷ootd,
5608,2023-02-06,网传TFBOYS十周年线下演唱会确定,导语：网传TFBOYS十周年线下演唱会确定在7.8份，在演唱会后解散。
5609,2023-02-06,洋迪已被注册商标,导语：今日，#洋迪# 又上了热搜，起因是迪丽热巴和杨洋元宵节用了同款勺子。
5610,2023-02-06,李宏毅说坐等帅家默,导语：李宏毅说坐等帅家默
5612,2023-02-06,张颂文在剧组狂推粤语,
5613,2023-02-06,任泽平建议法定婚龄降到18岁,
5619,2023-02-06,6岁男童在酒店被泳池旁泡泡机电亡,导语：2月4日，云南曲靖，黄先生称6岁儿子在九龙温泉玩泡泡时触碰到了机器后触电身亡，旁边没有任何安全提示语和栅栏保护措施。当晚政府部门相关人员都过来了，初步判断是触电身亡，黄先生质疑称温泉在出了安全事故没停业整顿排查，第二天照常营业，感到很气愤。
5628,2023-02-06,梁朝伟问周迅无名变喜剧了吗,
5639,2023-02-06,强震致土叙两国死亡人数已升至百余人,
5643,2023-02-06,徐若晗对言承旭说记住你了,导语：《夏花》要来了，徐若晗说记住你了，可以有啊，徐若晗对言承旭说记住你了，我蛮喜欢的！
5645,2023-02-06,想看林孝埈对决黄大宪要到下赛季了,导语：如果不是黄大宪“陷害”，小林可能也不会归顺。下个月林孝埈将会前往首尔参加短道世锦赛，不过这个赛季，黄大宪是没有和林孝埈交手的机会了。
5646,2023-02-06,Scout获得周MVP,导语：2023LPL春季赛第十周最佳阵容，Scout获得周MVP
5647,2023-02-06,韩媒评林孝埈双冠,导语：据韩联社：林孝埈将会参加3月在首尔开赛的世锦赛，因此与韩国选手的竞争备受关注。
5649,2023-02-06,宁理 导演这次我杀谁,
5650,2023-02-06,曝李秀满被公司单方面宣布退出,导语：曝李秀满被公司单方面宣布退出。
5651,2023-02-06,马嘉祺声生不息灰色毛衣上班路透,导语：马嘉祺声生不息上班路透来啦！灰色毛衣好帅好温柔呀！
5654,2023-02-06,中方就美方袭击中国飞艇提严正交涉,导语：2023年2月5日，中国外交部副部长谢锋奉命代表中国政府就美方武力袭击中国民用无人飞艇向美国驻华使馆负责人提出严正交涉。
5655,2023-02-06,张凌赫点赞欣诚则凌视频,导语：好家伙，张凌赫点赞了和虞书欣的cp欣诚则凌的视频。
5656,2023-02-06,产后抑郁不是公主病,导语：电视剧《今生也是第一次》中，唐艺昕饰演的陈兰青产后抑郁情绪崩溃，产后抑郁不是公主病，让我们一起理解和关心每一位妈妈！
5657,2023-02-06,报告称北京平均月薪13930元,导语：2022年我国企业招聘薪酬整体在波动中上升，第四季度全国平均招聘薪酬10558元。分城市看，第四季度北上深广杭薪酬水平仍领跑。北京以13930元招聘月薪位居榜首。
5658,2023-02-06,成毅吹笛子,导语：成毅吹笛子
5662,2023-02-06,坐上高铁去滑雪,导语：这个雪季去哪儿玩？跟着打卡就对了！北京冬奥会期间，京张高铁为赛事的开展提供了重要支撑，太子城站更是成为世界上首座进入奥运村的高铁站。
5680,2023-02-06,千万不要坐着遛狗,导语：大爷没有一丝防备！
5682,2023-02-06,成毅李一桐英雄志雪景同框路透,导语：成毅李一桐《英雄志》雪景同框路透氛围感拉满！
5684,2023-02-06,前CBA球员实名举报天津篮协主席,
5691,2023-02-06,张婧仪周一白色吊带裙随拍,导语：张婧仪周一白色吊带裙随拍🈶清纯可人的森系少女！
5694,2023-02-06,刘雨昕名誉维权案件进展,
5695,2023-02-06,不愧是重庆的出租车,
5696,2023-02-06,超市拒收1元纸币称银行难存,导语：2月5日，上海。一女子发视频称自己在上海清美鲜食超市购物付款时，被收银员拒收1元人民币。视频中，收银员表示不收1元纸币，存银行存不进去，周围顾客纷纷与其理论，随后该收银员跟领导通话后收了钱。
5698,2023-02-06,车主称会起诉故意推倒摩托老人继承人,导语：2022年6月，上海。陈先生的摩托车被一位老人故意推倒，损失16000多元。事后，老人态度强硬拒不赔偿，监护人避而不见，陈先生坚决维权引发关注。2月5日，陈先生表示经过与法院沟通，因老人去世，刑事终止，拿到刑事案件的终止裁定文书，以及本案的具体程序和流程。后续民事赔偿部分需要另案起诉其继承人，陈先生称会坚持走民事诉讼进行起诉。
5699,2023-02-06,火什么时候灭我们什么时候回,导语：近日，浙江湖州，一厂房起火消防员彻夜扑救，连饭都是蹲在路边匆忙扒拉的两口。待到彻底扑灭大火顺利归队时，天已大亮，蓝朋友们累得一上车就睡着了，看得人心疼～ps：“火什么时候灭，我们什么时候回”，是蓝朋友最朴实的承诺～
5701,2023-02-06,男孩通宵赶完的作业被狗子全部撕碎,导语：2月5日，福建福州。一男孩赶了几个通宵的寒假作业，一觉醒来被自家狗子全部撕碎，男孩崩溃大哭，家人不断安慰。
5702,2023-02-06,消失的她预告信息量,
5703,2023-02-06,易烊千玺橙色系运动风造型,导语：易烊千玺春夏大片之橙色系运动套装！好有活力呀
5704,2023-02-06,马龙进入国家队二十周年,
5705,2023-02-06,你会选择贷款买房吗,导语：你会选择贷款去买房吗？
5706,2023-02-06,许凯你比星光美丽黑西装饭拍路透,
5707,2023-02-06,这狗遛了但不多,导语：这狗子以后出门自己带水！
5722,2023-02-06,土耳其强震已致43死400余伤,导语：目前已在土耳其造成至少43人死亡，400多人受伤
5725,2023-02-06,女子称海鲜市场买到蓝环章鱼险食用,导语：2月4日，海南三亚。女子称在海鲜市场购买鱿鱼，回家煮熟后发现有一只疑似蓝环章鱼。
5738,2023-02-06,半熟恋人全员为爱举大旗,
5740,2023-02-06,什么样的另一半你会选择结婚,导语：面对“为什么还不结婚”这一问题，受教育程度提高、婚育成本增加、职业生活压力成为不婚晚婚人的答案，婚姻对他们来说是生活，不是生存。再者是当代年轻人恋爱观的改变，很多人宁缺毋滥、不再将就，婚恋对象选择条件比过去大大提高，都想有一段理想、稳定的婚姻关系。
5741,2023-02-06,Beyonce做出什么能拿到年专,
5742,2023-02-06,不必因为父母的普通而自卑,导语：我们不必因为父母的普通而自卑
5743,2023-02-06,土耳其地震暂无中国公民伤亡,导语：当地时间2月6日，土耳其发生强震。据中国驻土耳其使馆消息，土耳其地震暂无中国公民伤亡。
5744,2023-02-06,孙千腿真长,导语：孙千腿真长！
5745,2023-02-06,Adele获格莱美最佳流行歌手,导语：Adele获格莱美最佳流行歌手。
5746,2023-02-06,李承铉脖子上挂的是奶嘴,导语：谁能想到李承铉脖子上挂着的奶嘴也能被认成时尚单品？是奶爸的时尚没错了
5747,2023-02-06,90后被催婚时的反向操作,导语：催婚一直以来都是过节家庭聚会时的热门话题，面对家人五花八门的催婚，网友也有各式各样的花式反催婚方法与父母斗智斗勇。其实，父母家人催婚某种程度上也是出于对子女的关心，但结婚不是小事，与其和父母冷战、大吵一架，不如冷静下来和父母聊一聊自己对婚姻的看法。
5748,2023-02-06,两男子受高薪诱惑想去缅甸挣大钱,
5749,2023-02-06,张颂文的小肉手,导语：张颂文的我“小肉手”好可爱
5750,2023-02-06,格莱美,
5751,2023-02-06,朱一龙消失的她定妆视频,导语：电影《消失的她》释出朱一龙定妆视频，为了塑造“何非”朱一龙留胡茬、不洗头，表现出角色“够邋遢、够惨”的形象。
5752,2023-02-06,胜利将于2月11日出狱,导语：组合BIGBANG的前成员胜利（本名李胜贤，33岁）将于11日刑满出狱。
5754,2023-02-06,Angelababy的羽绒服,导语：angelababy杨颖《相思令》最新路透，这羽绒服好方便啊
5755,2023-02-06,白鹿张凌赫片场斗嘴花絮,导语：白鹿、张凌赫《宁安如梦》日常斗嘴花絮，小学生吵架既视感（[doge]
5756,2023-02-06,张若昀王阳庆余年后二搭,导语：《显微镜下的大明》张若昀、王阳二搭！值得期待！
5784,2023-02-06,狂飙捡手机文学,
5787,2023-02-06,建议将年龄歧视纳入反就业歧视范畴,导语：正值春招，但一些企业将30岁作为招聘年龄上限。有求职者表示，不管是线上还是线下，明显能感到用工单位对年龄的要求越来越严苛。
5789,2023-02-06,夫妇后悔送养女儿寻女30年,导语：2月5日，正月十五元宵节，四川广安的毛先生、蒲女士夫妇赶到了绵阳市公安局刑侦支队参加视频认亲，终于见到了分别30年的亲生女儿。
5791,2023-02-06,你会买超过2万元的iPhone吗,导语：苹果或将推出更高端的机型，并采用无接口设计，业内人士推测，更高的iPhone机型最高售价或超2万元，这样昂贵的手机，你会买吗？
5792,2023-02-06,Adele格莱美造型,
5793,2023-02-06,库克称果粉愿意高价买iPhone,导语：苹果再推Ultra机型已经不是秘密了，此前认为Ultra会取代目前的Pro Max系列，但是最新消息称苹果对Ultra的定位比Pro Max更高。
5795,2023-02-06,宁安如梦预约破200万,导语：白鹿张凌赫新剧宁安如梦预约人数破两百万啦 超级期待上线开播
5796,2023-02-06,网传骄阳伴我今日杀青,导语：网传肖战、白百何出演的《骄阳伴我》今日杀青
5797,2023-02-06,言承旭说我是33号,导语：看完《夏花》预告，好想知道言承旭说自己是33号是什么意思
5798,2023-02-06,阿尔卑斯山雪崩1名中国公民遇难,导语：奥地利阿尔卑斯山区2月3日以来发生多次雪崩，造成包括一名中国公民在内8人死亡。
5799,2023-02-06,AI男爱豆对AI女爱豆的mvreaction,
5800,2023-02-06,84岁外婆第一次穿旗袍惊艳外孙女,导语：江西九江，95后女生江梦琪为妈妈和外婆拍摄了一组变装，变装后的两位妈妈气质惊艳。江女士说，妈妈和外婆平时囿于厨房和柴米油盐，被遮住了美丽。听说要拍变装，还要穿旗袍，84岁的外婆还亲自挑选了珍珠项链和耳环。
5801,2023-02-06,苹果2024年或推出无接口设计iPhone,导语：据彭博社的 Mark Gurman 最新消息，苹果公司正在考虑将高端iPhone的价格推高的方法。
5802,2023-02-06,井柏然君子盟宣传主题曲别,导语：由井柏然演唱的《君子盟》主题曲《别》上线啦~快来听听井柏然给我们用歌声讲述的兰珏兰大人的故事。
5804,2023-02-06,Beyonce格莱美获奖最多音乐人,导语：Beyonce格莱美获奖最多音乐人。
5809,2023-02-06,专家称成年人有权做个废物,
5831,2023-02-06,是狂飙同款没错了,导语：什么档次 敢跟我驴哥用一样的 [doge]
5832,2023-02-06,提前还贷比借钱难,导语：提前还贷潮涌现 还钱比借钱难
5833,2023-02-06,虞书欣云之羽战损妆,
5835,2023-02-06,孩子的压力到底有多大,导语：《少年烦恼研究所》节目中，05后针对生活的各种压力纷纷吐槽，你认为当代孩子的压力大吗？
5837,2023-02-06,多地中考取消男生1000米女生800米,导语：近日，贵州省贵阳、遵义、六盘水、黔南等多个市州为此调整了体育中考项目，均取消了男生1000米、女生800米跑项目。
5839,2023-02-06,段奥娟瘦了好多,导语：@段奥娟_CLARE 参加江苏卫视元宵晚会，一曲《何妨》展现出百变声线
5841,2023-02-06,时代少年团实体专辑开启预约,导语：时代少年团实体专辑开启预约
5842,2023-02-06,朱一龙文咏珊新电影演夫妻,导语：朱一龙文咏珊新电影演夫妻
5843,2023-02-06,欧文被交易至独行侠,导语：篮网将欧文交易至独行侠
5844,2023-02-06,泫雅亲粉丝脸,导语：泫雅亲粉丝脸 是谁又羡慕了！
5846,2023-02-06,三体结尾有罗辑,导语：《三体》最后一集结尾出现了一个神秘男人，大家都认出这正是下一部的主角罗辑[思考]《三体》你是懂怎么吊胃口的
5847,2023-02-06,星云大师圆寂,导语：综合台湾《联合报》、“中时新闻网”报道，台湾佛光山星云大师于今日（5日）下午安详离世，享耆寿96岁，弟子们陪在身旁。
5848,2023-02-06,许诺 九尾,
5849,2023-02-06,狗狗跟主人坐长途车就差拍照了,导语：2月2日，四川。狗狗跟主人坐长途车，上车睡觉，下车尿尿，网友:就差拍照了。
5868,2023-02-06,女士的品格开播,导语：由万茜、刘敏涛、邢菲主演的《女士的品格》今日开播，锁定湖南卫视、芒果TV，今晚20：00等你准时收看！
5869,2023-02-06,林孝埈连夺两金,导语：#短道速滑世界杯#德累斯顿站最后一项男子5000米接力，中国队派出@李文龍 @短道速滑钟宇晨 @林孝埈Lin_xiaojun 刘冠逸@EON逸 出战，最终6分51秒106率先冲线再夺一金！
5870,2023-02-06,央美学生还原三体火鸡科学家,导语：央美同学塑造还原的火鸡科学家真的生动形象，《三体》剧粉好优秀！
5871,2023-02-06,消失的她定档0622,导语：由陈思诚监制，崔睿、刘翔执导，朱一龙、倪妮、文咏珊、杜江等出演的悬疑犯罪电影《消失的她》定档6月22日端午节。
5872,2023-02-06,你期待骄阳伴我吗,导语：网传骄阳伴我杀青，你期待这部剧吗
5877,2023-02-06,我国今年将全面推进探月工程四期,导语：今年，中国将全面推进探月工程四期，规划包括嫦娥六号、嫦娥七号和嫦娥八号任务。
5878,2023-02-06,郑秀妍郑秀晶元宵节做饭vlog,导语：郑秀妍郑秀晶元宵节做饭vlog
5880,2023-02-06,杭州小学生在烟花大会现场补作业,导语：2月5日晚，杭州烟花大会现场，有市民拍到一名小学生在人群中补作业。孩子妈妈在一旁帮忙打灯：“明天要开学了！”
5881,2023-02-06,于谦 梁家辉你被我盯上了,
5882,2023-02-06,车辆轮胎扎入钉子收费员一下听出,导语：近日，湖北恩施，一辆车刚驶入收费站，收费员沈邯就听出异响，推测车辆轮胎有异，第一时间提醒司机。经检查，发现车轮果真扎入一颗大螺丝钉，存在严重安全隐患。随后，司机等人到附近修理后重新进站，临走时对沈邯表示了感谢。
5884,2023-02-06,张颂文元宵节看烟花vlog,导语：张颂文元宵节看烟花vlog，张颂文祝大家元宵快乐，新的一年大家越来越好~
5885,2023-02-06,林孝埈中国队首金,导语：#短道速滑世界杯# 德累斯顿站男子500米决赛A组，中国选手@林孝埈Lin_xiaojun 夺冠，另一位中国选手@短道速滑钟宇晨 夺得银牌，中国选手包揽金银牌！！
5886,2023-02-06,90岁爷爷和5岁孙子对话看哭了,导语：近日，辽宁营口，90岁爷爷和5岁孙子的对话直戳泪点↓↓
5887,2023-02-06,苹果短期不会出新款MacStudio,导语：2 月 5 日消息，据彭博社的 Mark Gurman 称，苹果不太可能在短期内推出搭载 M2 Ultra 芯片的 Mac Studio 了
5888,2023-02-06,释放房地产市场合理需求,导语：经济日报：#释放房地产市场合理需求##部分城市调整首套房贷款利率#
5889,2023-02-06,韩国称自华入韩旅客阳性率为零,导语：2月4日，韩国中央防疫对策本部发布数据称，当天自华入境旅客的新冠落地检阳性率为零，是韩国对自华入境的短期停留人员实施新冠落地检后时隔1个多月以来的首次。目前情况下，期限为本月底的落地检和暂停签发中国公民赴韩短期居留签证措施是否会提前取消备受关注。
5891,2023-02-06,YG新女团日本新成员公开,导语：YG新女团日本新成员公开！实力好强！
5893,2023-02-06,多地调整体育中考项目,
