,Date,Title,Introduction
0,2023-10-01,有一种骄傲叫我爱你中国,导语：此刻，共同传递：祝福祖国！惟愿山河锦绣，国泰民安！
1,2023-10-01,吴艳妮抢跑,
2,2023-10-01,吴艳妮成绩被取消,
3,2023-10-01,满街五星红旗是中国人的浪漫,导语：庆祝新中国成立74周年，大街小巷都挂满国旗。热烈的中国红，是我们最爱的颜色。
4,2023-10-01,吴艳妮回应抢跑,导语：吴艳妮赛后接受采访时回应抢跑：受旁边对手影响没能撑得住，有遗憾希望在今后的训练和比赛中找不足，在巴黎奥运会上展现中国速度。
5,2023-10-01,中国亚运男足无缘四强,
6,2023-10-01,中国队羽毛球男团金牌,导语：杭州第19届亚运会羽毛球男子团体决赛，中国队夺得金牌。 ​​​
7,2023-10-01,孙颖莎vs早田希娜,导语：🏓杭州亚运会乒乓球女单决赛，@孙颖莎 4-1战胜早田希娜夺冠【11-5、11-9、10-12、11-8、11-7】
8,2023-10-01,中国队决赛不藏了,导语：摊牌了，不装了！中国队不断刷新成绩，成绩遥遥领先！
9,2023-10-01,一盒月饼下去办公室无人生还,
10,2023-10-01,林雨薇100米栏金牌,导语：杭州亚运会女子100米栏决赛，中国选手林雨薇夺得冠军。
11,2023-10-01,华伦天奴,"导语：知名意大利奢侈品品牌。自2016年7月7日起, 品牌创作总监由Pierpaolo Piccioli担任。"
12,2023-10-01,家有儿女取景地,
13,2023-10-01,杨紫羽毛袖白衬衫造型,
14,2023-10-01,林雨薇好美,导语：又美又飒！亚运会田径女子100米栏决赛，林雨薇12秒74创造个人PB夺得金牌
15,2023-10-01,巴黎世家 刘昊然,
16,2023-10-01,周深音乐节被喊周深开门,
17,2023-10-01,孙颖莎女单夺金,导语：今晚，杭州亚运会乒乓球女子单打决赛，@孙颖莎 4：1 战胜早田希娜，赢得杭州亚运乒乓球女子单打金牌。
18,2023-10-01,巴黎偶遇杨紫,导语：巴黎街头偶遇杨紫
19,2023-10-01,用来垫锅几年了才发现是成毅,
20,2023-10-01,夏思凝拿全国冠军的时候才16岁,导语：夏思凝拿全国冠军的时候才16岁！！！
21,2023-10-01,不要给吴艳妮太大的压力,导语：杭州亚运会女子100米跨栏决赛，吴艳妮由于抢跑被罚下，继续加油！
22,2023-10-01,许家印,
23,2023-10-01,虞书欣脉搏犹如40岁男子壮如牛,导语：虞书欣在采访中被问如何评价自己的健康，她表示自己小时候体质不是很好，属于操场上晒10分钟就会晕倒的人，但是现在，中医说“我的脉搏犹如40岁男子壮如牛”。
24,2023-10-01,腿姐回应,
25,2023-10-01,孙颖莎说感谢教练队友和粉丝,
26,2023-10-01,中国香港晋级亚运男足四强,导语：亚运男足1/4决赛，中国香港1-0击败伊朗，晋级四强！半决赛将对阵日本！ ​​​
27,2023-10-01,孙颖莎波澜不惊式采访,导语：孙颖莎：还有比赛要进行，自己也在积极调整。
28,2023-10-01,王栎鑫老来俏,
29,2023-10-01,马龙在王濛面前i人属性爆发,
30,2023-10-01,EDG第一幕夺冠,导语：骑士之志，一往无前！他们充满着激情和毅力，也不断强化着战术组织和默契配合。现在，他们成为了当之无愧的CN赛区线下赛的首个卫冕者！恭喜EDG获得了无畏契约CN赛区进化者系列公开赛 第一幕：聚势的冠军！期待他们继续前行，谱写属于他们的篇章！
31,2023-10-01,港媒曝郑少秋大女儿在美去世,导语：港媒曝郑少秋大女儿在美去世
32,2023-10-01,孙艺洲 有点冤但不多,
33,2023-10-01,原生家庭是他们能给你的全部了,
34,2023-10-01,国羽男团2比2印度,
35,2023-10-01,金发张元英,
36,2023-10-01,郑思维,导语：中国羽毛球名将
37,2023-10-01,女生手滑误拒浙大保研通知,导语：近日，四川广安。韩同学收到浙江大学的保研复试通知后误点了拒绝选项。
38,2023-10-01,樊振东王楚钦男双夺金,导语：亚运会乒乓球男双决赛，樊振东/@王楚钦___ 4-0战胜张禹珍林钟勋【11-6/11-8/11-7/11-3】夺得男双金牌，这也是国乒本届亚运会的第四金。
39,2023-10-01,85花爆剧统计,
40,2023-10-01,张军事业运,
41,2023-10-01,范丞丞cue王安宇,导语：现在就出发今晚有范丞丞王安宇
42,2023-10-01,李诗沣好稳的二单,
43,2023-10-01,上海四行仓库祭台被游客摆满祭品,导语：10月1日，上海。国庆当天，上海四行仓库祭台被游客插满国旗，摆满鲜花、食品等祭品，表达对先烈的敬意。
44,2023-10-01,前任4,导语：电影《前任4：英年早婚》将于9月28日上映！走过十年，爱情的命题常出常新，这次他们将如何见招拆招？
45,2023-10-01,吴艳妮被罚下,
46,2023-10-01,李诗沣超级大心脏,
47,2023-10-01,薛之谦滁州演唱会盲人和导盲犬,导语：终于理解了那句“台下的观众就我一个”
48,2023-10-01,国羽男团0比1印度,
49,2023-10-01,海珠广场,导语：本期话题推荐 ： 广州知名日系摄影师 @广州摄影师苍夏
50,2023-10-01,王艺迪止步女单四强,导语：🏓️亚运会乒乓球女单半决赛，王艺迪@迪214 3-4不敌早田希娜【4-11/11-3/8-11/11-7/12-10/13-15/10-12】止步半决赛，决赛孙颖莎对阵早田希娜。
51,2023-10-01,国足亚运队vs韩国,导语：10月1日，20：00 亚运会男足1/4决赛，中国vs韩国！
52,2023-10-01,iQOO手机见证中国电竞冲金时刻,
53,2023-10-01,樊振东让没天赋的人没饭吃了,导语：队友一句话评价樊振东：“天赋好又刻苦，让没天赋的人都没饭吃了。”
54,2023-10-01,男足,
55,2023-10-01,国足亚运队半场0比2韩国,导语：上半场结束，国足亚运队0-2韩国。洪贤锡任意球得分，宋旼奎扩大比分。
56,2023-10-01,王濛马龙击掌,导语：王濛马龙同框击掌，梦幻联动了！
57,2023-10-01,和平项目夺得金牌,
58,2023-10-01,张婧仪脏脏包,导语：张婧仪脏脏包
59,2023-10-01,韩国组合出不了樊振东王楚钦画的圈,导语：乒乓球男双决赛樊振东王楚钦轻取韩国组合夺冠！
60,2023-10-01,央视国庆晚会,导语：中央广播电视总台《中国梦·家国情——2023国庆特别节目》将以“开局之年·奋楫争先”为创作大背景，以典型故事+文艺表演的形式，突出“信心·奉献·欢庆”的主旨。
61,2023-10-01,王楚钦第3金,
62,2023-10-01,王楚钦说在国庆夺冠意味着更好的开始,导语：王楚钦在采访中表示在国庆节夺冠意味着一个更好的开始！
63,2023-10-01,卫明再婚是一场闹剧,导语：《好事成双》卫明再婚婚礼上，黄嘉仪母亲和卫明母亲互相出言不逊，场面一度失控，卫总这婚礼着实是热闹~
64,2023-10-01,孙颖莎夺冠,
65,2023-10-01,韩国选手球拍上有马龙照片,
66,2023-10-01,四地中小学生共唱今天是你的生日,
67,2023-10-01,女单决赛,
68,2023-10-01,乒乓球男单,
69,2023-10-01,戍边战士冰山脚下展开国旗庄严宣誓,
70,2023-10-01,朴志焄 希望大家不要在意,导语：小狗解释综艺的事情
71,2023-10-01,孙颖莎vs申裕斌,导语：🏓️法兰克福冠军赛女单1/4决赛，@孙颖莎 3-1战胜韩国选手申裕斌，晋级女单四强，四局比分10-12、11-5、13-11、11-6。
72,2023-10-01,国足亚运队丢球,导语：中国队禁区前犯规，洪贤锡直接任意球破门！中国0-1韩国！
73,2023-10-01,和平项目中国队遥遥领先,导语：和平精英项目总决赛首局开始，中国队一触即发，一路遥遥领先，恭喜中国队拿下第一局！
74,2023-10-01,YG的G没有了,
75,2023-10-01,陈牧驰的助理小鸟依人,
76,2023-10-01,大熊猫吃重庆火锅游客也想炫两口,导语：十一假期前两天，重庆动物园接待游客量已突破11.7万次，人山人海看大熊猫吃“重庆火锅”，游客表示太激动，也想跟着来两口！
77,2023-10-01,南京鸡鸣寺网红猫要被游客摸秃了,导语：10月1日，江苏南京，鸡鸣寺的网红猫“善喜”登高俯视游客，因长相可爱，被众多游客围住拍照、抚摸。
78,2023-10-01,莎头卫冕,导语：德班世乒赛混双决赛，王楚钦/孙颖莎以3比0战胜日本的张本智和/早田希娜卫冕成功。
79,2023-10-01,中国女排vs印度女排,
80,2023-10-01,1号到4号可以不用来兵马俑了,导语：10月1日，秦始皇帝陵博物院发布最新提示：10月1日至4日的门票已经全部售罄，后续日期还有少量余票。网友：人还没来兵马俑票先没了。
81,2023-10-01,升旗结束3男子草坪熟睡被艰难叫醒,导语：10月1日，四川成都。升旗结束后3男子躺草坪上熟睡被艰难叫醒引发网友热议，大家纷纷表示感受到了当代年轻人的爱国精神。
82,2023-10-01,新疆婚宴,
83,2023-10-01,一人一句为孙颖莎加油,导语：10月1日晚，杭州亚运会乒乓球女单决赛，孙颖莎vs早田姬娜 🇨🇳中国队，冲！ 莎莎，加油！！！
84,2023-10-01,capper音乐节,
85,2023-10-01,孙颖莎4比0申裕彬,导语：杭州亚运会首场女单半决赛，@孙颖莎 4-0横扫韩国选手申裕彬（11-7、11-8、14-12、12-10），率先晋级决赛！
86,2023-10-01,亲爱的祖国生日快乐,导语：74年风雨兼程，74载山河巨变，一起祝福伟大祖国生日快乐、繁荣昌盛！#今天之中国我为你骄傲#，目光所至，家国共好。一起转发，祝#亲爱的祖国生日快乐#！ ​
87,2023-10-01,有一种自豪叫中国,导语：为祖国的美好明天齐声点赞！有一种自豪叫中国！9月30日至10月6日由国家广播电视总局宣传司指导，北京、内蒙古、江苏、湖南、四川、新疆、三沙广播电视台主办，全国广电新媒体联盟共同开展“盛世赞中华 大美看中国”国庆七天大型融媒直播行动。
88,2023-10-01,孙颖莎进女单决赛,导语：在10月1日举行的杭州亚运会乒乓球女单半决赛中，孙颖莎战胜韩国选手申裕斌，晋级决赛。
89,2023-10-01,樊振东王楚钦vs韩国队,导语：杭州亚运会乒乓球男子双打决赛，中国组合樊振东/王楚钦击败韩国队，获得冠军。一起为国乒加油！ ​
90,2023-10-01,樊振东王楚钦进男双决赛,导语：在10月1日举行的杭州亚运会乒乓球男双半决赛中，樊振东/王楚钦战胜伊朗组合尼玛·阿拉米安/诺沙迪·阿拉米扬，晋级决赛。
91,2023-10-01,女排首战,导语：10月1日19点，杭州亚运会中国女排迎来首个对手印度队，这也是中国女排在杭州亚运会的首秀。
92,2023-10-01,樊振东王楚钦vs张禹珍林钟勋,导语：🏓杭州亚运会乒乓球男双决赛，樊振东/@王楚钦___ 4-0战胜韩国组合张禹珍/林钟勋夺冠【11-6、11-8、11-7、11-3】
93,2023-10-01,这是黄晓明还是黄小夫,导语：黄晓明和小夫第一眼真的太像了。
94,2023-10-01,和平精英亚运决赛,
95,2023-10-01,王俊凯金泳勋时装周看秀合照,导语：王俊凯金泳勋时装周看秀合照
96,2023-10-01,南昌烟花,
97,2023-10-01,张雨霏原名叫冰清,导语：杭州亚运会冠军张雨霏原名原来叫冰清，和水好有缘！
98,2023-10-01,小胖头,
99,2023-10-01,丘索维金娜不认同体操运动员的黄金年龄,导语：近日，@中国蓝新闻 记者专访到48岁的乌兹别克斯坦体操运动员丘索维金娜。邱妈表示，并不认同体操运动员所谓的黄金年龄。
100,2023-10-01,李现观战中网,
101,2023-10-01,亚运会,
102,2023-10-01,女儿把录警通知书带给牺牲父亲,导语：别立福女儿把录警通知书带给英模爸爸
103,2023-10-01,孙颖莎早田希娜争金,导语：🏓️亚运会乒乓球女单决赛将在今晚19:45上演，@孙颖莎 对阵老对手早田希娜，期待精彩的对决，为孙颖莎加油！
104,2023-10-01,孙颖莎对亚运记者们说国庆节快乐,导语：@孙颖莎 走过采访区，对在场的记者们说国庆节快乐~
105,2023-10-01,王一博新发色藏不住了,导语：王一博新发色藏不住了！
106,2023-10-01,女单半决赛,
107,2023-10-01,权志龙离开YG加入华纳,导语：权志龙离开YG加入华纳唱片…“Welcome GD”
108,2023-10-01,樊振东祝福祖国生日快乐,
109,2023-10-01,前任4观后感,导语：说一说你看完前任4的观后感
110,2023-10-01,这些大国重器彰显中国底气,导语：-10909米，“奋斗者”号成功触底；0米，辽宁舰、山东舰双航母编队海面犁浪。看↓这些大国重器彰显中国底气！
111,2023-10-01,黄山游客被大学生志愿者热情投喂,导语：近日，一名大学生在黄山旅游景区做志愿者，免费为没有做足充足爬山准备的老人孩子提供自热米饭等食物。收到爱心自热饭的游客也纷纷给小伙点赞，还有小朋友给小伙儿送水。简直是志愿者和游客热情双向奔赴现场。
112,2023-10-01,男子马拉松终点前倒立被反超,
113,2023-10-01,你好星期六全员被趾压板支配的恐惧,
114,2023-10-01,曾黎机场被粉丝递剧本的反应,导语：@曾黎 今日出发巴黎时装周，在机场居然有粉丝直接递上了剧本
115,2023-10-01,石宇奇,
116,2023-10-01,专家称住便宜酒店的时代可能过去了,
117,2023-10-01,为什么孙颖莎人气这么高,导语：真的好喜欢莎莎！
118,2023-10-01,杨幂巴黎私服出街,导语：杨幂巴黎私服出街
119,2023-10-01,林双离婚后修罗场都好香,导语：《好事成双》林双离婚后修罗场都好香
120,2023-10-01,白鹿发文感谢粉丝,导语：白鹿发文感谢粉丝
121,2023-10-01,钱塘江大潮撞拍护栏冲倒多名游客,导语：10月1日，浙江嘉兴。网友发视频称盐官观潮景区因浪太大把石护栏冲塌，多名游客被冲倒。
122,2023-10-01,喜欢吃月饼和白粥的都沉默了,导语：喜欢吃月饼和白粥的都沉默了
123,2023-10-01,魏大勋 白月光,
124,2023-10-01,蔚来,
125,2023-10-01,早田希娜 擦边球得分,
126,2023-10-01,腿姐,
127,2023-10-01,石宇奇1比2拉克什亚,
128,2023-10-01,坚如磐石 质疑了你就入戏了,
129,2023-10-01,5岁女孩池边喂50斤胖锦鲤,导语：近日，广东。小女孩在自家鱼池边喂食50斤胖锦鲤，边喂边摸头，画面和谐。
130,2023-10-01,迪士尼一玩偶原价199元炒至8000元,导语：9月26日起，“米奇和朋友们系列”商品上新。其中，角色高飞推出“紫色的飞龙”系列产品，包括钥匙圈、毛绒玩具等，被不少爱好者称为“紫龙高飞”。
131,2023-10-01,王源看秀待遇,导语：王源看秀待遇很好了吧
132,2023-10-01,萝卜刀应该被禁吗,
133,2023-10-01,黄轩演疯批要从亲爱的翻译官说起,
134,2023-10-01,台媒报道杨幂弘扬中华文化,导语：台媒报道杨幂弘扬中华文化
135,2023-10-01,山东花饽饽版五谷丰登,导语：近日，东营广饶的面塑非遗传人韩凤七，为中秋节制作了一锅大花馒头，主题是五谷丰登。她把山东馒头做成各类果蔬，有枣庄石榴、烟台苹果、寿光西红柿、滕州土豆、沾化冬枣、武城辣椒、沂源樱桃、青州柿子、黄河滩的玉米、花菜、豆角子……
136,2023-10-01,国羽男团vs印度,导语：杭州亚运会羽毛球男团决赛，中国队将与印度队争夺冠军！
137,2023-10-01,网友先后偶遇白鹿张凌赫,
138,2023-10-01,庆祝新中国成立74周年,导语：共同传递，把最好的祝福送给祖国！
139,2023-10-01,店员打压我妈被我怼了,导语：#店员打压我妈被我怼了#店员打压我妈被我怼了 ​​​
140,2023-10-01,街头随机采访到了富二代,
141,2023-10-01,网友被求婚收到了赵今麦送的花,导语：网友被求婚收到了赵今麦送的花，麦麦是什么小天使~
142,2023-10-01,汪顺说叶诗文非常不容易,导语：汪顺在快手《冠军来了》采访连线中表示叶诗文的这枚亚运会金牌非常不容易，从今年二三月份开始恢复训练到亚运会参加比赛，仅仅六个月的时间就能恢复到这么高的标准。
143,2023-10-01,陈凯歌透露朱一龙是志愿军2最主要人物,导语：陈凯歌“剧透”《志愿军》第二部：是以345三次战役为主，63军一个最主要的人物就是朱一龙所扮演的一名教导员，这个是非常重的戏份，我们会展开李家，就是辛柏青老师、张子枫和朱一龙的家庭的情感。
144,2023-10-01,坚如磐石,
145,2023-10-01,成毅留了胡渣,导语：成毅巴黎之行有难得一见的胡渣
146,2023-10-01,林双挖人,导语：《好事成双》林双挖人
147,2023-10-01,白鹿回国机场图,导语：白鹿回国机场图，好美！
148,2023-10-01,被稻城亚丁的风景累惨了,导语：一个去了会让人变年轻的地方，我每次都累的跟孙子一样，#被稻城亚丁的风景累惨了#
149,2023-10-01,王艺迪vs早田希娜,导语：🏓️亚运会乒乓球女单半决赛，王艺迪@迪214 3-4不敌早田希娜【4-11/11-3/8-11/11-7/12-10/13-15/10-12】止步半决赛，决赛孙颖莎对阵早田希娜。
150,2023-10-01,莫斯科行动,导语：由张睿执导，夏雨、姚芊羽、吴优等主演的大型热血刑侦剧，取材于93年震惊国际的“中俄列车大劫案”，莫斯科跨境实景拍摄，还原阻碍重重的跨国追捕传奇。1月8日起，每天19:30浙江卫视中国蓝剧场燃情播出，24:00腾讯视频、优酷视频同步上线。
151,2023-10-01,赵丽颖重现楚乔传高马尾,导语：赵丽颖十月行程图中高马尾造型真的一整个直接梦回楚乔传～
152,2023-10-01,鸡鸣寺的团宠橘猫,
153,2023-10-01,退伍老兵拼五星红旗和中国地图告白祖国,导语：10月1日，四川自贡，退伍小伙用农作物拼出五星红旗为祖国庆生。当事人何咚咚表示，昨天拼的地图用到4万多颗稻谷、3万多颗玉米、1万多颗辣椒，花了一天时间拼出中国地图。今天拼的国旗分别用到花生、玉米、稻谷和辣椒。每次五星红旗出现的时候，总有一股暖流涌遍全身，祝福祖国越来越好！
154,2023-10-01,李发彬举重夺金,导语：男子举重61公斤级决赛，中国选手@举重李发彬 抓举143kg创造亚运会纪录，挺举167kg，总成绩310kg排名第一夺得金牌！恭喜！
155,2023-10-01,杨紫抵达巴黎,
156,2023-10-01,邓为云秀行今日杀青,
157,2023-10-01,程潇进组,
158,2023-10-01,早田希娜 擦边,
159,2023-10-01,希望国乒双打失利能引起教练组的重视,导语：对昨日国乒双打失利，《亚运侃侃侃》的嘉宾彭友指出：“虽然国乒的失利比较少见，但赛场上并没有常胜将军，更多的还是希望国乒队能够吸取此次教训。”
160,2023-10-01,何冰娇强忍眼泪,
161,2023-10-01,孙颖莎想跟王艺迪会师决赛,
162,2023-10-01,韩庚前任4最出圈的台词,导语：韩庚《前任4》最出圈的台词，是谁心酸了我不说。
163,2023-10-01,丞磊下次要不戴耳机吧,
164,2023-10-01,封神笑榜,
165,2023-10-01,赵露思10月不进组,导语：赵露思10月还是不进组
166,2023-10-01,志愿军,
167,2023-10-01,陈牧驰的社交能力,
168,2023-10-01,轿车冲入河过路好汉们下水救人,导语：近日，浙江桐乡。一辆轿车失控冲入河中，危急时刻，一群好汉飞奔过来下水救人。据当事人介绍，当时水已经把人全部淹没，驾驶室基本没有什么空气了，大家合力把司机救出来的时候司机的脸已经发紫了，上来的时候他说，再晚一分钟他就憋不住了。
169,2023-10-01,张颂文 先辈用生命换来岁月静好,
170,2023-10-01,不小心把大哥穿的衣服翻译了,导语：不小心把大哥穿的衣服翻译了
171,2023-10-01,黄嘉仪是来整顿卫明全家的吗,导语：《好事成双》中黄嘉仪不仅对卫明提出在最好的楼盘买房子的要求，不开心时也直接对卫明父母甩脸色，果真是来整顿卫明全家的！
172,2023-10-01,林孝埈为亚运健儿送祝福,导语：不同的赛场，同一份拼搏！短道速滑运动员林孝埈为亚运健儿送上祝福，“关注中国体育，关注杭州亚运会，祝愿亚运健儿取得好成绩！
173,2023-10-01,萝卜刀,
174,2023-10-01,不要怀疑自己胜利的秘诀就是相信自己,
175,2023-10-01,丑猫 阴暗地蹲坐,
176,2023-10-01,妈妈送狗当成年礼女儿圆梦哇哇大哭,导语：9月29日，天津。徐女士为给18岁女儿过一个难忘的生日，特意买来女儿喜爱多年的狗狗。
177,2023-10-01,郑钦文说不会原谅前教练,导语：郑钦文跟经纪人哭了很久：“他那个举动对我来说很不道德，但是跳槽嘛，很人之常情，但这并不代表我会原谅他。”
178,2023-10-01,我服了于适了,
179,2023-10-01,DOTA2中国队晋级决赛,导语：杭州亚运会电子竞技项目刀塔2半决赛，中国队2比1战胜马来西亚队，晋级决赛
180,2023-10-01,莫斯科行动是纯血类型片,导语：票房不错，口碑很好，评分挺高的电影《莫斯科行动》是一部“纯血类型片”，嗷嗷纯的那种
181,2023-10-01,倪妮 没挡住但摸摸头,
182,2023-10-01,鹿晗侧颜鲨我,导语：鹿晗侧颜鲨我
183,2023-10-01,国乒男双现场放张杰少年中国说,导语：《咪咕亚运拍客行》国乒男双现场播放了张杰的《少年中国说》，让我们一起为亚运健儿加油吧！
184,2023-10-01,魏大勋片场把爸喊成叔,导语：《特工任务》魏大勋片场把爸喊成叔
185,2023-10-01,老人自发组织小区每周升国旗唱国歌,
186,2023-10-01,张子枫出发巴黎,
187,2023-10-01,橡皮筋突然成了主人的项链,
188,2023-10-01,国庆节快乐,导语：十月一日国庆节，让我们一起带话题词发博祝伟大的祖国母亲生日快乐！po出你的十一随手拍吧～
189,2023-10-01,夫妻在有小孩之后发生的改变,导语：本期《向山海出发》中大家聊到有小孩之后的变化，大家觉得有小孩之后有什么变化吗？
190,2023-10-01,黄子弘凡音乐节,导语：黄子弘凡音乐节持续更新中～
191,2023-10-01,韩国女队员侮辱性模仿何冰娇含泪,
192,2023-10-01,曾见义勇为的南京胖哥女儿离世,导语：9月30日，曾见义勇为身受重伤的“南京胖哥”邱绍春发布视频称“尽力了，她回去了，感谢大家”。此前，邱绍春发视频痛哭求助称，自己女儿9月9日出生后，发现患有严重的心脏病，手术后只能靠ECMO维持心肺功能。
193,2023-10-01,王曼昱分析输球原因,导语：中国举重队连丢两金，男子三人篮球不敌中国台北队......9月30日堪称中国代表团的爆冷日，但最大的冷门还是国乒“双保险”的接连失效。
194,2023-10-01,棕熊体内的寄生虫被拖着走,
195,2023-10-01,今天37岁的他在天府广场第35次看升旗,
196,2023-10-01,十月狗屎运最旺的星座,
197,2023-10-01,告诉老将军现在他们要踮着脚看我们了,导语：今天是刘华清将军诞辰107周年，1980年，时任中国人民解放军副总参谋长的刘华清出访美国时参观“小鹰”号航母。年迈的将军踮起脚尖，望向美军航母。回国之后，他说：“如果中国不建航母，我死不瞑目。”如今，人民海军已进入“三航母时代”，转发微博，告慰将军：今日，如您所愿！
198,2023-10-01,孟晚舟卸任华为轮值董事长,导语：9月30日，华为官网宣布，根据华为轮值董事长制度，在2023年10月1日-2024年3月31日期间，将由胡厚崑当值轮值董事长。         这也意味着，孟晚舟首次轮值董事长当职期也结束。华为董事会确定徐直军、胡厚崑、孟晚舟担任公司轮值董事长，循环履行职责。
199,2023-10-01,梁洁从白色橄榄树寄来的明信片,导语：《白色橄榄树》梁洁从白色橄榄树寄来的明信片
200,2023-10-01,被链球砸骨折的裁判目前生命体征平稳,导语：9月30日晚上，在杭州奥体中心体育场举行的亚运会田径项目男子链球决赛当中，一名裁判疑似被链球砸伤，随即被医护人员用担架抬离现场，引发关注。
201,2023-10-01,吉克隽逸锁骨窝,导语：吉克隽逸央视国庆晚会造型，裙子形状好像阿拉丁神灯！
202,2023-10-01,张远输了十六年终于赢了一回,导语：披荆斩棘张远输了十六年终于赢了一回
203,2023-10-01,农村小伙用自种农作物摆出天安门,导语：近日，安徽阜阳，安徽一农民用秋收的五谷拼对祖国的挚爱。当事人韩先生介绍，到了秋收的季节，正好赶上国庆，自己作为一名共产党员，想表达一下对祖国的爱，因为现在的美好生活都是祖国赐予的。用自家种的辣椒、小米、小麦、南瓜、玉米，摆了天安门和五星红旗。网友：最美的一幅画，祝祖国越来越好！
204,2023-10-01,特斯拉Model Y改款,
205,2023-10-01,侯明昊的造型缘,
206,2023-10-01,每个人都用自己的方式书写中国,导语：每个人都用自己的方式书写中国，勤劳、奋斗、温良、质朴、拼搏……一笔一划中，不断为“中国”，增添新的故事。你的方式是什么？
207,2023-10-01,梅姨安妮海瑟薇 梦回穿Prada的女王,
208,2023-10-01,因朋友喜欢发1我把他删了,导语：因朋友喜欢发1我把他删了
209,2023-10-01,超能摄影阳阳赞龚俊生图,
210,2023-10-01,国羽女团亚运银牌,导语：亚运会羽毛球女团决赛，中国队0-3不敌韩国队，摘得亚运会羽毛球女团银牌！
211,2023-10-01,赵小棠把蒙古帽披在了身上,导语：赵小棠帽子好大大大大大啊！
212,2023-10-01,留学时不要乱用emoji,
213,2023-10-01,是怎么说服黄景瑜王子奇拍的,
214,2023-10-01,三只小猫在叠叠乐,
