,Date,Title,Introduction
0,2023-02-12,中国式现代化走得通行得稳,导语：中国式现代化走得通、行得稳，是强国建设、民族复兴的唯一正确道路
1,2023-02-12,官方准备击落山东海域不明飞行物,导语：2月12日，青岛即墨区海洋发展局回应“日照附近海域发现不明飞行物，正准备击落”：确有此事，不明飞行物具体是什么尚未接到通知，已短信通知附近渔民注意安全。
2,2023-02-12,林孝埈500米两连冠,导语：#短道速滑世界杯#多德雷赫特站男子500米A组决赛，中国选手@林孝埈Lin_xiaojun 成功夺冠！连续两站比赛夺得500米冠军！！ ​​​
3,2023-02-12,中国救援人员加油保重,导语：土耳其当地时间2月11日下午，江苏蓝天救援队在土叙边境阿德亚曼救出一名男性，男子被营救出来时家属就在旁边。
4,2023-02-12,张大大 许愿池的王八,
5,2023-02-12,70岁阿姨微信被封哭诉会孤独终老,导语：阿姨：两天看不到微信，都没用乐趣了，我怎么办，老朋友老同学想聚会都找不到了，微信没了我会孤独终老。
6,2023-02-12,王楚然好漂亮,
7,2023-02-12,多人身体绑藏100斤牛肚入境被查,导语：近日，新疆乌鲁木齐。乌鲁木齐海关所属霍尔果斯国际边境合作中心海关连续查获多起人身绑藏牛肚入境案，共计查获牛肚50.5千克，主要为使用胶带将牛肚捆绑在腹部、背部、四肢等部位，利用冬季宽松衣物遮挡入境，现已移交相关部门进一步处理。
8,2023-02-12,山东海域发现不明飞行物,导语：2月12日，青岛即墨区海洋发展局回应“日照附近海域发现不明飞行物，正准备击落”：确有此事，不明飞行物具体是什么尚未接到通知，已短信通知附近渔民注意安全。
9,2023-02-12,杨紫卷发,导语：杨紫说卷毛的一天，杨紫卷发真好看啊！
10,2023-02-12,唐嫣宋亚轩唱有何不可路透,导语：唐嫣宋亚轩唱《有何不可》路透
11,2023-02-12,安欣老公渣得离谱,导语：电视剧《女士的品格》，安欣老公渣得离谱，竟然提出要安欣抚养他和柳青的孩子。
12,2023-02-12,小狗其实什么都知道,导语：小狗其实什么都知道，知道你喜欢什么也知道你害怕什么！
13,2023-02-12,微信头像褪色,
14,2023-02-12,吴磊赵今麦 能不能边拍边播,
15,2023-02-12,听说你喜欢我,导语：《听说你喜欢我》改编自潇湘书院吉祥夜小说，彭冠英、王楚然领衔主演，讲述了宁至谦、阮流筝二人从拥有爱到理解爱，历经内心挣扎和外部阻碍，寻回了守护彼此的勇气的故事。
16,2023-02-12,刘敏涛身材,导语：《女士的品格》里47岁刘敏涛的身材也太好了吧，狠狠羡慕了！想知道保养秘籍！
17,2023-02-12,短道速滑世界杯,
18,2023-02-12,边亮付心童离婚,导语：《打开生活的正确方式》边亮付心童离婚好扎心！！
19,2023-02-12,哇唧唧哇新人原野撞脸龚俊,导语：网友热议哇唧唧哇新人原野撞脸龚俊
20,2023-02-12,武契奇称塞尔维亚可能将对俄实施制裁,导语：据俄新社报道，2月11日，塞尔维亚总统武契奇表示，由于西方对塞尔维亚施加压力，塞尔维亚可能将不得不对俄罗斯实施制裁。武契奇认为，塞尔维亚被迫这样做的时刻很快就会到来，“让我尽可能地拖延时间。我不会对人民隐瞒任何事情。”
21,2023-02-12,嘎子哥直播间1999元手机1880能买到,导语：2月12日，有网友称，嘎子哥谢孟伟前几日在直播间卖飞利浦s706手机，直播中，嘎子哥称该手机8999元，1999元卖给粉丝。但有网友指出，该款手机原本价格就不到1999元。12日，在嘎子哥所提平台搜索，并未找到该款手机，在另一平台找到该款手机，商家表示该款手机1880元就能卖。
22,2023-02-12,梅德韦杰夫预言欧洲将彻底消失,导语：据塔斯社莫斯科11日报道，俄罗斯联邦安全会议副主席德米特里·梅德韦杰夫预言，欧洲现任领导人的治理结果将“非常凄惨”，欧洲将如同被宙斯绑架的神话中描述的那样“彻底消失”。
23,2023-02-12,关晓彤澳门随拍,导语：《万里走单骑》关晓彤澳门随拍，追寻着澳门的海风，与海洋文明热情相拥~
24,2023-02-12,孩子许愿考年级前三孔明灯原路返回,导语：近日，安徽一对父子放孔明灯许愿，放出去的灯不料又回来了。
25,2023-02-12,高启盛走路,导语：没人逃得过高启盛的嚣张步伐啊！
26,2023-02-12,售楼部回应小区池子形似卫生巾,导语：2月12日，福建宁德。一段小区人工湖造型像卫生巾引发网友热议。
27,2023-02-12,露思 笑中带泪,
28,2023-02-12,姐弟俩仿冒论文期刊四年牟利1800多万,导语：在北京顺义法院审理的一起非法经营案中，一对姐弟召集代理人员，仿冒正规期刊进行征稿，并私自印刷假冒刊物，开展不法行为，仅用四年时间，便代发论文十余万篇，牟利1800万余元。
29,2023-02-12,2023亚洲杯将于2024年进行,导语：体坛周报记者马德兴报道，据来自亚足联的消息，2023亚洲杯赛将定于2024年1月份进行，亚足联已经与卡塔尔组委会方面就具体的比赛时间达成了一致。
30,2023-02-12,流浪地球2成中国影史票房榜第10名,导语：据灯塔专业版实时数据，《流浪地球2》票房达36.51亿，超过《红海行动》，进入内地影史票房前十！
31,2023-02-12,吴磊赵今麦芬兰雪地随拍,导语：吴磊和赵今麦都发了芬兰雪地里的营业照片，果然是男帅女美！
32,2023-02-12,言承旭跳操,
33,2023-02-12,女生买的二手书里夹了400块后续,导语：近日，浙江绍兴的陈同学在买的二手书里发现了400元钱，联系上卖家归还后，卖家将这本书免费送给了陈同学。
34,2023-02-12,渤海,
35,2023-02-12,安宥真演唱会状态,导语：安宥真演唱会状态太好了吧！好美哦！
36,2023-02-12,满江红秦桧房间是如何设计的,
37,2023-02-12,北京近期发生4级以上地震可能性不大,
38,2023-02-12,微信回应头像褪色,导语：今日有网友反映微信头像出现褪色的情况，用了一段时间的头像照片与原图相比清晰度和色彩变暗淡了。也有网友猜测，是由于压缩画质导致的。
39,2023-02-12,张元英演唱会直拍,导语：张元英演唱会直拍，太美啦
40,2023-02-12,女子智齿位置奇特目测要背井离乡,导语：2月8日，山东青岛。一女子晒出自己“骨骼清奇”的智齿位置，竟然位于下颌窦附近，甚至引来医院科室围观！
41,2023-02-12,WBG春季赛首周冠军,导语：恭喜WBG战队获得2023 PEL 春季赛首周周冠军！枪鸣惊天传四海，雷声渐响焕新生！
42,2023-02-12,男子进男厕发现里面有3名女子,导语：2月11日，陕西西安。一段视频显示，一男子进入男厕，结果发现厕所里有3名女士，推门如厕反被指责。其中一名女子表示，是因为小孩憋着，进男厕图个方便。
43,2023-02-12,万茜把高一仁踢出直播间,导语：《女士的品格》直播好有趣，万茜不愧是手机小能手！高一仁找不到退出键，身为群主的万茜友情出手把他踢出去了！太有意思了～
44,2023-02-12,熙妃回宫,导语：韩媒：HYBE方选出了参选S.M.新理事的人选，方时赫、闵熙珍可能会成S.M.新理事。这是熙贵妃回宫吧！
45,2023-02-12,茶颜悦色仍有门店要求排队取餐,导语：2月9日，茶颜悦色官方微博发文致歉称，春节过后，尝试在小范围的门店内测一种新的点单取杯方案，目前，为期3天的内测期已结束，内测门店现已恢复至之前的点单取餐方式。不过，极目新闻10日在武汉探访发现，仍有部分门店点完单后，必须在现场排队取餐。
46,2023-02-12,沈月晒黑西装红领带对镜自拍,
47,2023-02-12,转发这个李飞,导语：他在2023年2月11日23点19分赚了168000000！看到的30s内转发这个李飞，财运就能从他身上转移到你身上！
48,2023-02-12,原来1400多年前就有炒鸡蛋,导语：北魏农学家贾思勰所著《齐民要术》中记载了近三百种食品和菜品，“炒鸡子”就是今天的炒鸡蛋。看《典籍里的中国》↓
49,2023-02-12,张萌说彭冠英是新婚之夜鸽子王,导语：《听说你喜欢我》直播，制片人张萌吐槽彭冠英演的就是新婚之夜放王楚然鸽子的“鸽王”
50,2023-02-12,关晓彤马甲线,导语：关晓彤微博晒六宫格健身照，马甲线好明显！
72,2023-02-12,澳门明代已经在接外贸单了,导语：《万里走单骑》今晚更新，原来澳门早在明代就向海外输出定制瓷器！
73,2023-02-12,年轻时候的黄磊,导语：翻到黄磊老师早年参加台湾综艺被整蛊的视频，年轻时候的黄磊好帅啊！
81,2023-02-12,假如狂飙有平行时空,导语：假如《狂飙》有平行时空，he版大结局🈶
84,2023-02-12,他们的种地技巧已经熟练得不像艺人了,
85,2023-02-12,李硕珉跳了antifragile,导语：李硕珉跳了antifragile，啊啊太好看了！好喜欢啊！！
86,2023-02-12,彭冠英说要给宁至谦好好上上课,导语：《听说你喜欢我》的直播真的谁看谁不说一句笑发财了！怎么做到句句都是梗的！彭冠英说要亲自给宁至谦上课。
87,2023-02-12,我才不要和你做朋友呢,导语：《我才不要和你做朋友呢》是由田宇执导，陈昊宇、庄达菲、周彦辰、马思超领衔主演，古子成、郭欣禹、王漪淼主演的奇幻爱情校园喜剧。
88,2023-02-12,女子婚礼跪谢姑母姑父改口喊爸妈,导语：2月8日，四川。一女子从小因意外变故痛失双亲，是姑母姑父承担起重任将其养育长大。婚礼上听着主持人的介绍，双方都在不停抹眼泪。随后新娘与新郎一起下跪，向养育自己多年的姑母姑父敬茶，姑姑试图上前扶起，新娘坚持跪着，然后改口喊了句“妈妈爸爸请喝茶”，瞬间引现场众人泪目。
90,2023-02-12,尬到抠脚趾的选秀综艺,导语：内娱爱豆参加国外选秀，才艺表演看哭一众导师！
92,2023-02-12,这下我的沙发安全了,
93,2023-02-12,闵熙珍或将成SMTOWN新理事,导语：闵熙珍或将成为SMTOWN新理事
95,2023-02-12,曾沛慈说很想去浪姐4但没收到通知,导语：果然综艺《浪姐4》的网传录制名单还是准确度不高，连曾沛慈都直接回应自己并没有收到面试通知
113,2023-02-12,罗云熙粉丝给白鹿手写道歉信,导语：罗云熙粉丝给白鹿手写道歉信
120,2023-02-12,奶奶的微信群聊,
122,2023-02-12,EDG战胜BLG,导语：2023LPL春季赛 EDG 2－0 BLG，恭喜EDG拿下一城！
128,2023-02-12,苹果闹钟,
129,2023-02-12,林诗栋4比0奥恰洛夫,导语：#WTT常规挑战赛安曼站2023# 男单决赛：@林詩棟y 4-0 @奥恰洛夫OVTCHAROV 【11-7、11-3、13-11、11-8】，恭喜林诗栋夺得本站比赛男单冠军！🎉 ​​​
130,2023-02-12,典籍里的中国齐民要术,导语：CCTV-1今晚八点档《典籍里的中国》，一同识读“中国古代农业百科全书”《齐民要术》！
131,2023-02-12,张若昀演技,导语：《显微镜下的大明之丝绢案》张若昀的演技，你打几分？
132,2023-02-12,BLG对战EDG,
133,2023-02-12,汪小菲寸头,导语：友人晒与汪小菲聚餐合影，汪小菲以寸头新造型出镜
134,2023-02-12,林书豪中国台湾联赛首秀,导语：林书豪中国台湾联赛首秀拿下21分13助攻6篮板
135,2023-02-12,怎么还有papi酱,
137,2023-02-12,姐姐放弃考研捐骨髓救17岁妹妹,导语：河南平顶山郏县一高17岁的王笑歌，学习成绩一直是班级第一，本来她应该和其他同学一样坐在教室里迎战高考，但2022年6月因为反复发烧，去医院检查后最终被确诊患上了骨髓增生异常综合征，也就是白血病前期。在郑州进行考研冲刺的姐姐王梦歌知道后，毅然放弃考研，捐骨髓救妹妹。
139,2023-02-12,上海奶奶逛展时看到50年前的自己,导语：76岁的上海奶奶在逛一场百物展时，竟看到了50年前摩登的自己，原来是认识她的工作人员偷偷将她的老照片当做展物展出。
140,2023-02-12,中国式现代化创造人类文明新形态,导语：现代化不是单选题。历史条件的多样性，决定了各国选择发展道路的多样性。我们党团结带领亿万人民通过走中国式现代化道路，用几十年时间就走完了西方发达国家几百年走过的工业化历程，创造了经济快速发展和社会长期稳定的奇迹。
143,2023-02-12,土耳其震后救灾现场的中国身影,导语：土耳其南部靠近叙利亚边境地区6日发生强烈地震，给土叙两国造成重大人员伤亡。目前，已有多支来自中国的救援队抵达灾区开展救援工作。
159,2023-02-12,网友泰国偶遇张新成,导语：网友在泰国偶遇张新成。
164,2023-02-12,王楚然说想给阮流筝擦眼泪,导语：《听说你喜欢我》中阮流筝哭戏代入感绝了，王楚然也发博说想给阮流筝擦眼泪。
165,2023-02-12,日本的LiSA,
167,2023-02-12,我国进入长寿时代,
168,2023-02-12,何广智没谈过恋爱但初吻可能没了,导语：最近，@何广智- 参加非诚勿扰找女朋友，一句“脱单也不是我想就能办到的呀”说出了谁的心声哈哈哈！
170,2023-02-12,边牧绝育后站医院门口撒尿报复,导语：近日，湖北武汉。边牧绝育后站医院门口叫嚣撒尿报复。医院工作人员赵女士表示，这只狗狗半个月前在我们店做的绝育，之后就经常在店门口叫嚣，抱进来很乖，在外面就不停尿尿，看我们员工穿工作服就一直叫。
172,2023-02-12,如果真的有曾沛慈,导语：曾沛慈如果真上浪姐，初舞台请一定唱《够爱》
173,2023-02-12,林书豪暂停布置战术,导语：@JeremyLin林书豪 今日迎来P+联赛首秀，暂停时直接拿起战术板布置战术，主教练示意队员：注意听！[中国赞]目前比赛进行至第三节中段，林书豪砍下13分5篮板10助攻！
174,2023-02-12,北京房山2.8级地震,
176,2023-02-12,papi酱 我怎么不知道,
177,2023-02-12,好像中奖了可惜奖过期了,导语：我今天一不小心把她送给我的装着520颗星星的玻璃瓶碰碎了，我发现每张上面每张上面都写着字，每一张都写着我爱你
178,2023-02-12,kpop出圈名场面,导语：2022年最出圈的kpop名场面盘点
180,2023-02-12,时代少年团孔雀开屏式拍照,
182,2023-02-12,WB战胜VG,导语：恭喜北京WB在KPL职业联赛中战胜VG
183,2023-02-12,医生称大学生精子活力不如30岁男性,导语：医生介绍，虽然捐精面向的主要人群是大学生，但许多年轻人爱熬夜、作息不规律，因此许多大学生的精子活力检测通过率甚至不如30岁左右的男性，只有少数大学生能通过检测，并且成功拿到补贴。
184,2023-02-12,北京河北部分网友有震感,
185,2023-02-12,暖阳露娜月下无限连,导语：暖阳露娜帅气进场，高地三角飞月下无限连，压制力十足！
186,2023-02-12,新疆草莓音乐节,导语：2023新疆草莓音乐节正式开启。
187,2023-02-12,Jessi来了还能播吗,
188,2023-02-12,你会选择80岁仍要还房贷吗,导语：11日，南宁楼市多个楼盘宣称“住房按揭贷款年龄期限可延长至80岁”。你会选择80岁仍要还房贷的生活吗？
189,2023-02-12,RNG对战WE,
190,2023-02-12,二百者也,
220,2023-02-12,超市刀具被栅栏封锁购买需联系员工,导语：近日，广东广州。林先生在超市购物时，发现销售厨房用刀的区域被围栏全部封锁住，并且张贴告示说明如需购买，需要联系就近营业员。
221,2023-02-12,高启强这个角色为何如此出圈,
222,2023-02-12,车保罗说赵樱子没人选不是剧本,导语：本期《无限不无聊》，@车保罗1102 回应首期《无限超越班》@赵樱子 独自落选，网友质疑“有剧本”的问题，力证选角环节没有一个剧本，都是当下真实发生的。@吴彤 也解释当时因为有3名演员无法来到现场，各种原因交织导致最后出现了只轮空1个演员的情况。
223,2023-02-12,调查显示高龄老人生活满意度高,
224,2023-02-12,王楚然 小说女主,
225,2023-02-12,婴儿被困107小时得救吮吸护士手指,
226,2023-02-12,吴彤美颜镜头下的宋亚轩,导语：吴彤美颜镜头下的宋亚轩🈶
227,2023-02-12,岳云鹏特意请假在工体旁听任贤齐的歌,导语：岳云鹏在《今晚开放麦》说自己特意请假在工体旁听任贤齐的歌。当年我也听好多！
228,2023-02-12,周杰伦问今年又出歌是不是会吓坏,导语：周杰伦问今年又出歌是不是会吓坏
229,2023-02-12,央美准考证模版用肖战照片,导语：央美准考证模版用了肖战的照片
230,2023-02-12,种地吧,导语：让我们一起相信土地的力量！
231,2023-02-12,乘客称航班飞行时多次下坠引尖叫,导语：2月11日，西藏拉萨，有网友发视频称，由拉萨至重庆的PN6392航班飞行途中遭遇气流，飞机出现大幅度颠簸并下坠，乘客纷纷惊呼尖叫。拍摄者麻女士称：飞机刚起飞时较平稳，随后突然摇晃并多次下坠，全程持续约十余分钟，机舱内多名乘客尖叫，自己也很害怕，机组人员反复在广播内安抚乘客
232,2023-02-12,中国救援队,
233,2023-02-12,土耳其男子被救出后惦念被埋妻子,
234,2023-02-12,宋亚轩二专,
235,2023-02-12,虞书欣白色露背蓬蓬裙拍摄路透,
237,2023-02-12,中国空间站第一视角看地球转动,导语：日前，神舟十五号乘组完成了他们的首次出舱任务。漫步太空，看河山大好；舱外作业，筑太空家园。
251,2023-02-12,人民网评狂飙演员曾涉毒,导语：远离毒品，敬畏法律，才是对自己和家人负责，远离毒品才是对缉毒警察真正致敬。
262,2023-02-12,男孩举手7次后身亡妈妈发文,导语：2月9日，据红星新闻报道，近日，一位家长在网络上发帖称，2020年11月，其8岁的儿子郭某在福州市鼓楼区某小学上课期间，感到身体不适，10分钟内举手示意7次，但任课老师没有带他离开教室。
265,2023-02-12,周润发参加香港马拉松10公里赛,导语：据橙新闻等港媒报道，香港渣打马拉松2月12日举行，这是当地新冠抗疫复常后的最大型体育赛事。香港艺人周润发参与了这项活动的10公里比赛。
267,2023-02-12,南宁房贷年龄期限可延长至80岁,导语：2月11日，南宁楼市多个楼盘对外宣称“住房按揭贷款年龄期限可延长至80岁”，记者向南宁多家银行求证后了解到，确有其事。
268,2023-02-12,绑架原县委书记嫌犯仍在逃,导语：2月10日，警方通报广西梧州藤县一村民伙同他人涉嫌绑架勒索该县原县委书记黄东明的消息，引发舆论关注。2月11日，多位村民向极目新闻介绍了他们眼中的在逃嫌犯陈克政。
269,2023-02-12,浪姐4 嘉宾名单,
271,2023-02-12,相差10岁的童瑶张新成演情侣了,导语：38岁的童瑶和28岁的张新成新剧《微暗之火》官宣！差十岁的两个人演情侣年下恋氛围感满满～好斯哈！
272,2023-02-12,TTG两连胜,导语：恭喜@广州TTG 3:0战胜对手，迎来两连胜！
274,2023-02-12,不然曜好细节,导语：不然的曜多次细节操作秀翻全场！带领队伍拿下第二局的胜利
276,2023-02-12,满江红有两个秦桧,导语：最大的剧透🈶了，原来秦桧一直都有替身
277,2023-02-12,TTG对战RNGM,
278,2023-02-12,部队的驾驶员技术有多猛,导语：部队驾驶员担负着兵员、物资、装备等多项运输保障任务，想成为一名合格的部队驾驶员必须经受严格的训练。
280,2023-02-12,买房租房哪个更划算,导语：2月10日，北京。一男子分享出自己花了15万硬装的婚房，他称其还不如花2000元合租的房子。你觉得买房租房哪个更划算？
281,2023-02-12,战士麟羽轩回来了,导语：你的佛珠战士麟羽轩回来了！欢迎回家！
282,2023-02-12,朱珠产后带孩子进组拍戏,导语：朱珠谈到产后带孩子进组感受，直言回家看到宝宝后都会觉得很充实~
309,2023-02-12,男子震后靠可乐坚持134小时获救,
310,2023-02-12,李小冉 虽然没有Joey但有的是老友,
312,2023-02-12,哇唧唧哇新人路演,导语：哇唧唧哇新人线下路演新歌《让全世界都哇！》真的少年味十足呀～在这个雨夹雪的北京看到小哇就会活力满满呀！
314,2023-02-12,男子吐槽15万装修婚房不如出租屋,导语：2月10日，北京。一男子分享出自己花了15万硬装的婚房，他称其还不如花2000元合租的房子。
316,2023-02-12,金博洋太不容易了,导语：金博洋复出首次参赛，获得四大洲赛第七名。
317,2023-02-12,阴阳师,
318,2023-02-12,他生前说只是研制了几枚火箭而已,导语：“两弹一星”元勋任新民见证了中国航天50年发展历程，却说一辈子只干了一件事，“研制了几枚火箭，放了几颗卫星而已”。致敬！
319,2023-02-12,重庆一对情侣蹦极倒挂滞留半空,导语：2月11日，重庆渝北区圣名游乐城高空蹦极项目现场，两名游客倒挂滞留半空引发关注。视频显示一男一女抱着倒挂在半空，救援人员下去进行施救。19时，圣名游乐城回应称现场没有发生安全事故，悬空游客系一对情侣，他们在空中抱着秀恩爱、撒狗粮，拒绝扣上安全扣上来，所以悬挂在空中，无奈之下，教练下去强行给他们扣上安全扣，并将其拉上来，他们身体无大碍。
320,2023-02-12,1894个账号借胡鑫宇事件造谣传谣被处置,
321,2023-02-12,阳光开朗大男孩,
322,2023-02-12,人民币贷款创历史新高,
323,2023-02-12,杨九郎说自己是超燃家族团拉,导语：本期《超燃美食记》大家在讨论“谁的挑战最拉胯？”时，杨九郎主动说自己是超燃家族团拉，哈哈哈有点可爱～
325,2023-02-12,DK对战HLE,导语：2023LCK春季赛DK对战HLE
327,2023-02-12,清清蒙恬好猛,导语：清清蒙恬能抗能打，带领队伍先下一城！
329,2023-02-12,郑州小伙1年半花百万造飞机,导语：河南郑州，从事金融行业的小伙“压缩饼干”用1年半的时间建造一驾飞机。因为从小喜欢航模，经常参加各种航展的他，利用本科学习的计算机知识，一步步电脑作图、建模、3D打印、组装，焊接。
330,2023-02-12,坚定不移推动高质量发展,导语：中国将坚定不移推动高质量发展。中国经济总体发展势头良好，去年中国国内生产总值增长8%左右，实现了较高增长和较低通胀的双重目标。虽然受到国内外经济环境变化带来的巨大压力，但中国经济韧性强、潜力足、长期向好的基本面没有改变，我们对中国经济发展前途充满信心。
350,2023-02-12,于正 我绝对是娱乐圈的另类,
351,2023-02-12,缉毒警察的付出与涉毒艺人的复出,导语：对毒品，我们的态度是零容忍！
355,2023-02-12,养4年流浪金毛送婚戒满眼只有主人,导语：2月11日，四川德阳。胡女士结婚婚礼上让养了4年的金毛狗狗负责送婚戒，狗子乖巧可爱完成任务。
360,2023-02-12,真的会有艾薇儿吗,
361,2023-02-12,东契奇欧文合体,导语：独行侠加时不敌国王，东契奇欧文合体首秀合砍55分
362,2023-02-12,贺峻霖个人技,
363,2023-02-12,满江红,
364,2023-02-12,谷阿莫参选台独政党委员落选,导语：据台湾ETtoday新闻云12日报道，鼓吹“台独”的“时代力量”第四届决策委员选举结果12日凌晨出炉，网红谷阿莫（本名仲惟鼎）落选。“时力选举”委员会将在12日上午11时正式公告票数及名单。
365,2023-02-12,熬夜可能会导致大脑损伤提早,导语：当下大多数人因生活节奏加快，导致生活不规律、精神压力大、睡眠质量差，再加上不健康的生活习惯和饮食，导致患上阿尔茨海默病的人群也逐渐年轻化。
366,2023-02-12,男童被炸致截肢背后的炮仗调查,导语：1月21日，江西上饶男童硕硕（化名）被邻居翁某扔的一枚炮仗炸伤，以致失去右臂，家属称，硕硕伤口处被炸得“血肉模糊”。如此悲剧的发生，让人不禁发问，什么炮仗会有这么大的威力？
369,2023-02-12,王鹤棣西装造型手拿咖啡上班路透,导语：王鹤棣今日份《以爱为营》西装造型，手拿咖啡，是我们帅气的时总啦！
372,2023-02-12,任贤齐晒骑行合照告别滚烫人生,导语：任贤齐晒合照告别《我们的滚烫人生·骑行季》，硬核的浪漫骑行，滚烫长文浪漫告别！
373,2023-02-12,阿凡达2进入影史票房榜前三,
374,2023-02-12,汪汪队版想见你,
375,2023-02-12,别对我动心主演 周也林一,
376,2023-02-12,妈妈为女儿开3元理发店20年不涨价,导语：长沙岳麓区，唐金连奶奶开了家3元理发店，20年来从未涨价，遇到困难、年迈的老人，她还经常打折甚至免费，她的店里有一整面墙，写满了顾客的祝福，一位八旬老人连续七年写诗感谢。
378,2023-02-12,吾乡有情人 孙千,
402,2023-02-12,湖人战胜勇士,
408,2023-02-12,土耳其7月大婴儿震后140小时获救,
412,2023-02-12,UFC284,
