,Date,Title,Introduction
21237,2023-01-24,女子带仙女棒进站被罚300,导语：北京，袁女士坐火车回家进站检查行李时，被检查出携带仙女棒，随后被民警带去派出所做笔录并被罚款300元。
21262,2023-01-24,路人镜头下的田曦薇,导语：路人偶遇田曦薇，真的好美啊～
21263,2023-01-24,张艺谋谈满江红为何放弃全片一镜到底,导语：张艺谋曾计划《满江红》全片“一镜到底”，但最终因电影节奏等问题而放弃，“这是我的遗憾，但讲好故事是第一位的，这也许又是我作为导演的清醒，或者学习的心得。”
21264,2023-01-24,太空电梯,
21265,2023-01-24,湖南一94年女生被父亲酒桌催婚,导语：1月22日，湖南常德澧县。拍摄者王女士表示：被催婚的女生是她堂妹，最近几年经常会有催婚环节，还有几个差不多年龄的堂妹也都单身，长辈们就喜欢开玩笑。
21271,2023-01-24,张颂文 角色魅力,
21272,2023-01-24,王俊凯兔年新春祝福私信,导语：王俊凯的兔年新春祝福私信请查收，“兔年到了，祝大家新年快乐。新的一年身体健康，平安喜乐，万事顺心。”
21274,2023-01-24,王一博无名路演说以真心换真心,
21275,2023-01-24,宋轶看到张若昀吃鸡腿的反应,导语：宋轶看到张若昀在春晚后台吃鸡腿的反应
21276,2023-01-24,9岁男孩瓶内放炮被扎30多块玻璃渣,导语：近日，陕西西安。9岁的男孩小张（化名）将点燃的鞭炮放入玻璃瓶中，爆炸后瓶体碎裂，碎玻璃致孩子受伤。
21278,2023-01-24,无名官微称网传豆瓣分数为谣言,导语：《无名》官微称网传豆瓣分数为谣言
21279,2023-01-24,男子大年初二走亲戚被堵2小时,导语：1月23日，河南信阳，大年初二，杜先生开车走亲戚，因车流量比较大，途中堵车两三个小时。杜先生称，这条路平时不堵，好多新手司机不太懂交通规则，又着急回家，加塞逆行导致，本来是双向道，现在变成了单行道。
21281,2023-01-24,王一博回应无名卡车上的笑,
21282,2023-01-24,2023网络视听年度盛典花絮,导语：“奋进·新征程2023网络视听年度盛典”精彩剧照、花絮火热发布。2023网络视听年度盛典于2023年1月24日19:00预热，20:00盛大开启！
21308,2023-01-24,打开生活的正确方式今晚开播,
21310,2023-01-24,宋祖儿说白宇春晚后台背词最大声,导语：宋祖儿在《狐厂大拷问》春节系列节目采访中透露，白宇在春晚后台是背歌词最大声的那个，爱看一些乔家兄妹欢乐怼人日常～
21319,2023-01-24,金智秀刘海,
21320,2023-01-24,满江红 家国情怀,
21321,2023-01-24,为什么我们不愿意走亲戚了,导语：为什么我们年轻人越来越不爱走亲戚了？带话题发微博一起来聊聊。
21322,2023-01-24,满江红我和我的塑料同事特辑,
21324,2023-01-24,流浪地球2是对人类命运共同体的思考,
21325,2023-01-24,奶奶为3岁孙女缝出5个朝代汉服,导语：湖南长沙，60岁的马奶奶退休后自学汉服制作，亲手为3岁孙女缝制了一套马面裙，作为兔年新衣。近2个多月来，马奶奶已经给孙女做了5个朝代共6套汉服。
21326,2023-01-24,江西为天价彩礼降温,导语：如何为“天价彩礼”降温？江西各地采取了不少实招新招，以期移风易俗。
21327,2023-01-24,文化和旅游部再次提醒游客平安出游,导语：2023年春节假期迎来第三天，文化和旅游部再次提醒广大游客增强安全意识，平安健康出游。
21345,2023-01-24,高启盛 疯批,
21349,2023-01-24,邓超导戏自己演自己喊cut,导语：邓超《中国乒乓》幕后花絮发布，在片场同时担当导演、主演两角，邓超把自己演戏自己喊cut做到极致，果然不爱演的导演不是好指导
21357,2023-01-24,赵丽颖新年祝家家户户富流油,导语：赵丽颖新年祝家家户户富流油
21359,2023-01-24,兔系艺人图鉴,导语：谁能抵挡萌萌的兔系颜值呐！兔年当然要看#兔系艺人图鉴#啦！伴着新年的欢愉气氛快一起来感受布林布林的颜值暴击~兔年，我们一起可可爱爱，快快乐乐！
21360,2023-01-24,满江红局中局芭莎大片,导语：谜案悬而未决，局势瞬息万变，身在局中又该如何找寻破局之法？欲知后事如何，大年初三，《时尚芭莎》为您分解。
21362,2023-01-24,喝不上酒的交警女婿开始上班了,
21363,2023-01-24,90年代明星唱跳实力有多强,导语：除了好听，老歌可唤起被爱、被保护和与他人联系的感觉，获得性乐观。 你们听老歌的感觉呢
21364,2023-01-24,流浪地球2谢谢你们一直在MV,
21365,2023-01-24,网易发布暴雪游戏退款公告,导语：2月1日起开放“暴雪游戏产品”退款申请，推出了以战网价格阶梯最高单价进行全现金兑付，并支持战网、iOS、安卓等全平台退款申请的“全现金、全平台”退款方案。
21366,2023-01-24,3岁娃春节玩太欢趴碗里睡着,导语：1月22日，云南昭通，大年初一，3岁男孩与家人吃饭时，累得一头睡进碗里，逗乐家人。孩子姑姑易女士称，孩子在外边玩了一整天没睡觉，前一秒还在夹菜，下一秒已经睡在碗里了，还不让人动他的筷子，大家都在笑，母亲笑得比谁都开心。
21377,2023-01-24,仙舟罗浮,
21384,2023-01-24,50岁以上的出列,
21389,2023-01-24,邓超拍中国乒乓是战战兢兢的,
21395,2023-01-24,张译称演得好坏未来由观众去评说,
21397,2023-01-24,今年过年你去相亲了吗,导语：过年期间，父母和亲戚的轮番“关心”和热情“牵线”，让许多“单身汪”的春节变成了“相亲节”。今年过年你去相亲了吗？
21398,2023-01-24,刘筱亭掰折宋木子合文俊的红缨枪,导语：宋木子、合文俊做客《天津卫视相声春晚》正准备展示绝活红缨枪刺喉，却发现道具被刘筱亭折断，场面令人啼笑皆非！
21399,2023-01-24,原来古巨基KTV也点情歌王,
21400,2023-01-24,满江红实时票房破9亿,
21401,2023-01-24,山东一村2000人合拍全家福,
21402,2023-01-24,无名梁朝伟王一博王传君花絮,
21403,2023-01-24,男版许红豆照进现实,导语：《去有风的地方》热播，有网友也晒出了自己同款行程，简直就是男版许红豆照进现实啊
21404,2023-01-24,moss 大boss,
21405,2023-01-24,林家川刀哥出狱,导语：林家川在《狂飙》饰演的唐小龙结束6年狱中生活，即将从小龙升级到刀哥。
21407,2023-01-24,梅西无意与巴黎续约,导语：据记者罗梅罗报道：就目前来讲，梅西无意与巴黎续约。世界杯夺冠改变了他的想法。
21408,2023-01-24,tangoz看交换人生的原因,导语：tangoz要笑死我！直播是说看交换人生的原因是纯粹对张小斐老师的欣赏
21409,2023-01-24,你已断开连接,导语：暴雪国服游戏停服，国服断开连接。再见了！！！ ​​
21410,2023-01-24,金智秀公主风造型,导语：金智秀参加时尚活动，齐刘海盘发白色长裙宛若公主
21411,2023-01-24,寻找家乡年味,导语：兔年春节，一起寻找家乡年味吧！
21439,2023-01-24,张艺兴公司新公开三位练习生,导语：张艺兴公司新公开三位练习生
21442,2023-01-24,东北人有多爱旋酒,导语：电影《东北恋哥2对你爱不完》里徐铁和一帮兄弟们，说旋酒就旋酒，南方来的大佬为了融入这帮兄弟甚至还偷偷学旋酒[doge]
21444,2023-01-24,撒贝宁魏大勋是懂盛典互动的,导语：@撒贝宁 @魏大勋 在CMG首届中国电视剧年度盛典现场互动笑翻众人。魏大勋为国剧出海感到骄傲，被撒贝宁扎心两连问：你的剧在海外播出了吗？你是在为别人骄傲？[笑cry]谈及演戏，魏大勋表示要和角色交流无障碍，撒贝宁：“我作为一个主持人我交流有障碍吗？”[允悲]戳↓更多欢乐对话！
21446,2023-01-24,男子回家过年发现新房装了一套半,导语：1月21日，江苏苏州。男子回家过年打开新房发现房子装修一套半，一半精装修一半“简易风”。
21448,2023-01-24,春节假期最冷的一天,导语：冷冷冷！春节假期最冷的一天就要来了，你家今天的温度十分冻人吗？
21449,2023-01-24,男孩偷用压岁钱给母亲买金项链,导语：近日，湖南一女子在商场内等待早餐，发现儿子突然跑去隔壁金店，准备用压岁钱给自己挑选礼物。
21450,2023-01-24,谢之遥给许红豆写的道歉信,导语：电视剧《去有风的地方》正在热播中，谢之遥给许红豆写的道歉信， 不得不说这个道歉信内涵深刻，谢之遥不愧是绝世好男友啊！
21451,2023-01-24,八村垒被交易到湖人,导语：湖人送出纳恩和三个次轮签，从奇才交易得到八村垒
21473,2023-01-24,你今天睡饱了吗,导语：经过除夕、初一和初二的热闹，到了初三应该注意休息，补补觉，歇歇脚，养养神。
21475,2023-01-24,外国女婿回村过年被烟花吵醒,导语：1月21日，湖南湘潭。外国女婿回村过年被烟花吵醒：还以为在乌克兰。愿世界和平，国泰民安！据当事人沙哈表示，他来自俄罗斯，来中国5年了，和老婆结婚1年。这也是他第一次在村里过春节除夕夜也放了烟花，感觉很有氛围。
21477,2023-01-24,卡塞勒0比7巴黎圣日耳曼,导语：姆巴佩五子登科，内马尔、索莱尔破门，巴黎7比0狂胜卡塞勒，晋级法国杯16强！ ​​​
21478,2023-01-24,正月初三有哪些年俗,导语：无论是年俗还是传说，都承载了人们对新一年的美好心愿。戳图了解#初三年俗活动指南#↓↓ ​​​
21485,2023-01-24,张艺谋说沈腾是一颗珍珠,导语：张艺谋评价《满江红》演员沈腾：自带笑点，是我们的珍珠，在公共场合任何话都能接得住，喜剧演员很难得。
21487,2023-01-24,陈哲远怕挤到粉丝把手撑到车窗上,
21490,2023-01-24,王一博说拍无名是人生压力最大时刻,
21492,2023-01-24,春节档电影票房破30亿元,导语：2023年春节档影片涵盖悬疑、喜剧、科幻、动画等多种题材，这个春节，你看了哪部电影？
21494,2023-01-24,水母烟花,
21495,2023-01-24,暴雪国服游戏停服,
21496,2023-01-24,北京玉渊潭2株早樱绽放,导语：北京玉渊潭公园内两株早樱品种樱花已悄然绽放。树上的红灯笼与樱花相映成趣。
21497,2023-01-24,沈月何与合唱初恋,导语：在《无限超越班》新春特辑舞台表演环节，何与和沈月共同表演了歌曲《初恋》，并还原了《食神》里星爷和莫文蔚告白的名场面，氛围感十足。
21498,2023-01-24,大年初三,
21527,2023-01-24,瑶琴,
21534,2023-01-24,姥爷开吊车为孙女摘飞走的气球,导语：1月23日，河南商丘。孙女气球飞走挂在树顶，姥爷得知后开吊车拿回。
21540,2023-01-24,韩国拟投资67亿发展旅游,
21541,2023-01-24,医生除夕夜驱车200公里返院救人,导语：除夕夜，正在苏州老家过年的唐程斌医生接到科室紧急通知，医院收治了一位心血管破裂的危重患者，急需手术。唐程斌随即连夜开车从苏州赶回扬州。
21543,2023-01-24,再见艾泽拉斯,
21545,2023-01-24,金晨主持状态,
21546,2023-01-24,廖凡这长相都得稍稍避他的锋芒,导语：张颂文廖凡合影，网友神评论“廖凡这长相都得稍稍避他的锋芒”哈哈哈哈笑哭
21547,2023-01-24,40岁男子给8岁小孩磕头拜年,导语：2023年1月22日河南商丘永城。40岁男子给8岁小朋友磕头拜年，拍摄者：大人应该叫小孩爷爷，10块20随便给。
21548,2023-01-24,为何拜年反成一种负担,导语：急匆匆的拜年方式不仅发生在年轻人身上，也悄悄影响着长辈。
21572,2023-01-24,漠河究竟有多冷,导语：漠河最低温达到零下50多摄氏度，在户外，把鸡蛋打到铁锹上，蛋清瞬间变白结冰↓↓
21581,2023-01-24,他们从未想过结局会是如此,导语：再见了，暴雪。 只是他们从未想过，结局会是如此。
21584,2023-01-24,刘耀文唱的Monica,导语：刘耀文无限超越班唱的Monica
21585,2023-01-24,妈妈说再也不担心煮丸子效率低了,导语：《小妙招享受自制肉丸的顺滑感》网友：我缺的是教程吗？我缺的是这双巧手啊！
21586,2023-01-24,魔兽世界停服,
21587,2023-01-24,儿子不回家过年母亲仍守在路口张望,导语：1月20日，海南琼海，苟先生本因为经济原因，决定不回家过年，在听说父母阳性后，他还是选择回家看望父母。让苟先生没想到的是，他搭着朋友的顺风车刚刚到家门口，便发现母亲站在门口张望。苟先生表示，自己并没有告诉母亲要回家，后来才知道母亲只要听到车声就会出来张望。刚开始母亲还没有认出自己，走近之后才恍然大悟。
21589,2023-01-24,大兴安岭女子回家发现单元门冻成冰窖,导语：1月22日，黑龙江大兴安岭，一女子回娘家拜年，结果发现大门结冰，冻成“冰窖门”。女子表示，这是一楼的单元门，不是家里，家里温度在零上18度左右。据媒体报道，今年冬天黑龙江多地出现低温严寒天气，大兴安岭阿木尔实测22日温度更是达到-53℃。网友：实在不行你去冰箱里暖和暖和吧。
21591,2023-01-24,满江红是怎么创作出来的,
21592,2023-01-24,吴越年度女演员,导语：演员的灵气、勇于挑战的勇气、角色力量的正气，一起汇聚成了新时代女性角色的大气。恭喜@吴越 凭借《县委大院》获得CMG首届#中国电视剧年度盛典# “年度女演员”荣誉！ ​​​
21594,2023-01-24,守望先锋停服,导语：《守望先锋》国服于2023年1月24日0时停止运营。
21610,2023-01-24,女子庙里祈福时遇兔子带路,导语：1月22日，福建南平，女子去庙里祈福遇兔子带路，“正好是兔年感觉特别巧”。
21611,2023-01-24,妈妈这个词只是叫一叫便喉间哽咽,导语：带话题#春节摄影大赛#发微博，分享你和妈妈的故事~
21616,2023-01-24,岳云鹏被孙越一秒哄好,导语：在天津卫视相声春晚上看哄人大师孙悦如何一秒哄好岳云鹏
21626,2023-01-24,宋轶在春晚后台给赵今麦送小饼干,导语：赵今麦在《狐厂大拷问》春节系列节目中分享春晚后台小故事，遇到宋轶时收到了小饼干，姐姐妹妹的互动好有爱～
21629,2023-01-24,宋佳年度女演员,导语：【#宋佳年度女演员# [打call]】演员的灵气、勇于挑战的勇气、角色力量的正气，一起汇聚成了新时代女性角色的大气。恭喜@宋佳 凭借《人世间》获得CMG首届#中国电视剧年度盛典# “年度女演员”荣誉！ ​​​
21634,2023-01-24,刘宇宁个人EP将与五位朋友合作五首歌,
21641,2023-01-24,深海讲了什么故事,导语：《深海》太特殊了，喜欢的喜欢到死，讨厌的很可能无感，那么喜欢这部电影的大家，你觉得《深海》好在哪儿？
21676,2023-01-24,张继科跟爸爸的相处方式,
21681,2023-01-24,过年才能吃到的甜烧白,
21804,2023-01-24,90岁老人过大寿家人挨家挨户送蛋糕,导语：1月22日，浙江诸暨。家里老人90岁大寿，家人开着三轮车载着一车蛋糕，挨家挨户给村里其他老人发蛋糕，把长寿、喜悦也一起传递出去！
21908,2023-01-24,成果王冰冰同框双厨狂喜,导语：成果与王冰冰在贺岁栏目剧《兴旺》中同框合作，你期待吗？
21914,2023-01-30,虞书欣易梦玲同框,导语：哇，虞书欣易梦玲同框！
21917,2023-01-30,杨幂戴假发没被人认出来,导语：杨幂戴蓝色假发去滑冰的原因🈶️怕被人认出来会打扰到路人游玩
21921,2023-01-30,网友泰国偶遇蔡徐坤,导语：网友泰国偶遇蔡徐坤
21953,2023-01-30,三体第17集好刺激,导语：统帅身份曝光，高能反转不断上演，谁看了《三体》电视剧17集不说一声刺激！
21955,2023-01-30,井柏然台词,
21958,2023-01-30,日本船只非法进入我钓鱼岛领海,导语：1月30日，日“新世丸”号等5艘船只非法进入我钓鱼岛领海，中国海警舰艇依法对其采取必要管控措施并警告驱离。
21961,2023-01-30,胡鑫宇案导致其学校部分学生退学系谣言,导语：近日，网传胡鑫宇案导致江西铅山县致远中学高中部部分学生退学。对此，记者现场走访核实，并联系当地相关部门确认，系谣言。1月30日下午，在致远中学门口，记者看到陆续有学生走进校门。校外马路两边停满了自行车和电瓶车，学校门前有警车值守，附近路段有特警队员来回巡逻。
21970,2023-01-30,杨健你糊涂啊,导语：今晚播出的电视剧《狂飙》中，为了挽救被利欲熏心、犯下错误的杨健，指导组徐忠带他昔日的兄弟们前来唤回他的初心，高燃大场面让人泪目！
21975,2023-01-30,高启兰高晓晨被绑架,导语：高启兰高晓晨被绑架
21996,2023-01-30,强盛集团孙红雷也是卖鱼出身,导语：强盛集团法人孙红雷直播回应：同样卖鱼出身但是守法经营，跟剧里不是同个公司。
21998,2023-01-30,小猫咪可以有多妖娆,导语：#小猫咪可以有多妖娆# 小样 ，又被我迷倒了吧  油腻小猫，妖娆
22000,2023-01-30,村民称找鸡时发现胡鑫宇,导语：据知情人士透露，胡鑫宇被发现于该粮仓内围墙边上，粮仓管理员寻找所养的鸡时发现胡鑫宇遗体，缢吊绳索为鞋带。
22001,2023-01-30,乐华娱乐股价暴跌,导语：据界面新闻消息，号称“最热闹”的2023春节档正式收官。
22002,2023-01-30,当流浪地球2战机遇上歼20,导语：《流浪地球2》里一款酷似歼-20的战斗机引发关注。电影称其为“歼-20C”，是一种可垂直起降的双座战斗机，前舱飞行员主要负责驾驶，后舱飞行员负责操纵机载武器和无人僚机。
22005,2023-01-30,许凯说不是买彩票是自助付款机,导语：许凯回应买彩票：“不是买彩票，是自助付款机”
22006,2023-01-30,业内人士赞王一博无名表现优秀,
22007,2023-01-30,小熊猫连睡觉都很可爱,
22009,2023-01-30,李飞对时代少年团成员的评价,
22017,2023-01-30,安欣赌孟钰不会害自己,导语：安欣赌孟钰不会害自己，安欣赌赢了
22028,2023-01-30,李健穿长裤,
22041,2023-01-30,生育登记并非上户口,导语：​​​1月30日，四川生育登记取消结婚限制、取消数量限制的消息在网上引起热议。对此，记者从四川省卫健委相关处室获悉，《办法》中所说的“生育登记”并非大众所认为的“上户口”。
22042,2023-01-30,男子检查车胎发现卡住一枚戒指,导语：1月29日，浙江杭州。杨先生发视频，他检查轮胎时，发现一枚戒指，让他十分惊讶。杨先生称，他早上出门车内显示胎压低，他去检查轮胎的时候发现了这枚戒指，他没去鉴定，但看到是某金饰品牌同款，也感到很意外。
22045,2023-01-30,坐火车不要把手搭在下面,
22048,2023-01-30,宋亚轩刘耀文嘟嘴,导语：宋亚轩刘耀文唱歌嘟嘴好可爱
22049,2023-01-30,狂飙片名来自毛主席诗词,
22050,2023-01-30,胡鑫宇录音笔解析结果今日将出,
22052,2023-01-30,这猫怎么是扁平足啊,导语：黑猫：吆，脚不小啊
22053,2023-01-30,这螃蟹怎么虾里虾气的,导语：大家有见过这种又像螃蟹又像虾的吗？
22054,2023-01-30,佟丽娅分享视频为儿子庆生,导语：佟丽娅分享视频为儿子朵朵庆生
22055,2023-01-30,北京重点商圈将开展外摆试点,
22057,2023-01-30,电影满江红出品方商业版图,
22058,2023-01-30,向白云深处跑去,
22059,2023-01-30,你在流浪地球2里多少岁,导语：大家有没有好奇过如果自己也存在在流浪地球里是多少岁？
22062,2023-01-30,四川生育登记取消结婚限制,
22073,2023-01-30,狂飙一下子变仙飙,导语：《你的欣有一道墙》安欣高启强别太般配，这bgm加的也太适配了吧！我看谁还没开嗑！
22074,2023-01-30,三胎概念股突然大涨,
22075,2023-01-30,蔡徐坤雾霾蓝发色度假随拍,
22078,2023-01-30,胡鑫宇家属透露遗体发现细节,导语：1月30日上午，在胡鑫宇外婆家，红星新闻记者见到了胡鑫宇的母亲李女士。李女士回忆，29日早晨，她接到家人的电话，告诉她鑫宇找到了，一个储粮仓库里，用鞋带“上吊”着，家人去现场看了遗体。李女士称，她看到孩子时，遗体已经腐坏，几乎是“骸骨”，头颅形状勉强能看出是鑫宇。
22079,2023-01-30,王栎鑫带孩子游玩vlog,导语：王栎鑫带孩子游玩vlog，玩的开心哦，真好啊！
22080,2023-01-30,程耳联系王一博的过程,导语：程耳联系王一博的过程，先找黄磊联系，黄磊找何炅联系
22081,2023-01-30,不要对头发做的五件事,导语：执照的毛发学家告诉你不要对你的头发做这五件事！
22082,2023-01-30,胡鑫宇遗体所处区域有明显搜索痕迹,导语：记者实地探访铅山县致远中学南侧金鸡山区域。记者发现在学校边侧有一堵约2米高的围墙，外部就是一处于废弃状态的厂房，穿过厂房可直接进入金鸡山区域。该区域此前搜索痕迹明显，随处可见有灌木丛被砍伐。
22083,2023-01-30,NCT127今日新专回归,导语：NCT127新专今日就要回归啦！已经狠狠期待住了！
22084,2023-01-30,10岁女孩疑食用售卖面包中毒身亡,
22085,2023-01-30,你会选择不喜欢的人结婚吗,导语：你会迫于压力选择和不喜欢的人结婚吗？
22086,2023-01-30,张根硕模仿黑暗荣耀里的空姐,导语：张根硕模仿《黑暗荣耀》里的空姐惠廷，很传神了！
22087,2023-01-30,徐冬冬说高叶演的大嫂太好了,导语：近日电视剧《狂飙》热播，高叶饰演的大嫂陈书婷走红，影视剧中那些经典的“大嫂”角色再度引发网友讨论，《余罪》中徐冬冬饰演的大嫂也被网友票选出来，对此徐冬冬发文表示“感恩可以演过大嫂这类型的角色”。
22088,2023-01-30,陈妍希恋综首秀,导语：陈妍希官宣加盟《半熟恋人》第二季，即将带来她的恋综首秀，期待！
22089,2023-01-30,强盛集团开通微博关注张颂文,导语：1月30日，山东强盛集团在微博开通官方账号并关注了@张颂文。
22090,2023-01-30,折腰,导语：电视剧《折腰》讲述了小乔和魏劭先婚后恋，在相处中消弭隔阂渐生情愫，跨越世仇相知相爱。纷争下的宅邸日常，有步步为营亦有人间烟火，敬请期待！
22091,2023-01-30,张颂文说唱歌一直是我的恐惧,导语：张颂文老师曾说：唱歌一直是我的恐惧！但面对恐惧的方式就是要面对他呀！张老师不要放弃接着唱吧～
22092,2023-01-30,李楷灿MV镜头,导语：李楷灿MV镜头好帅啊！造型能不能原封不动上舞台！
22093,2023-01-30,全国各省离婚人数排名,导语：#全国各省离婚人数排名# ：四川排名令人意外，来看看离婚的十大因素
22094,2023-01-30,好羡慕头发不会出油的人,导语：平等的恨每一个头发不油的人！
22096,2023-01-30,连农村的厕所都这么卷了,导语：农村人进城和城里人进村都是一副没见过世面的样子，真是开了眼了
22097,2023-01-30,2023LPL春季赛,
22098,2023-01-30,父亲教10岁儿子理财1年挣1570元,导语：近日，山东济南。父亲给10岁儿子制定了通过劳动获得收入的理财计划，奖罚分明，每当累计满50元，父母保管一个月以上便会支付给孩子10%的存款利息。徐一杰称：自己从2022年1月开始做理财计划，1年间共收入1570元，这一年自己最大的变化就是不乱花钱了
22099,2023-01-30,沙溢说自己是小破球最幸运的粉丝,
22100,2023-01-30,胡鑫宇遗体被找到时衣服疑似反穿,导语：1月30日上午，在胡鑫宇外婆家，红星新闻记者见到了胡鑫宇的母亲李女士。李女士回忆，29日早晨，她接到家人的电话，告诉她鑫宇找到了，一个储粮仓库里，用鞋带“上吊”着，家人去现场看了遗体。李女士称，她看到孩子时，遗体已经腐坏，几乎是“骸骨”，头颅形状勉强能看出是鑫宇。
22101,2023-01-30,第一次感受到娃娃机的真诚,导语：第一次感受到了来自娃娃机的真诚，直接劝退哈哈哈哈哈
22102,2023-01-30,猫猫肉眼可见的心虚,导语：它怎么能这么欠欠的啊
22103,2023-01-30,什么是缢吊,导语：国内知名法医专家告诉记者，警方通报里所说的“缢吊”，其实是指胡鑫宇尸体被发现时的一个状态，而上述网友解释的是“缢死”，是死因的一种鉴定。警方通报里写的是“缢吊”，而非缢死，也就是说，暂未指明胡鑫宇的死亡原因。
22104,2023-01-30,赵丽颖白色皮草大衣造型,
22105,2023-01-30,浙江的服务区能有多豪华,导语：被浙江嘉兴的服务区豪到了
22106,2023-01-30,梁朝伟王一博王传君见面好好笑,导语：电影《无名》发布一则片场花絮，当梁朝伟出现在片场，王一博与王传君打招呼时显得拘谨又兴奋，而梁朝伟貌似也有点紧张。
22107,2023-01-30,流浪地球2动物隐喻,导语：《流浪地球2》影片中狗、海鸥、带鱼、兔子背后的隐喻大家发现了吗？
22108,2023-01-30,LGD对战OMG,
