,Date,Title,Introduction
11038,2023-02-07,少爷和我4季度热点事件TOP1,导语：#少爷和我#登顶#2022年4季度综艺报告#热点事件top1。
11039,2023-02-07,土耳其地震已在土造成2379人死亡,导语：土耳其副总统福阿德·奥克塔伊6日说，当天发生在土耳其南部的强烈地震已在该国造成2379人死亡、14483人受伤。救援人员已从废墟中救出7840人。
11040,2023-02-07,果然大学生撕伞是把好手,导语：论撕伞还得是大学生， 因为淋过雨，所以知道怎么下暴雨😂
11041,2023-02-07,刘敏涛说的周正男孩原来是师铭泽,导语：@刘敏涛93 新剧《女士的品格》开播，原来她在“花少4”里说的周正男孩是@师铭泽11 啊！
11042,2023-02-07,考研查分空窗期怎么度过,导语：2023考研初试成绩即将公布，这段“考研查分空窗期”，你可以做些什么？
11043,2023-02-07,百度类ChatGPT产品名为ERNIEBOT,导语：2月7日上午消息，此前，百度即将推出一款类似于ChatGPT产品的消息引发外界关注，今日，百度向新浪科技确认了该消息。
11044,2023-02-07,张译自创的呼吸睡眠法,导语：张译自创的呼吸睡眠法，哈哈哈哈哈哈哈哈哈哈哈哈哈哈
11046,2023-02-07,明日方舟,
11047,2023-02-07,刘耀文油彩妆,导语：刘耀文乌托邦专辑热血高校大片，脸上涂绿白油彩，好帅啊！
11048,2023-02-07,揭秘爆红ChatGPT之父,导语：OpenAI的首席执行官山姆·奥特曼1985年出生，8岁时就学会了如何编程，后在斯坦福学习了两年计算机后辍学创业。2015年和马斯克一起创立OpenAI。2022年11月OpenAI发布了爆火聊天机器人ChatGPT。
11049,2023-02-07,漫威电影回归内地大银幕,
11050,2023-02-07,中国公羊救援队8人前往土耳其震中救援,导语：2月6日，土耳其发生两次7.8级强震。中国首支社会救援力量公羊救援队将于北京时间2月7日上午派遣第一支国际城搜救援队由杭州基地出发赶赴土耳其此次地震受损最严重的灾区。
11052,2023-02-07,王力宏新歌,
11054,2023-02-07,杭州两套拆迁房让一对亲姐妹闹翻,导语：杭州两套拆迁房让一对亲姐妹闹翻，一个细节让网友感叹：太重要！
11061,2023-02-07,脱口秀演员自曝上综艺可以接受恶剪,导语：《#开工了新生活#》小佳说“今年想多录一些综艺，录那种真人秀，我可以接受恶意剪辑”。
11071,2023-02-07,高叶说幸亏张颂文选择了演戏,导语：高叶自曝在听完张颂文唱歌之后给他发微信表示：“幸亏你选择了演戏啊”
11072,2023-02-07,守望先锋2联动一拳超人,
11077,2023-02-07,詹姆斯对湖人错过欧文感到失望,导语：詹姆斯对湖人错过欧文感到失望
11078,2023-02-07,2023年以来最强雨雪上线,导语：2月7日至9日，大范围雨雪天气将席卷我国中东部地区，江南等地部分地区有暴雨，西北、华北等地部分地区有大雪，局地暴雪。
11079,2023-02-07,满江红张大一句话触动孙均,导语：电影《满江红》里张大与孙均诀别的戏真好，一句话就触动了对方
11080,2023-02-07,男孩吃火锅时发现作业没写愁到大哭,导语：2月5日，河南三门峡。男孩吃火锅时发现自己即将开学作业还没写完，愁到大哭的视频，引发网友关注。
11083,2023-02-07,苹果仍在开发反向无线充电功能,导语：苹果仍在继续为 iPhone 提供全面的反向无线充电支持。苹果曾希望在 iPhone 14 Pro 系列中首次推出该功能，但未能在该期限前完成。
11084,2023-02-07,2022年度个税汇算3月1日开始,
11085,2023-02-07,你现在王者什么段位,
11086,2023-02-07,张凌赫用身高压制白鹿,导语：张凌赫居然用身高压制白鹿！
11088,2023-02-07,等考研成绩有多难熬,
11089,2023-02-07,导游回应不达购物标准不给游客房卡,导语：2月6日，一网友称参加广西一旅行团时被强制购物，不达消费标准不给房卡的视频引发关注。报名时工作人员虽然告知大家这是一个购物团，但未提到有最低消费标准。直到旅途第二天，导游才宣布每人必须消费满400元，否则不给房卡，因此与团内另一游客发生冲突。
11090,2023-02-07,ChatGPT,
11092,2023-02-07,刘宇宁贾士凯聚餐路透,导语：刘宇宁跟贾士凯聚餐路透，两位是有什么新合作吗？
11093,2023-02-07,张颂文孤舟民国造型路透,导语：张颂文孤舟民国造型路透
11094,2023-02-07,多条国际航班票价降至千元以内,导语：据 @证券时报e公司 此前了解到，出境航班数量较少、票价昂贵，成为出境游重启困难的主要原因。随着近期航班数量恢复以及春节高峰过去，国际航线机票价格明显下降。
11096,2023-02-07,绝地追击定档4月7日,导语：由邱礼涛执导，欧豪等主演的灾难动作电影《绝地追击》定档4月7日上映。
11098,2023-02-07,狂飙剧组全员百灵鸟,导语：狂飙剧组全员百灵鸟哈哈哈 全员百灵鸟，唱得最好的还得是你安欣    张译  张颂文  高叶！就属张颂文的歌声最深情！
11102,2023-02-07,骄阳伴我,导语：电视剧《骄阳伴我》由宋晓飞执导，李潇、姜无及编剧，肖战、白百何、田雨、朱珠领衔主演。9月1日起，锁定CCTV-8、爱奇艺、腾讯视频，不见不散！
11115,2023-02-07,肖战杀青抱着白百何转圈,导语：《骄阳伴我》杀青，肖战抱着白百何转圈圈
11132,2023-02-07,肖战双手比心,导语：白百何片场举着相机拍肖战 肖战对着镜头双手比心
11133,2023-02-07,华晨宇超话掉落Q版华晨宇,导语：华晨宇超话掉落q版华晨宇
11139,2023-02-07,无名北美版海报,导语：电影《无名》发布北美版海报，2月17日美国、加拿大上映。 ​
11140,2023-02-07,谷歌将推出ChatGPT竞争对手Bard,导语：谷歌正在推出一款名为Bard的人工智能聊天机器人，与ChatGPT竞争。
11141,2023-02-07,很离谱但如果是张译也合理,导语：那些听起来很离谱的事情放到张译身上就合理起来了哈哈哈哈哈
11142,2023-02-07,乾隆的猫都叫什么,
11143,2023-02-07,256斤男生半年暴瘦100斤变肌肉猛男,导语：近日，湖北。一位男生分享自己的减肥经历，半年暴瘦100斤如同整容。男生称自己制定了严格的减肥计划，每天早晨6点起床，简单喝一杯咖啡就开始燃脂训练，每天几乎都累到力竭。他表示，减肥是一种态度和坚持，减掉的不仅是肥肉，而是不甘和自卑，阳光帅气比整容更有效。
11147,2023-02-07,留洋土耳其球员称遭遇极端天气,
11149,2023-02-07,土耳其全国哀悼7天,导语：据土耳其卫生部长证实，土耳其地震遇难人数升至1651人，此外还有1万1119人受伤。土耳其总统埃尔多安宣布全国哀悼 7天。
11154,2023-02-07,男子称买蒙牛酸奶打开都是清水,导语：2月6日，江苏徐州，男子吐槽买到的蒙牛活菌好酸奶打开都是清水，没有任何味道。当事人表示，是在超市买的，孩子喝了好多之后表示酸奶不甜，这才发现都是清水，超市员工也解释不清楚怎么回事，最后给赔偿了一盒同样的酸奶。
11169,2023-02-07,个人有必要做新冠抗体检测吗,导语：近日，湖南、湖北、深圳等多地发布通知，开展新冠病毒抗体检测，价格在30-50元/次。 通知提到，抗体检测可用作新冠感染辅助诊断，同时为新冠病毒疫苗接种时间及接种方案提供依据。
11171,2023-02-07,1999年以来土耳其最严重强震,导语：据土耳其媒体报道，此次地震是1999年以来土耳其最严重强震。
11172,2023-02-07,三秒摔了六跤,
11177,2023-02-07,浙江专升本门槛降了,导语：浙江2023专升本门槛降了！细则公布
11178,2023-02-07,开学第一课是睁眼说瞎话,导语：开学第一课是睁眼说瞎话…
11181,2023-02-07,高叶回应剧抛脸,导语：《狂飙》陈书婷扮演者高叶在直播中回应“剧抛脸”评价，表示这是一个演员应该做的事情。
11184,2023-02-07,这驾照是非学不可吗,导语：这不就是我刚学车的样子吗哈哈哈哈
11185,2023-02-07,2岁娃山区玩后反复发烧查出黑热病,导语：2岁的小新（化名）突然发热，体温最高达41℃，间隔4-6小时反复。妈妈以为是普通感冒，服用感冒药和退烧药后孩子病情仍未好转。
11190,2023-02-07,网传肖战李沁梦中的那片海Q1播出,
11194,2023-02-07,胡锡进谈ChatGPT,导语：今天，@胡锡进 发博称，看到几个群里用与#ChatGPT# 聊天拿自己开涮，还有人预言它将让老胡失业。对此，胡锡进表示自己“是一门永远的155毫米榴弹炮，简单，不依附任何时髦的东西。” ​​​
11195,2023-02-07,直播镜头拍下土耳其强震现场,导语：6日，土耳其一天内两次7.8级强震。第二次强震来袭时，有记者正在马拉蒂亚省震区进行直播连线。
11196,2023-02-07,唐僧安欣和孔雀高启强,导语：用西游记的方式打开《狂飙》，唐僧安欣和孔雀高启强属实没想到啊哈哈哈～
11209,2023-02-07,突然就不害怕死亡了,导语：突然就不害怕死亡了～
11215,2023-02-07,在北京100块能买多少糕点,
11219,2023-02-07,狂飙大嫂高叶直播,导语：《狂飙》“大嫂”陈书婷@高叶ChLoe 做客【娱理聊聊】， 笑称这个春节可过好了～
11223,2023-02-07,猫咪的爪子到底有多可爱,导语：小猫咪的爪子，手感也太好了吧，隔着屏幕都被萌到了……
11224,2023-02-07,吴京说流浪地球3该炸哪儿了,
11225,2023-02-07,官方回应一男生被多人扇脸踢踹,导语：2月6日，河南信阳平桥区的王先生（化姓）向记者提供了一段视频，视频中一名蓝衣男孩被多人围殴，多次遭扇脸、踢踹
11233,2023-02-07,第一次听说水果生蚝,导语：2月4日，广西。女子点了一份烤生蚝，配料竟是芒果和草莓，纵观全国也是相当炸裂的，终于理解意大利人看到菠萝披萨时的愤怒了。
11240,2023-02-07,杨幂白切黑变脸视频,
11242,2023-02-07,杨幂方起诉黑粉,
11243,2023-02-07,东北公主的下午茶有多优雅,导语：此刻一位东北公主正在优雅的享受下午茶～
11285,2023-02-07,你会邀请前任参加你的婚礼吗,导语：前任结婚邀请你，你们会去吗？你是否又会邀请前任参加你的婚礼？
11401,2023-02-07,张颂文贾发跳舞好可爱,导语：张颂文在《乘龙怪婿》中饰演的贾发好可爱啊
11456,2023-02-07,这是我打工的真实写照,导语：破防了！没想到灰太狼也开始打工了，原本以为会是一只高傲的狼，没想到被打工累成了狗，感觉灰太狼演绎了我本人。被《次元，破了！》刷新童年记忆
11526,2023-02-19,Wendy哭了,导语：生日会上，回想起当时等待自己康复的粉丝们，Wendy哭了。
11530,2023-02-19,EDG对战TES,
11537,2023-02-19,宋亚轩拥抱式哄刘耀文,导语：家人们，耀文因为亚轩不给他看手机（亚轩的手机） 生气走掉了，这是我能嗑的吗？！
11538,2023-02-19,樊振东王曼昱晋级混双半决赛,
11539,2023-02-19,薛飞张瑞3比0王楚钦孙颖莎,导语：#德班世乒赛选拔赛# 混双小组赛第3轮，薛飞/@Z张瑞Z 3-0 @王楚钦___ /@孙颖莎 【11-8、11-7、11-6】。
11540,2023-02-19,张萌谈宁至谦阮流筝的爱情,导语：发现读完萌姐的文字以后对整个剧集有了更深刻的理解，尤其是对宁至谦这个人物有所改观，我们需要的不仅仅是完美的男主，更期望可以从剧中对现实生活有所感悟!
11544,2023-02-19,巴黎圣日耳曼vs里尔,
11545,2023-02-19,丁程鑫贺峻霖再跳psycho,导语：在拍摄现场听到bgm就浅浅跳了几下，没想到还能看到cover的psycho，所以什么时候能正式的再一次嘛
11546,2023-02-19,新增确诊病例主要是没阳过的,
11548,2023-02-19,金毛被撞趴地吐血女子救助收养,导语：2月12日，四川绵阳。金毛被撞趴地吐血路过女子将狗狗送医救助。
11549,2023-02-19,学生曝食堂勾芡严重菜稀成面条卤子,导语：2月18日，辽宁铁岭，网曝开原市第二高级中学食堂菜品勾芡严重。网友发布的视频显示，一勺子下去，舀上来的大半都是芡汁，最后到学生碗里的菜刚好铺满餐盘底部。2月19日，铁岭12345政务热线工作人员表示，已经收到多位家长的投诉，目前在受理处理中。
11550,2023-02-19,苏醒分享种地吧vlog,导语：号外号外号外！！！！！老歌手更新啦啦！这次是录音棚vlog+种地吧vlog！
11551,2023-02-19,撞脸明星的素人能有多像,
11552,2023-02-19,全智贤机场风衣穿搭,导语：全智贤机场风衣穿搭路透🈶
11554,2023-02-19,张新成演技,导语：剧集《光渊》正在热播，张新成在剧中饰演裴溯，本哥的演技，你觉得如何？
11555,2023-02-19,夜昙被退学,导语：《星落凝成糖》夜昙@李兰迪 因为碧穹仙子在星君面前告状被误解，自己还没上学就被退学，这波真的心疼夜昙~
11577,2023-02-19,无名,
11581,2023-02-19,苏小玎说狂飙张颂文和角色反差最大,导语：高启盛扮演者苏小玎说《狂飙》里张颂文和角色反差最大
11582,2023-02-19,真的没有人为坎儿井发声吗,导语：坎儿井和万里长城、京杭大运河并称为中国古代三大工程，但却鲜少有人知道坎儿井的真实面貌，来看本期《万里走单骑》走进新疆，一起了解坎儿井吧～
11584,2023-02-19,电影无名海外影评,导语：电影《无名》在北美上映，来看海外网友对于《无名》的评价！
11586,2023-02-19,陈都灵冯蘅绿衣路透,导语：陈都灵冯蘅绿衣造型路透
11591,2023-02-19,王鹤棣坐在车头唱rap,导语：王鹤棣坐在车头唱rap
11592,2023-02-19,Cube回应gidle演出服被售卖,导语：Cube回应Gidle巡演上穿过的演出服被二次售卖。
11593,2023-02-19,合肥宣扬功利性内容教授已停课,导语：2月19日上午，一则题为“合肥教育名师陈宏友讲座中被学生轰下台”的视频+图文网帖在微博、抖音等多个网络平台上广为流传。19日午间，澎湃新闻记者多方确认了上述视频的真实性，视频中的讲座主讲人确为合肥师范学院教师教育学院副教授陈宏友。2月19日中午，陈宏友接受澎湃新闻记者电话采访时表示，目前合肥师范学院和他所在的二级学院党委已注意到网络上的相关舆情，按照学校的要求，他目前已经停课在家反省。
11594,2023-02-19,黄多多双语视频,导语：黄多多录制的双语视频
11597,2023-02-19,肖战wetv2022最佳男主角,导语：肖战凭借《余生请多指教》顾魏一角获wetv2022最佳男主角，实至名归~ ​
11598,2023-02-19,如懿传剧组最新合照,导语：制片人晒了如懿传剧组最新合照
11600,2023-02-19,若美方执意扩大事态中方必将奉陪到底,导语：中共中央政治局委员、中央外事工作委员会办公室主任王毅：如果美方执意借题发挥、炒作升级、扩大事态，中方必将奉陪到底，一切后果将由美方承担。
11601,2023-02-19,柯南2023全新片尾曲,导语：名侦探柯南片尾曲ED68《クウフク(starring VALSHE)》映像来了！全新封面插画公开
11604,2023-02-19,促发展需要做好精准文章,导语：在“精准”上持续用力，主动服务、靠前服务，靶向发力、精准施策，必能更好为企业解难题、办实事，不断提振发展信心。
11624,2023-02-19,合肥师范回应陈宏友中学演讲内容不当,导语：合肥师范学院回应陈宏友在中学演讲涉及不当内容：当晚就已停课处理
11628,2023-02-19,原来兔子会打人,导语：咏春兔问！
11629,2023-02-19,金泰亨出差十五夜预告视频,
11633,2023-02-19,MTG对战eStar,
11640,2023-02-19,官方通报上栗2名民警1名辅警因公牺牲,导语：2023年2月17日晚，上栗县公安局交警大队根据统一部署开展交通违法行为整治行动。期间，民警何明树、李兵与辅警李荣强依法查处了黄某某无证驾驶、酒驾违法行为。事后，黄某某带刀折返现场，趁执法人员转换执法地点不备之际，突然持刀袭击。何明树、李兵、李荣强三人与其展开搏斗中不幸负重伤，经送医院抢救无效牺牲。
11643,2023-02-19,赵露思神隐红衣拂袖路透,导语：赵露思新剧《神隐》红衣拂袖路透，太美了吧！
11644,2023-02-19,桃李面包中吃出2厘米带锈刀片,
11645,2023-02-19,重紫心魔,导语：《重紫》重紫中了嗜心毒，幻想中她发现自己爱上了师父。她的心魔就是师父洛音凡
11646,2023-02-19,浙江彩民中2.4亿元巨奖,
11647,2023-02-19,满江红实时票房破44亿,
11648,2023-02-19,租客跟房东说养宠物结果是匹马,导语：近日，湖南长沙一小区，一租客竟然在住宅内养起了马，让人大跌眼镜！
11649,2023-02-19,LGD单局12淘汰,导语：2023PEL春季赛第二周周决赛第三天收场比赛，杭州LGD以12淘汰成功吃鸡！
11655,2023-02-19,庐江中学,
11664,2023-02-19,刘畊宏vivi鼓励大家多亲吻,导语：《哎呀好身材4》伴侣季刘畊宏王婉霏夫妇鼓励大家多亲吻，要多多表达爱意呀！
11668,2023-02-19,陈宏友回应讲座引不满被高中生反呛,
11671,2023-02-19,let me do it for you,
11673,2023-02-19,广东选调,
11679,2023-02-19,沈阳三胎家庭每月发放500元补贴,导语：近日，沈阳市委、市政府印发了《实施积极生育支持措施促进人口长期均衡发展实施方案》，在降低生育养育成本上，方案明确，对夫妻双方共同依法生育三个子女的本地户籍家庭，三孩每月发放500元育儿补贴，直至孩子3周岁止。
11681,2023-02-19,Faker中单安妮,
11682,2023-02-19,中国16岁女孩获网球世界冠军,导语：近日，在ITF国际青少年网球锦标赛决赛中，来自浙江清华附中嘉兴学校、年仅16岁的夏锦舒，收获了个人网球生涯的首个国际青少年单打冠军。
11683,2023-02-19,非婚生育将面临哪些困境,导语：从她们的讲述中，可以看到她们在成为非婚妈妈的过程中受到的支持、制约及周边人的质疑。她们讲述自己经历，时不时透露出对于孩子的喜爱和对未来生活的期待。不论今后是否走进婚姻，她们认为自己的未来依然广阔。
11684,2023-02-19,刘耀文严浩翔演武林高手,导语：无限超越班中，刘耀文严浩翔演武林高手，太可爱了吧！
11685,2023-02-19,马云与43年前儿时好友相见,
11686,2023-02-19,陈宏友,
11687,2023-02-19,付辛博 爹系,
11688,2023-02-19,小夫妻飞奔救人后手挽手离开,导语：浙江杭州，沈银银和张雨婷碰到一小伙情绪低落地坐在桥栏上。他们协助民警救下小伙，还与警方一同劝说。
11690,2023-02-19,熊猫香香回国,导语：最近，在东京上野动物园正门前，每天都排着一支长长的队伍，他们都是前来和即将回到中国怀抱的大熊猫“香香”道别的日本民众。
11692,2023-02-19,德国小伙时隔三年回家父母的反应,导语：当德国小伙吴雨翔时隔3年再回到家中，父亲一脸不敢相信，母亲激动落泪，“你闻起来不一样了”。
11693,2023-02-19,何与 卢洋洋,
11694,2023-02-19,你闻起来有中国的味道了,导语：当德国小伙吴雨翔时隔3年再回到家中，父亲一脸不敢相信，母亲激动落泪，“你闻起来不一样了”。
11713,2023-02-19,张新成造型 男女老少,
11720,2023-02-19,讲座名师遭高中生抢话筒,
11723,2023-02-19,宁艺卓实力,
11727,2023-02-19,赵露思wetv2022最佳女主角,导语：赵露思wetv2022最佳女主角，恭喜！今天也是为《星汉灿烂·月升沧海》程少商疯狂上头的一天！
11732,2023-02-19,战歌级韩剧OST,导语：#阿乐星愿企划#之在你心里能被称为#战歌级韩剧ost#的是?
11733,2023-02-19,春雨里的中国美成了一幅画,导语：“好雨知时节，当春乃发生。”明日雨水，是二十四节气的第二个节气。春雨润万物，种下希望，不负春光。
11734,2023-02-19,上海中环一车失控翻下高架并起火,
11735,2023-02-19,刘培强中校 检测到您心率上升请保持理智,
11736,2023-02-19,渊种,
11737,2023-02-19,检出XBB.1.5意味着新一轮发烧开始吗,导语：有网友疑问，“新一波病毒又要来了吗？” 对此，北京佑安医院呼吸与感染性疾病科主任医师李侗曾2月18日接受采访时表示，我国现阶段免疫屏障比较强，近期不太可能暴发新一波疫情
11738,2023-02-19,萨顶顶客串搞笑女,导语：萨顶顶《星落凝成糖》客串搞笑女~真就唱一首OST换一个角色😏
11739,2023-02-19,上戏回应表演系高考须达一本线,导语：2月19日，澎湃新闻记者从上海戏剧学院获悉，“上戏明年表演系考生高考须达一本线”系误读，学校向记者表示，明年上海戏剧学院招生继续遵循教育部相关要求，表演等校考专业招生分数线不低于普通本科录取控制分数线，而非“一本线”。
11740,2023-02-19,T1战胜GEN,导语：T12-0战胜GEN，拿下首胜，恭喜
11741,2023-02-19,薛之谦衢州加场,
11756,2023-02-19,谁给张新成画的眉毛,导语：谁给张新成画的眉毛
11759,2023-02-19,江西3名民辅警查酒驾时被刺身亡,导语：2月19日，记者从萍乡市上栗县官方获悉：2月17日晚，上栗县交警大队在县城查酒驾时一名嫌疑人因无证驾驶、酒驾被查，嫌疑人持刀将2名民警1名辅警刺伤，3人经抢救无效牺牲。当地警方称，犯罪嫌疑人已抓获归案，案件正在进一步调查处理中。
11764,2023-02-19,LNG对战FPX,
11772,2023-02-19,男孩疑遭校园霸凌被迫跳舞,导语：2月18日，贵州贵阳。某中学一男孩疑似遭遇校园霸凌，被多人围起来后被迫在讲台上跳舞，并被拍下视频。
11776,2023-02-19,吴磊赵今麦牵手饭拍路透,导语：吴磊赵今麦《在暴雪时分》牵手饭拍路透，这两位，也太有氛围感了吧，期待见面中！
11779,2023-02-19,你是我最后一个女人,导语：《夏花》热播中，一句：你是我最后一个女人！被感动到了！[泪][泪]
11780,2023-02-19,乌梅子酱是什么神仙味道,导语：你浅浅的微笑就像乌梅子酱，乌梅子酱是什么神仙味道？美食博主在线告诉你～
11781,2023-02-19,宋亚轩我们的客栈跳舞预告,导语：宋亚轩我们的客栈跳舞预告！期待小宋老师的表现
11782,2023-02-19,4步教你快速辨认撞脸春花,导语：春天到来，桃花、樱花、梨花、李花、杏花......这些花你能分清吗？看颜色、看花叶、看枝干、看花蕊，#由远及近法认出组团出道春花#↓↓按图索骥，实用又方便，让你变身春日赏花达人！
11783,2023-02-19,黄奕第一次演姐弟恋,导语：黄奕出道以来第一次演姐弟恋，画面好甜！
11784,2023-02-19,杭师大,
11786,2023-02-19,沈月在节目里谈分手原因,导语：《#无限超越班#》@沈月 被问上一次分手原因，表示是过于平淡而分手。
11787,2023-02-19,科学家发现太空旅行会改变大脑,导语：近日，来自比利时和俄罗斯的联合研究团队进行了一项新研究发现，长期的太空生活会让大脑功能连接发生变化，有些变化是持久性的
11788,2023-02-19,曾小贤戏推赛巴斯,
11790,2023-02-19,于正说张楠得三月底进组,导语：于正说张楠得三月底进组，好期待美女 ~
11791,2023-02-19,马龙这球太帅了,
11808,2023-02-19,肖战雨水营业照,导语：肖战雨水春风送雨随拍
11816,2023-02-19,金泰妍音乐节全开麦舞台,导语：金泰妍音乐节全开麦舞台公开！好稳的开麦
11822,2023-02-19,郭晓婷的交友尺度,导语：惠英紅赞叹晓婷交友尺度拿捏的很好，咱就是说晓婷艺员可以出一下交友秘籍嘛[举手]
11826,2023-02-19,王智再晒网友手绘的韩朵朵漫画,导语：王智再晒网友手绘的韩朵朵漫画，Q版的韩朵朵都好可爱呀，韩朵朵真的是从电影走到了大家眼里。
11828,2023-02-19,侯明昊你内衬开了,导语：侯明昊一身古装造型，内衬却意外崩开，这谁能不盯着屏幕看呀！
11829,2023-02-19,WB对战WE,
11831,2023-02-19,杭州通报家联公寓燃气爆燃情况,导语：2月19日5时许，杭州市萧山区北干街道家联公寓某住户发生燃气爆燃事件，楼下空地发现一男子，经现场施救已无生命体征。目前，应急、公安等部门及有关专家正在现场处置，具体原因正在进一步调查中。
11832,2023-02-19,无限超越班 恋综,
11833,2023-02-19,丈夫否认网传产妇月子没过就跳河,导语：2月18日，河南周口，网传郸城县“一产妇连月子都没过就跳河，丈夫全程站在岸上比路人还冷漠”，引发网友讨论。
11834,2023-02-19,四川凉山制止528起10万以上彩礼,导语：近段时间，四川凉山、河北河间、甘肃定西等多地相继公布了高价彩礼问题治理的阶段性成效。
11835,2023-02-19,王鹤棣收工后的篮球vlog,导语：王鹤棣收工后的篮球vlog，今天是运动系河堤~
11836,2023-02-19,艺考 文化课成绩,
11845,2023-02-19,杭州一高层住宅爆炸,导语：2月19日，杭州一高层住宅发生爆炸，杂物散落一地。楼下商户称：有人直接摔下来。
11860,2023-02-19,刘国梁为电影中国乒乓加油,
11869,2023-02-19,浙师大,
