,Date,Title,Introduction
8647,2023-10-23,学校里的小狗 随地大小睡,
8648,2023-10-23,南澳震感,
8650,2023-10-23,傅首尔锐评二手杰作,
8651,2023-10-23,孩子碎玻璃卡喉交警一路狂飙送医,导语：近日，浙江台州，男孩被碎玻璃卡喉一度晕厥，一时没有救护车能送主城区，孩子父亲报警求助。接上求助的父子后，警车拉响警笛一路狂飙。遇到拥堵路段，交警咆哮喊话，让前方车辆让行，并联系相关路段交警配合。抵达医院后交警把父子俩送进急诊，经过救治目前孩子已无大碍。
8652,2023-10-23,aespa预告,导语：5月6日，aespa通过SNS官方账号公开了《Next Level》logo的视频和形象，正式进入回归倒计时，让粉丝们对这次新曲的期待感大增。
8655,2023-10-23,华浅仲夜阑彻底be了,导语：华浅仲夜阑彻底be了
8656,2023-10-23,厦门震感,导语：地震了！福建厦门、福州、泉州等多地网友震感强烈，你感觉到了吗？
8661,2023-10-23,薛之谦扔戒指,
8664,2023-10-23,我国计划实施近地小行星防御任务,导语：10月22日，中国探月工程总设计师吴伟仁院士介绍未来15年中国深空探测十大工程。我国在行星探测领域计划开展的工程包括首次实施近地小行星防御任务。
8668,2023-10-23,把鉴宝专家给整不会了,导语：盘点奇葩的宝物，把鉴宝专家给整懵了
8669,2023-10-23,24考研英语石雷鹏功能句,导语：快来看看这些功能句
8671,2023-10-23,苏醒刚圆梦就要醒了,导语：苏醒在《我们的歌》刚圆上的梦就马上要结束了吗
8672,2023-10-23,汤姆布雷迪伊莲娜分手,
8673,2023-10-23,aespa 迷你4辑,
8675,2023-10-23,于和伟还原吹蜡烛名场面,导语：于和伟现场还原tui吹蜡烛！！
8676,2023-10-23,张宁哭了,
8679,2023-10-23,繁城之下结局,
8681,2023-10-23,F1,
8683,2023-10-23,未知全貌 给予好评,
8684,2023-10-23,再见乐队的夏天,导语：再见夏天，夏天再见
8685,2023-10-23,原来这些玻璃制品是这样做出来的,
8687,2023-10-23,中国环月空间站和月球熔洞穴基地方案,
8688,2023-10-23,崔秀彬不是这真的TooMuch了,导语：崔秀彬不是这真的TooMuch了
8689,2023-10-23,蕾哈娜或将回归乐坛,导语：已信，莫辜负。
8690,2023-10-23,力丸说朝阳打歌中心都是好人,导语：在火锅局受到王敬轩和阿弗娄的照顾，鸽猜力丸内心一定在循环播放：人间有真情人间有真爱～
8692,2023-10-23,环球影城里最酷的闺蜜,导语：我仿佛看到我老了以后跟闺蜜一起的样子！
8694,2023-10-23,夫硕顺音乐之神先公开,导语：夫硕顺音乐之神先公开！
8697,2023-10-23,吃火锅有哪些保护肠胃的小技巧,导语：天气转凉，热腾腾的火锅愈发受到人们的喜爱。然而，由于火锅对人体的胃肠道刺激较大，容易对胃造成伤害，有些人吃了火锅后会出现恶心、呕吐、腹泻、腹痛及咽喉肿痛等不适症状，甚至引发胃肠道疾病。那么，吃火锅有哪些保护肠胃的小技巧呢？
8698,2023-10-23,女儿偷偷回家给爸爸送生日惊喜,导语：近日，江苏泰州，女儿悄悄从外地赶回家给父亲过生日，进门的一刻爸爸既惊喜又感动。
8700,2023-10-23,为有暗香来好超前的剧宣,
8705,2023-10-24,坚持党对工会的全面领导,导语：新华社北京10月23日电 中共中央总书记、国家主席、中央军委主席习近平23日下午在中南海同中华全国总工会新一届领导班子成员集体谈话并发表重要讲话。
8706,2023-10-24,王志刚被免去科学技术部部长职务,
8707,2023-10-24,李佳琦直播间称从未要求品牌二选一,导语：美ONE回应中新经纬称，1、李佳琦直播间和海氏品牌没有签订所谓的“底价协议” ；2、李佳琦直播间从未要求品牌进行任何的二选一；3、李佳琦直播间商品的定价权在于品牌。
8708,2023-10-24,神十七航天员已做好出征准备,导语：神舟十七号三名航天员已从身体、心理、技术上为飞行做好充分准备。
8709,2023-10-24,全国财政赤字将由38800亿元增加到48800亿元,导语：今年以来，我国多地遭遇暴雨、洪涝、台风等灾害，地方灾后恢复重建任务较重；近年来，各类极端自然灾害多发频发，对我国防灾减灾救灾能力提出了更高要求。
8710,2023-10-24,花知晓腮红,
8711,2023-10-24,我国将增发1万亿元国债,
8712,2023-10-24,周迅 把我跟拖垃圾袋一样拖上来,
8713,2023-10-24,高校食堂干锅虾28一份有61只虾,导语：高校食堂干锅虾28元一份，学生仔细数了每一个虾头有61只虾
8714,2023-10-24,白敬亭何泓姗二搭爷青回,导语：白敬亭何泓姗二搭了，梦回匆匆那年，方茴乔燃意难平还是意难平。
8715,2023-10-24,双十一 满减,
8716,2023-10-24,海氏电器实名举报京东,
8717,2023-10-24,李佳琦公司美ONE合同细则曝光,
8718,2023-10-24,李佳琦直播间时隔43天再次带货花西子,导语：10月24日，在此前的79元眉笔事件风波后，李佳琦直播间时隔43天再次直播带货花西子，不过李佳琦本人并未出镜现身为此次花西子产品讲解带货。
8719,2023-10-24,双十一 卫生巾,
8720,2023-10-24,我国艾滋病患者治疗成功率已超过90%,
8721,2023-10-24,陕西一交通局拖欠男子770万工程款,
8722,2023-10-24,不同身材女生穿同款裙子,
8723,2023-10-24,田耕纪的结局连主演都不知道,导语：曾舜晞田曦薇都不知道田耕纪最后结局是什么
8724,2023-10-24,五条悟回归暗示,
8725,2023-10-24,小鹏要造星舰了,
8726,2023-10-24,林心如年轻时的盛世容颜,导语：24岁的林心如和19岁的张柏芝同框也太养眼了
8727,2023-10-24,你还喝农夫山泉吗,导语：你还喝农夫山泉吗？
8728,2023-10-24,迪丽热巴微信名,
8729,2023-10-24,女子曝15万存款被农行私自改成购买,导语：近日，四川成都，一女子爆料，自己去当地一农行网点办理15万定期存款转存时，业务员偷偷将单子上的存款改为“购买”。她怀疑，自己的15万存款被购买了理财产品。
8730,2023-10-24,抢到丝塔芙了吗,导语：丝塔芙大白罐，24h锁水保湿，告别干燥、起皮、紧绷， 这罐润极了
8731,2023-10-24,国债,
8732,2023-10-24,Capper专辑,
8733,2023-10-24,千万别找射手座借钱,
8734,2023-10-24,沈诺给蔓儿的玩家通关信,
8735,2023-10-24,这种美发方式很致癌,导语：一项10年间追踪3.3万人（35-74岁的女性）的研究发表在《美国国家癌症研究所杂志》上，研究证实：使用化学直发剂与女性子宫癌风险升高有关；而且使用越频繁，风险升高得越明显。经常使用直发剂的参与者，患子宫癌的风险升高了155%。
8736,2023-10-24,陈牧驰近照,
8737,2023-10-24,李佳琦直播间的底价协议合理吗,
8738,2023-10-24,5.9元粉底液日销5万单暴涨100倍,导语：昨日一款售价仅5.9元的粉底液，引起网友广泛讨论，登上微博热搜。该产品日销从原先的大几百到一千左右，增至5万多单。商家解释称，该款产品之前卖15块8毛8，现有官方的秒杀补贴，对优质小商家的扶持，才卖到5块9。
8739,2023-10-24,52岁大叔自驾游中国说后悔没有30岁出发,
8740,2023-10-24,疯狂小杨哥回应电商挤压实体经济,导语：针对网上流传电商的兴起导致实体店铺倒闭，让实体经济陨落这一观点，10月23日，小杨哥在直播间回应称，实体不会陨落的。
8741,2023-10-24,王一博跟小动物PK热度,导语：王一博最新短片释出，冰天雪地中与小动物探讨如何过冬，pk热度画面萌趣十足！
8743,2023-10-24,突然学会自我介绍了,
8744,2023-10-24,蛋仔派对,"导语：咔咔~欢迎各位光临蛋仔岛！加入奇妙""圆""宇宙，共同创造欢乐~ (*╹▽╹*)"
8746,2023-10-24,0失误花苞头教程,
8747,2023-10-24,警方破获涉25亿特大跨境赌博案,导语：近日，成都市公安局天府新区分局刑侦支队民警张镭，被四川省公安厅记个人二等功1次。
8748,2023-10-24,名侦探柯南茱蒂声优去世,
8749,2023-10-24,莫文蔚台上演唱 巩俐台下打光,
8750,2023-10-24,花儿与少年空镜海报,
8751,2023-10-24,缅北诈骗窝点有老虎当看守,导语：近日，江西宜春。涉嫌偷越国（边）境罪的犯罪嫌疑人李某来到刑警大队投案，谈话中讲述自己被困缅北三年的真实经历。
8752,2023-10-24,邓超晒照说和鹿晗年龄相仿,导语：邓超晒照说和鹿晗年龄相仿
8753,2023-10-24,陕西清涧发现商代方国中心城址,导语：10月23日，在中国考古学大会上发布了多项重大考古成果。陕西清涧发现商代晚期方国中心城址，8座“甲”字形大墓，对研究“大商邑”与北方文化交融和政治地理结构有重大意义。
8754,2023-10-24,双十一iPhone价格全系比拼,导语：近日iPhone 15降价引发热议，随着各平台的双十一相继开启，媒体就iPhone怎么买进行了测评。
8755,2023-10-24,马立奥 妈妈回来就接你,导语：马里奥太可爱了
8756,2023-10-24,为自强不息顽强拼搏的他们加油,导语：19日上午，杭州第四届亚残运会火炬开始传递。杭州亚残运会火炬“桂冠”的灵感来自良渚玉琮和桂花，玉琮往下有几十条科技线，象征着绵延人类的历史和城市科技的脉络。
8757,2023-10-24,京东采销喊话李佳琦,
8758,2023-10-24,小鹏X9,
8759,2023-10-24,90后小伙用橘子打开抑郁症奶奶心扉,
8760,2023-10-24,为什么说今年双十一更便宜了,导语：近期，已经有不少网友开始为双11做攻略了。今晚8点，2023天猫双11预售正式开启。据悉，今年双11将更加便宜。你双11的预算是多少？
8762,2023-10-24,辱骂新加坡护士的女子涉谎报身份,导语：涉在医院辱骂护士和警员的中国籍女子星期二（10月24日）早上被加控，指她在申请工作准证时谎报自己受雇于一家公司当书记，但其实在本地各地点当陪酒女。
8763,2023-10-24,女孩五月天演唱会给去世爸爸点歌,导语：10月22日，成都，五月天演唱会上女孩点歌《约翰蓝侬》：“爸爸已经走出了时间，只要我还记得，他永远会活着”。
8765,2023-10-24,肖战笑颜分析,
8766,2023-10-24,粉丝评于适健身视频,
8767,2023-10-24,爷爷把我的泡泡玛特当锅盖,
8768,2023-10-24,王安宇微信名啥意思,导语：《花儿与少年》王安宇微信名啥意思呀哈哈！！
8769,2023-10-24,任嘉伦贺峻霖撞衫,导语：任嘉伦贺峻霖撞衫同款橘子毛衣，果然帅哥的审美都是一样的 ​
8770,2023-10-24,河边的错误 全是细节,
8771,2023-10-24,浙江男篮vs广东男篮,导语：10月24日新赛季CBA常规赛第二轮，浙江男篮vs广东男篮。
8772,2023-10-24,甘肃肃北5.5级地震,
8773,2023-10-24,今晚8点天猫双11双降了,
8774,2023-10-24,几条大狗凌晨在小区乱窜撕咬流浪猫,导语：10月23日，网曝几条大狗凌晨在天津汐岸国际小区内乱窜并撕咬流浪猫。
8775,2023-10-24,美妆券,
8776,2023-10-24,倪妮金鹤奖最佳女主角,导语：倪妮东京国际电影节中国电影周金鹤奖最佳女主角
8777,2023-10-24,官方通报无窗帘教室校长已被停职,导语：10月24日，山东聊城东昌府区教体局就教室未安装窗帘发布情况说明：涉事学校校长被停职，正调查教师是否被区别对待。
8778,2023-10-24,傅首尔因为愧疚无法下定决心离婚,导语：《再见爱人3》老刘对婚姻的牺牲让傅首尔感到愧疚，无法下定决心离婚
8779,2023-10-24,王一博方否认将演六姊妹,导语：王一博方否认将演《六姊妹》
8780,2023-10-24,关晓彤女扮男装造型,导语：《梅花红桃》关晓彤女扮男装造型
8781,2023-10-24,秦刚被免去国务委员职务,
8782,2023-10-24,嫦娥奔月的故事不再只是神话,
8783,2023-10-24,天猫双11直播间堪比跨年演唱会,导语：起猛了，还以为到了跨年演唱会！10月24日天猫双11直播间的明星阵容可谓是相当豪华非常炸裂，快看看你喜欢的明星有没有营业吧～
8784,2023-10-24,白桃星座 千万别找射手座借钱,
8785,2023-10-24,四狱警殴打犯人致死最高获刑6年,导语：2023年10月17日，甘肃省白银市景泰县法院就兰州监狱四名狱警虐待服刑人员一案作出一审判决，认定四人虐待监管人罪名成立，分别判处6年或4年有期徒刑。
8786,2023-10-24,重庆这地形再次验证背篼的必要性,导语：近日，重庆。因为母亲晕车，兄弟两个人轮流用背篼背着母亲，徒步去医院看病。
8787,2023-10-24,双十一直播间是会整活的,导语：10月24日晚8点，今年的天猫双十一正式开启预售，主打一件就降价。明星、主播齐聚直播间花式整活，拿出各路砍价本领，让网友直呼双十一直播好下饭。
8788,2023-10-24,北大团队识别血指纹破36年前命案,导语：36年前，浙江舟山发生一起特大抢劫杀人案，现场遗留的关键线索之一是一枚带血的指纹。
8789,2023-10-24,化妆化成了艺术,
8790,2023-10-24,为什么人喜欢把手插进米堆里,
8791,2023-10-24,沈梦辰想把这个妆焊死在脸上,导语：沈梦辰想把这个妆焊死在脸上
8792,2023-10-24,眉笔 消费降级,
8793,2023-10-24,海氏品牌方要求京东恢复正常价格,
8794,2023-10-24,钟睒睒又双叒叕成中国首富,导语：10月24日，2023胡润百富榜发布。今年是胡润研究院自1999年以来连续第25次发布“胡润百富榜”。1241位个人财富50亿元人民币以上的企业家登上今年胡润百富榜，比去年减少5%。农夫山泉的钟睒睒以4500亿元第三次成为中国首富。
8795,2023-10-24,张杰谢娜原来这么甜的吗,导语：张杰曾说过永远觉得谢娜无敌可爱，天猫这首超洗脑的《我会省》也被娜娜演绎的无敌可爱！今晚8点，坐等天猫双11预售开启！
8796,2023-10-24,中国妇女第十三次全国代表大会在京开幕,导语：中国妇女第十三次全国代表大会23日上午在人民大会堂开幕。习近平、李强、赵乐际、王沪宁、蔡奇、李希等党和国家领导人到会祝贺，丁薛祥代表党中央致词。
8797,2023-10-24,成功发射遥感三十九号卫星,导语：北京时间10月24日4时03分，我国在西昌卫星发射中心使用长征二号丁运载火箭，成功将遥感三十九号卫星发射升空，卫星顺利进入预定轨道，发射任务获得圆满成功。
8798,2023-10-24,新郎接亲遇秋收剥完玉米才让进门,导语：10月22日，山东烟台，一对新人结婚，新郎带着接亲团去新娘家接亲，到了家门口，新娘家拉来一车玉米放在门口，让前来接亲的新郎和伴郎们帮忙剥玉米，剥完玉米才能进门接新娘。
8799,2023-10-24,京东晚8点直播买货和老板谈,导语：京东晚8点直播买货和老板谈
8800,2023-10-24,今晚的购物车里都有啥,导语：今晚，双11大促开启，不少人都准备好激情下单“买买买”。你种草了哪些宝藏单品？购物车里都有啥？
8801,2023-10-24,早退通勤包,导语：文件袋爆改通勤包，又省了一笔钱
8802,2023-10-24,女子结婚要求前同事还礼400元,
8803,2023-10-24,崔胜澈 那就听欧巴给你唠叨吧,
8804,2023-10-24,京东直接买现货真香,导语：不用经历煎熬的等待和繁琐的套路，今年双十一的新物种现货人有多香？
8805,2023-10-24,原来大熊猫也有团建聚餐,导语：大熊猫摇摇晃晃组团“聚餐”，网友：它们还知道找自己的位置。
8806,2023-10-24,对普通人来说500元什么概念,导语：怎么样合理 该省省该花花…
8807,2023-10-24,网络贷款死灰复燃了吗,导语：近日，安徽地方金融监管局称两家网络小贷公司可按要求全国放贷引起热议，专家表示不符合规定。网贷环境会否放宽？事件进展待进一步跟进。
8808,2023-10-24,上海金山区非沪籍人才购房资格调整为个人,
8809,2023-10-24,美ONE回应京东采销喊话李佳琦,
8810,2023-10-24,张万森送给林北星一片星空,
8811,2023-10-24,警察哥哥收到仙女姐姐送的锦旗,导语：近日，一面印有“仙女姐姐赠警察小哥哥”的锦旗送到了卫坪派出所，原来是大意的小姐姐遭到电信诈骗，在南京警方协助下，民警帮其及时挽损。
8812,2023-10-24,有的人确实不适合做饭,导语：有的人真的不适合做饭
8813,2023-10-24,哈马斯释放两名以色列女性并赠送零食饮料,导语：两名被释放的以色列妇女为85岁的利夫希茨和79岁的库珀，哈马斯下属武装派别卡桑旅发言人阿布·乌拜达称，“出于人道主义和健康状况不佳的原因，我们决定释放她们”。
8814,2023-10-24,林心如参加首档综艺,导语：#林心如首综#
8816,2023-10-24,张婧仪晒新美甲,导语：张婧仪晒新美甲
8817,2023-10-24,未成年人网络保护条例公布,
8818,2023-10-24,56岁片警手机号成孤寡老人专线电话,导语：56岁片警手机号成孤寡老人专线电话，除了有求必应，他还下了班为老人包饺子，过节时和妻子去老人家做饭陪伴。
8819,2023-10-24,秦昊杨超越互评对方心眼子多,
8820,2023-10-24,找对象也要卷起来了,
8821,2023-10-24,薛之谦剧透官宣时间,导语：薛之谦剧透《火星情报局6》官宣时间
8822,2023-10-24,定妆喷雾是智商税吗,导语：喷一喷就能「定妆」的定妆喷雾，是智商税吗？
8823,2023-10-24,梅西中国行首站或改在海口,导语：据网上一份青岛海牛对主办方的回函显示，梅西今年第2次中国行的首场比赛有可能在海口五源河文体中心进行。 ​​​赛事主办方官微@迈迦SuperCup超大杯 上次更新还是在18号。 ​
8824,2023-10-24,方时赫朴振英 没有需求硬要供给,
8825,2023-10-24,男子捡10万现金原地等1小时后报警,导语：近日，上海。吴先生发现楼道角落有一个布袋，打开发现里面竟装着大量现金。吴先生在原地等待了近一个小时，但始终未见失主出现，便将钱交给社区民警，请居委会工作人员和民警帮忙寻找失主。
8826,2023-10-24,显脸小的法式刘海儿,
8827,2023-10-24,谁把辛芷蕾的共享单车骑走了,导语：《花少丝路季》先导片上线，辛芷蕾为省钱选择骑共享单车，结果忘记锁车帮别人支付了近十公里的费用，谁把三姐共享单车骑走啦！
8828,2023-10-24,独自出门失踪3岁女童已找到,导语：10月24日，河南濮阳，@都市报道 记者从女童家属处了解到，目前女童已经找到。
8829,2023-10-24,迪丽热巴快把自己跑yue了,导语：迪丽热巴快把自己跑yue了
8830,2023-10-24,于适看一下你的狗好了,
8831,2023-10-24,樱井敦司去世,
8832,2023-10-24,居民医保一年减少2500万人,
8833,2023-10-24,爱国主义教育法表决通过自明年元旦起施行,导语：十四届全国人大常委会第六次会议10月24日表决通过《中华人民共和国爱国主义教育法》，自2024年1月1日起施行。这部旨在加强爱国主义教育、传承和弘扬爱国主义精神的法律，共5章40条，包括总则、职责任务、实施措施、支持保障、附则。
8834,2023-10-24,花西子,
8835,2023-10-24,吃药不良习惯 食道损伤,导语：吃药有讲究，干吞药物容易引起食道炎。
8836,2023-10-24,张踩铃 当我生了一个两岁半的老干部,
8837,2023-10-24,孙卓被拐案抗诉申请被驳回,导语：​​​记者从深圳前海蛇口自贸区人民检察院了解到，孙卓被拐案抗诉被驳回。
8838,2023-10-24,花少5回归全自助出国游,导语：《花儿与少年·丝路季》回归全自助出国游！所有吃住行皆由花少团自己安排～期待值拉满了！
8839,2023-10-24,关晓彤国风百花妆,
8840,2023-10-24,王者周年庆节目单,
8841,2023-10-24,你常买的粉底液多少钱,导语：近日，有博主发布视频测评5.9元一瓶的粉底液，你常买的粉底液多少钱？
8842,2023-10-24,谢娜杨紫新综艺,导语：谢娜杨紫新综艺《我们的美好生活》
8843,2023-10-24,王毅将访问美国,导语：应美国国务卿布林肯邀请，中共中央政治局委员、外交部长王毅将于10月26日至28日访问美国。 ​​​
8844,2023-10-24,许佳琪出现呼吸困难症状,
8845,2023-10-24,张小斐分享自己经历鼓励大学生,导语：张小斐在《拯救嫌疑人》路演分享自己经历，她说自己的经验是抓住每一个小小的机会去努力，未来就会明了，也希望量变到质变是真实存在的
8846,2023-10-24,板栗焖饭,
8847,2023-10-24,可以买贵的不能买贵了,
8848,2023-10-24,3人失联民警大雪中徒步10公里搜救,
8849,2023-10-24,父亲要求月入6000元女儿付4500元赡养费,
8850,2023-10-24,甜筒壳收纳化妆刷,
8851,2023-10-24,让CBA全场安静的男人,导语：《看不见的顶峰》给张洪不畏艰难、勇于攀登的精神狠狠点赞了。
8852,2023-10-24,日本科学家称人类精子打败了牛顿,
8853,2023-10-24,π是无限不循环小数的可视化,
8854,2023-10-24,官方回应女子举报嫂子出轨生子,导语：官方回应女子举报嫂子出轨生子。
8855,2023-10-24,男子突然休克警民40秒暖心救助,导语：近日，南京地铁双龙大道站，一名男子突发癫痫并陷入休克。当站值班站长吴璠立即赶到，跪地开展心肺复苏。同时，一名热心小伙也迅速“跨栏”，跳过闸机赶来帮忙。经40秒紧急抢救，男子恢复了意识。后经民警回访得知，男子有癫痫病史，目前已无大碍。
8856,2023-10-24,欧阳娜娜白开水妆,导语：欧阳娜娜白开水妆
8857,2023-10-24,印尼封禁TikTok电商是一个错误,导语：据半岛电视台报道，印尼宣布禁止社交平台作为商品交易平台近一个月后，雅加达的丹纳阿邦市场并没有出现人流如潮的繁荣景象。相反地，与之前相比，这里的客流量少了一半
8858,2023-10-24,潘玮柏提醒粉丝不要真的不回家,导语：潘玮柏全新单曲《今夜不回家》正式上线！发微博贴心提醒粉丝：不要真的不回家哦
8859,2023-10-24,六姊妹主演阵容,
8860,2023-10-24,我要逆风去 定档,
8861,2023-10-24,吉林一小区爆炸致1死16伤,
8862,2023-10-24,数码宝贝第二部主题曲公开,
8863,2023-10-24,水晶葡萄妆,
8864,2023-10-24,美籍男子抵达香港时行李搜出手枪,导语：港媒：一美国男子抵达香港时行李中搜出手枪，自称是华盛顿州参议员
8865,2023-10-24,帕梅拉新浪扫楼,
8866,2023-10-24,零成本自制化妆刷清洗工具,
8867,2023-10-24,好事成双非会员收官,导语：《好事成双》今日非会员收官！
8868,2023-10-24,杨舒予再发文拒绝粉丝接机,导语：10月23日，女篮球员@杨舒予YSY 发文拒绝粉丝接机、拒绝粉丝蹲守未公开训练行程并索要签名，称这样非法获取自己个人信息和行程的事情，让自己感觉很恐怖。
8869,2023-10-24,蔡文静扮装成安娜去迪士尼,
8870,2023-10-24,韩女妆,
8871,2023-10-24,美国一机组人员试图在飞行途中关闭发动机,导语：当地时间22日，一名隶属于美国阿拉斯加航空的机组人员因涉嫌试图在飞行途中关闭发动机，而被控83项谋杀未遂罪，83项鲁莽危害罪和危害飞行罪。
8872,2023-10-24,深秋的第一只口红,
8873,2023-10-24,熊猫妈妈剥竹子没有崽崽吃得快,导语：面对两只专业夺竹子的小熊，熊妈妈表示：剥不赢，根本就剥不赢。
8874,2023-10-24,用银杏叶做一只蝴蝶,导语：抓住秋天的尾巴，用银杏叶做一只美丽的蝴蝶吧，简单易学，捡几片银杏叶试试吧~
8875,2023-10-24,男子看黄网一夜转账26次被骗450万,导语：近日，杭州男子小王（化名）深夜被美女照片诱惑，打开一个黄色网站。激活专员称，想看片就先注册VIP，并做一下任务。
8876,2023-10-24,广州草莓音乐节阵容,
8877,2023-10-24,可恶我买的联名口红就是重新喷漆,导语：#可恶我买的联名口红就是重新喷漆#
8878,2023-10-24,徐老师镜头下的杨紫,导语：徐老师拍的杨紫来了
8879,2023-10-24,外媒炒作中国6艘舰艇同时现身中东,导语：“解放军海军的6艘战舰同时出现在中东地区以应对巴以冲突”的消息近日引发外媒关注。对此，中国驻美国大使馆发言人刘鹏宇22日要求有关方面应尊重事实，停止无端炒作。
8880,2023-10-24,向全球顶级富豪征税2%或可创收2500亿美元,
8881,2023-10-24,男孩公交上晕倒全车暖心守护,导语：近日，广州一男孩突然在公交车上晕倒、抽搐。随后，一车司乘加入了疾速救援行动中。
8882,2023-10-24,平价黄黑皮本命口红,
8883,2023-10-24,为有暗香来 丫鬟妆造,
8884,2023-10-24,张艺兴演唱会,
8886,2023-10-24,科大讯飞,导语：科大讯飞
8887,2023-10-24,发型也是穿搭的一环,导语：发型也是穿搭的一环啦！
8888,2023-10-24,恋与王室 皇女的诱惑,
8889,2023-10-24,秦岚电音朵拉,导语：《花少丝路季》今日开播，秦岚嗓音自带电音太可爱啦
8890,2023-10-24,开机广告消失后电视或将涨价,
8891,2023-10-24,金世佳毛晓彤吻戏,导语：啊啊啊啊我发出尖锐的爆鸣！！！
8892,2023-10-24,为有暗香来女二,
8893,2023-10-24,ENHYPEN亚洲巡演官宣,
