,Date,Title,Introduction
16677,2023-02-16,连下半月雨后学校现壮观晒被场面,导语：2月15日，江西上饶，一学校宿舍楼前晒满被子，十分壮观。
16682,2023-02-16,19岁女孩离世捐器官救了5人,导语：近日，广东梅州，19岁的女大学生李文静突发意外，不幸离世。父母忍痛决定捐献她的器官，为5名患者带去光明和希望。
16683,2023-02-16,今起可提前预约个税办税,导语：2022年度个税汇算将于3月1日起开始，2月16日起可以提前预约办税。
16684,2023-02-16,贺峻霖晒自己做的菜,导语：贺峻霖晒自己做的菜
16685,2023-02-16,浙江一男生获3次保送清北的机会,导语：温州中学的刘谨畅，去年参加了数学、信息学两门学科竞赛，而且都入围国家集训队。2021年12月，还在念高一的刘谨畅就曾以全国第9名的成绩，入选过数学国家集训队。也就是说，刘同学已经先后入围过3次国家集训队，相当于拿到了3次保送清北的机会。
16687,2023-02-16,时代少年团二次元cos路透,
16688,2023-02-16,德布劳内躲水瓶,导语：#阿森纳1比3曼城# 面对看台上球迷丢下的水瓶，丁老师小头一低淡然躲过。
16689,2023-02-16,护心,导语：由侯明昊、周也主演的青春仙侠剧《护心》正在热播！
16690,2023-02-16,在芝加哥中国公民加强安全防范,导语：当地时间2月13日晚，美国密歇根州立大学发生严重枪击事件，造成3人遇难、5人受伤，其中有两名中国留学生不幸中枪受伤。
16696,2023-02-16,以为主人被欺负的小狗,
16699,2023-02-16,多特蒙德1比0切尔西,导语：欧冠1/8决赛首回合多特蒙德vs切尔西，阿德耶米一条龙破门，切尔西苦攻无果！最终多特蒙德主场1比0战胜切尔西！
16725,2023-02-16,阿森纳vs曼城,
16728,2023-02-16,应急部门回应河南多地有巨响,导语：河南漯河、许昌等多地居民听到了巨响。漯河和许昌当地应急部门表示，当地并未发生爆炸和自然灾害。
16740,2023-02-16,张芷溪新剧演杨超越妈妈,导语：张芷溪在电视剧重紫里饰演杨超越的妈妈水姬
16745,2023-02-16,于正写诗回应虐猫造谣者被判刑,
16759,2023-02-16,卜尔Q,
16924,2023-02-16,三体拍出了北京的科幻感,导语：《阿乐云游手册》年初高质量好剧必有《三体》，抠书式还原，拍出了北京的科幻感！
17007,2023-02-25,8旬奶奶将孩子手机号文在手背防走失,导语：近日，浙江衢州。家人领八旬痴呆症老人，文孩子手机号防走丢。
17031,2023-02-25,贺峻霖做辣炒花甲视频,
17035,2023-02-25,夫胜宽崔秀彬直播,导语：甜甜冰冰一起直播啦！
17036,2023-02-25,黑与白,
17039,2023-02-25,WB射手,
17040,2023-02-25,郑秀妍花朵裙,导语：郑秀妍花朵裙造型，好美[打call][打call][打call]
17042,2023-02-25,川籍华人飞3000公里看丫丫哭了,导语：近日，一位川籍华人去看望丫丫，泪洒动物园，拍摄者表示，感觉丫丫的情况很不好，我们感觉很无助。
17045,2023-02-25,人们为啥都不爱买车了,
17046,2023-02-25,日本网友2020年已发起拯救丫丫的请愿,
17049,2023-02-25,袁一琦无袖舞台,导语：SNH48袁一琦火柴梗直拍 无袖造型太帅了！！
17050,2023-02-25,丫丫 乞食,
17051,2023-02-25,光渊到底更不更,
17052,2023-02-25,TT 可惜,
17053,2023-02-25,刘些宁宫廷风造型,导语：刘些宁宫廷风造型亮眼，她表示未来规划会更专注在拍戏上面，也会给大家带来一些舞台。
17055,2023-02-25,LGD战胜WB,
17057,2023-02-25,我们的日子会员大结局,导语：电视剧《我们的日子》会员大结局！
17058,2023-02-25,EDG 打麻将,
17059,2023-02-25,JDG对战TES,导语：2023LPL春季赛2月25日，JDG对战TES，无畏竞巅峰！
17060,2023-02-25,金黄油菜花海与蓝天配色好搭,导语：近日，云南晋宁沙堤600亩的油菜花迎来盛花期。菜花灿烂蝴蝶蹁跹，金黄的花海每天迎客千余人。清澈的蓝天白云下，古朴的绿皮小火车停靠在滇池畔，文艺清新。
17061,2023-02-25,郑成华回应未按时缴纳税务罚款传闻,导语：郑成华回应未按时缴纳税务罚款传闻
17062,2023-02-25,LGD 旋转,
17064,2023-02-25,RNG对战TT,
17065,2023-02-25,饭店保洁捡2万元报警寻失主被开除,导语：近日，辽宁大连，原紫航海鲜大饭店保洁员宋大姐称，1月28日，她在工作中捡到2万现金，现场寻失主无果便交给前台。几日后，自己得知仍无人认领救报了警。随后饭店店长给宋大姐所属的第三方公司领导打电话。公司领导得知其为寻失主选择报警后，决定将其开除。
17066,2023-02-25,餐厅接网吧10个订单收到9个差评,导语：2月19日，山东济南。餐饮店刘先生称，自己近日接连收到9个外卖差评，订单虽不是同一手机号，但送餐地址显示来自同一家网吧。2月25日，刘先生表示该网吧共有10个订单，其中有9条差评，另外1条被平台拦截。
17067,2023-02-25,绝意太秀了,
17068,2023-02-25,GISELLE演唱会solo舞台,导语：GISELLE演唱会带来solo舞台《2HOT4U》​
17069,2023-02-25,王丽丽60分13篮板,导语：WCBA季后赛1/4决赛，@王丽丽no-23 47投23中，狂砍60分13篮板，但所在的新疆女篮最终以99-104不敌上海女篮，止步8强。 ​​​
17070,2023-02-25,胡烨韬造型,导语：胡烨韬的造型好好看啊！又辣又纯，是位漂亮帅哥!
17071,2023-02-25,绝意马可波罗太绝了,导语：WB对战LGD，绝意的马可波罗秀翻全场，斩获MVP！
17072,2023-02-25,RNG 暂停,
17073,2023-02-25,钟欣潼米兰看秀红裙造型,
17074,2023-02-25,不如回溯到S8,
17075,2023-02-25,诟病,
17078,2023-02-25,肖战探店,
17079,2023-02-25,EDG战胜UP,导语：2023LPL夏季赛中EDG 2-1击败UP，恭喜EDG！
17081,2023-02-25,谭仔米线,
17082,2023-02-25,众星为李一桐新剧打call,导语：众星为李一桐新剧九霄寒夜暖打call
17083,2023-02-25,aespa演唱会,
17084,2023-02-25,这个班没他就散了,导语：幼儿园里的防拐达人
17085,2023-02-25,WB对战LGD,导语：17:00 北京WB vs 杭州LGD大鹅（第三组，上海）
17086,2023-02-25,得了甲流该如何用药,
17087,2023-02-25,刘雨昕微博直播,导语：刘雨昕微博直播
17088,2023-02-25,王昱珩说赚钱这事是最简单的,导语：王昱珩做客展开说说，然后聊到了工作和赚钱，水哥觉得赚钱这件事最简单，呜呜呜有被凡尔赛到！
17089,2023-02-25,五哈3观后感,导语：看完五哈，来分享你的观后感吧！
17090,2023-02-25,男子地摊套娃娃发现内藏摄像头,导语：2月24日，福建厦门，有网友发布视频称，其在一大学城套的娃娃中发现内藏摄像头。视频显示，被撕开的玩具熊鼻子处有一方形黑色摄像头。
17091,2023-02-25,苹果或在4月推出15.5寸MacBookAir,导语：屏幕供应链咨询公司 DSCC 首席执行官罗斯・杨（Ross Young）在本月初曾透露，苹果有望在今年 4 月推出 15 英寸的 MacBook Air。国外科技媒体 MacRumors 在最新文章中，汇总了关于这款新 MacBook Air 的 5 大新功能 / 新特性。
17092,2023-02-25,考公为什么会越来越卷,导语：2020年新冠疫情带来不确定性、国内外形势变化、宏观经济增速放缓有关，多种因素加大了规模不断增长的应届生的就业压力，社会大众开始重新认识到有一份稳定“编制”的价值。
17093,2023-02-25,林娜琏烤瓷牙,导语：林娜琏烤瓷牙
17094,2023-02-25,丁禹兮回应被扎针花絮,导语：丁禹兮回应与赵露思拍摄《传闻中的陈芊芊》被扎针
17096,2023-02-25,商丘公交司机称工资已全部发下,导语：2月23日，河南商丘公交公众号发布通告，称拟于3月1日起暂停运营商丘市市区公交线路。随后该公司发布第二条公告，称不会停运并表示道歉。25日下午3时许，一位公交车司机告诉记者，“工资已发，全给发了。”之前几个月未发的工资已经全部发了下来。
17097,2023-02-25,泽连斯基强忍泪水诉苦,导语：2月24日，俄乌战事一周年新闻发布会上，乌克兰总统泽连斯基在谈到家人时强忍泪水。
17098,2023-02-25,高叶真空西装,
17099,2023-02-25,任素汐对自己太狠了,导语：电影「荒原」中任素汐“毁容”式出演，全程戈壁实拍对自己太狠了！三十岁出头的丛林（任素汐 饰）如何也想不到，与哥哥丛来（李晨 饰）的又一次戈壁“寻人之旅”，会被一场沙暴推向生命绝境。哥哥身负重伤，丛林必须独自前行，为两条生命寻找一线生机。
17100,2023-02-25,苹果回应偷看密码后再偷iPhone,导语：《华尔街日报》近日报道称不少窃贼在盗取iPhone之前，都会先偷偷窃取受害者的iPhone解锁密码。对此苹果回应称，安全研究人员一致认可iPhone是最安全的消费类移动设备，并表示无论攻击手段多么罕见也会高度重视。
17101,2023-02-25,周杰伦演唱会附近酒店涨价三倍,导语：演唱会现场附近某酒店将6月30日的价格从平时最低195元提升至833元，溢价约327%，且只有一种房型可选。
17102,2023-02-25,考公路上的那些酸甜苦辣,导语：无论如何，祝福所有考生，你们为了选择而努力就一定可以成功，预祝所有考生成功上岸
17103,2023-02-25,蔡依林黑色漏腰西装造型,导语：蔡依林黑色漏腰西装造型🈶，好酷好帅！
17104,2023-02-25,婚纱日常化,导语：本季米兰时装周，“婚纱日常化”已经成为新的潮流趋势。
17105,2023-02-25,彭冠英王楚然现场还原名场面,导语：《听说你喜欢我》彭冠英王楚然线下合体，恋爱告白直播真的有把我甜到！！
17106,2023-02-25,乌总统称目前没有与普京谈判可能,导语：24日，乌克兰总统泽连斯基在基辅举行新闻发布会。他表示，现在没有与俄罗斯总统普京进行谈判的可能性。
17107,2023-02-25,搜狐时尚盛典,
17108,2023-02-25,SNH48年度金曲大赏,
17109,2023-02-25,海外出生的大熊猫仍属于中国所有,
17110,2023-02-25,这颗子弹在老人右肩藏了74年,导语：近日，浙江平湖。96岁老人去医院检查身体，右肩竟藏了颗74年前的子弹。
17111,2023-02-25,听说你喜欢我恋爱告白会,
17112,2023-02-25,秒睡可能是种睡眠障碍,导语：“秒睡”是一种什么样的体验？一沾枕头就着，坐着也能打盹；上一秒还在说话，下一秒鼾声就起来了……这种令人羡慕的睡眠能力，其实也是睡眠障碍的一种体现。
17113,2023-02-25,宋茜路演,
17114,2023-02-25,蔡徐坤线上演唱会邀请视频,导语：@蔡徐坤 发出诚挚的邀请：“Welcome to the show！”02月26日周日晚八点，一起来完成我们的约定[心]
17115,2023-02-25,威少失误把湖人球迷看PTSD了,导语：湖人自媒体@LakeShowYo ：我的PTSD发作了[允悲]
17116,2023-02-25,搜狐时尚盛典红毯,导语：22日，搜狐时尚盛典举行，你更喜欢谁的红毯造型呢？
17118,2023-02-25,张远现身石家庄,导语：#张远线下人气##张远现身石家庄#张远现身石家庄参加活动，远哥线下人气好高啊！！！
17119,2023-02-25,柳真跳Hypeboy,导语：柳真翻跳Hypeboy
17120,2023-02-25,清明假期不调休,导语：今年清明节放假安排 4月5日放假共1天，不调休。到劳动节会有一个小长假能够连休5天！想出行的小伙伴们可以提前计划起来了。
17122,2023-02-25,张嘉倪露背私服好辣,
17123,2023-02-25,文俊辉直播,导语：文俊辉微博直播进行时～
17124,2023-02-25,魏大勋跳舞动作,导语：魏大勋跳舞动作好好笑，确定不是在演我跳舞吗
17125,2023-02-25,刘畊宏谈小泡芙扎针,导语：小泡芙真的很勇敢，扎针的事情，因为勇敢不是不害怕，是害怕还敢去做才是真正的勇敢
17126,2023-02-25,赵一博算数,
17127,2023-02-25,彭冠英看到王楚然撒娇的反应,导语：彭冠英王楚然新剧花絮送达，谦筝万确超好磕的～
17128,2023-02-25,岳云鹏追猪,导语：《极限挑战》岳云鹏追猪，岳云鹏说上次这么拼命跑还是在追燕子~
17129,2023-02-25,香港名媛遭谋杀警方已拘捕3人,导语：据港媒报道，香港大埔发生碎尸案，死者为香港名媛蔡天凤，警方已拘捕其前夫的父母及兄长3人，目前前夫仍然在逃。
17130,2023-02-25,蔡天凤前夫落网,导语：据香港01报道，香港名媛蔡天凤前夫25日下午已经落网。24日香港大埔龙尾村发现一宗碎尸案，死者是失踪多日的28岁女模特、名媛蔡天凤。
17131,2023-02-25,郑恺的家庭vlog,导语：郑恺的家庭vlog，郑恺说答应ANA的大熊猫来了
17132,2023-02-25,赵樱子周柯宇倩女幽魂海报,导语：赵樱子周柯宇倩女幽魂海报~
17133,2023-02-25,杨蓉也买不到完美的光腿神器,导语：拿着显微镜看大侦探的收获就是：杨蓉的光腿神器蹲下也会有褶皱，所以大家不用再纠结了，因为根本不存在完美的光腿神器
17134,2023-02-25,乌梅子酱 口水歌,
17135,2023-02-25,广东省考 难,
17136,2023-02-25,沈月何与吻戏,导语：无限超越班芭莎大片里沈月何与吻戏镜头氛围感好绝
17137,2023-02-25,福宝,
17138,2023-02-25,快船国王合砍351分,导语：国王176-175险胜快船 ​​，合砍351分是NBA历史第二的总得分。 ​
17139,2023-02-25,山东省考,
17140,2023-02-25,你认为存多少钱能有安全感,导语：央行近日披露的统计数据显示，今年1月全国人民币存款增加6.87万亿元，同比多增3.05万亿元。其中，住户存款增加6.2万亿元，创历史同期新高，同比多增7900亿元。一时间，居民超额储蓄使“报复性存款”成为热词。
17141,2023-02-25,女子与前夫摆拍家暴视频被拘10日,导语：2月25日，安徽阜阳。经查，23日，女子谭某为博取同情吸粉引流，与其前夫摆拍家暴视频，并在直播时谎称报警，误导公众。25日，谭某因违反治安管理处罚法第二十五条第一项，散布谣言，扰乱公共秩序，被依法行政拘留十日。
17142,2023-02-25,涉猥亵女干部的县长辞去人大代表,导语：安远县选出的李秋平辞去了赣州市第六届人民代表大会代表职务。
17144,2023-02-25,小猫咪手贱扒拉壁虎下一秒惊呆了,导语：近日，江西一位网友上传了一段有趣视频。视频中，一只小猫咪玩耍时发现墙上有一只壁虎，好奇地凑过去用爪子不停扒拉。没想到壁虎也是个狠人，不跑不动，直接来了个断尾求生~把小猫咪一下子整懵圈了！
17145,2023-02-25,国家医保局答记者问,导语：针对此次改革中社会普遍关心的问题，国家医疗保障局有关司负责人回答了记者提问。
17146,2023-02-25,李嘉琦晒与陈瑜周末合照,导语：哇！跟🐟宝见面了诶！！小辣最近看起来很开心啊[抱一抱]
17147,2023-02-25,巴奴火锅创始人再回应天价土豆,导语：近日，陕西西安。巴奴毛肚火锅店内18元一份的土豆片仅5薄片引发热议。2月24日晚，巴奴创始人杜中兵再回应，巴奴卖的“富硒土豆”，它不仅包含了产品本身的价值，它也包含了环境价值，服务价值，以及全供应链的价值，所以巴奴暂时不考虑降价，并持续为顾客创造有价值的产品。
17148,2023-02-25,蔡天凤与前夫家有巨额金钱纠纷,导语：香港警方称，蔡天凤与其前夫一家有巨额金钱纠纷。有人不满意受害人处理财产方式，因而引发纠纷继而动杀机。
17149,2023-02-25,iPhone15Pro将配备LiDAR传感器,导语：iPhone 15 Pro 两款机型在配备改进后的 LiDAR 传感器之后，可以进一步改善夜间模式、自动对焦等拍摄性能，并且可以进一步增强 AR 体验。
17150,2023-02-25,李一桐双麻花辫,导语：李一桐双麻花鞭造型真的好可爱，减龄活力满满
17151,2023-02-25,宋威龙工作室声明,导语：宋威龙工作室对网传“疑似宋威龙女友”相关话题发布声明回应称：“网传信息内容纯属虚假。”
17152,2023-02-25,网友偶遇鹿晗合照,导语：网友上海酒吧偶遇鹿晗，鹿·男高中生·晗！
17153,2023-02-25,丫丫回国流程进行到哪一步了,导语：北京志愿者慧慧（化名）23日前往中国动物园协会，了解“丫丫”回国的相关情况。24日，慧慧告诉记者，中国动物园协会称专家已经去了（美国），并且这两天已在开展工作。
17154,2023-02-25,警方回应女子高铁站殴打威胁女童,
17155,2023-02-25,101岁老人每天赶2场麻将,导语：杭州101岁老人俞阿花，一天要赶两场麻将，身体硬朗、思路清晰、洗衣做饭样样能行。
17156,2023-02-25,seventeen将5月举办Fanmeeting,导语：seventeen将5月举办Fanmeeting，真的是好期待呀!!
17157,2023-02-25,吴磊赵露思片场骑马花絮,导语：吴磊赵露思片场骑马花絮
17158,2023-02-25,北上主演,导语：网传北上主演，一起来看看吧
17159,2023-02-25,丁程鑫侧身转场视频,导语：丁程鑫侧身转场视频，有点太酷了，帅气小哥哥营业！
17160,2023-02-25,国王快船双加时,导语：国王双加时战胜快船！
17161,2023-02-25,11名缉毒警和徒弟们合影不露脸,导语：合影现场，11名民警带着11位徒弟，侧身敬礼，不见正脸，第一排11名民警胸前挂满了勋章。
17162,2023-02-25,汤普森12记三分,导语：汤普森投进12记三分，砍下42分7篮板
17163,2023-02-25,明星时装周造型,导语：明星时装周造型合集，除了好看还是好看，你最喜欢谁的造型
17164,2023-02-25,蒙克45分,导语：蒙克狂砍45分，帮助国王双加时战胜快船
17165,2023-02-25,你好星期六全员晒工牌,导语：好六街春招会即将开始，全员晒工牌，分享入职宣言。更多精彩锁定今晚7:30《你好星期六》！
17166,2023-02-25,李荣浩的歌,
17167,2023-02-25,金泰亨把口罩当成护目镜,
17168,2023-02-25,姚晨综艺里砍柴,导语：没想到还能看到姚晨综艺里砍柴。身为团长的姚晨自领重任，大姚姐真的什么都会啊！
17169,2023-02-25,蔡徐坤又收到粉丝送的蓝玫瑰,
17170,2023-02-25,威少快船首秀,导语：威少在对阵国王的比赛中迎来快船生涯首秀！
17171,2023-02-25,吕珍九胖了好多,导语：吕珍九怎么了？ ​
17173,2023-02-25,月薪4万非洲养鸡岗位未招到人,导语：近日，山东青岛一家企业开出近4万月薪，招聘坦桑尼亚养鸡场场主的岗位信息引发热议。
17174,2023-02-25,国王绝平三分,导语：国王vs快船，蒙克迎着防守飚中续命三分硬生生将比赛拖入加时！
17175,2023-02-25,十四届全国人大代表全名单,导语：中华人民共和国第十四届全国人民代表大会代表名单公布。
17176,2023-02-25,行测,
17177,2023-02-25,诗情画奕,
17178,2023-02-25,想偷孙悦的衣柜,导语：孙悦的衣品也太好了吧！在线求姐姐出穿搭教程！
17179,2023-02-25,范世錡李一桐cp氛围感,导语：无限超越班今日发布范世錡李一桐复刻喜剧之王跳跃海报，两人之间的cp氛围感真的好好嗑
17180,2023-02-25,广西一艘船上3人窒息死亡,导语：2月21日10时30分，郁江边一艘长期停靠船坞的自家船舶，船主及其儿子进入密封船舱，因未通风，二人昏迷。
17181,2023-02-25,国王vs快船,导语：NBA常规赛，国王vs快船。
17182,2023-02-25,法考,
17183,2023-02-25,光渊更不更新,
17184,2023-02-25,被无人机播种效率惊呆了,导语：#种地吧#请来真飞行嘉宾——无人机帮助播种，种地工作瞬间变得高效又快捷～
17185,2023-02-25,iPhone15Plus渲染图曝光,导语：国外科技媒体 9to5Mac 在分享了 iPhone 15 和 iPhone 15 Pro 两款机型的高清渲染图之后，在最新文章中再次分享了 iPhone 15 Plus 的高清渲染图。
17186,2023-02-25,地铁跑酷,导语：地铁跑酷（Subway Surfers）是一款冒险类游戏，游戏的背景设定在地铁铁轨上，玩家要帮助Jake和伙伴躲避警察的追捕同时往来的地铁给游戏增加了挑战难度。游戏采用3D立体视角每天都会即时刷新三项任务供玩家去挑战。一起来晒晒你的分数吧~
17187,2023-02-25,李宇春 开云老板老板娘,
17188,2023-02-25,资料分析,
17189,2023-02-25,2040年参加高考人数或不到600万,导语：据数据推算，按照当前普职率和大学本科招录比，到2040年参加高考的人数或将降至不到600万。你觉得未来上大学会更容易吗？
17190,2023-02-25,肖战上意大利电视了,导语：肖战上意大利电视了
17191,2023-02-25,香港警方公布蔡天凤碎尸案细节,导语：香港警方公布蔡天凤碎尸案细节
17192,2023-02-25,行测常识,导语：更多行测常识备考干货关注这里~
17193,2023-02-25,香港名媛蔡天凤遭谋杀,导语：据多家港媒报道，香港名媛蔡天凤遭谋杀。
17194,2023-02-25,曝韩国男爱豆对女友施暴,导语：网友曝自己的朋友和某韩国男爱豆交往，期间遭受暴力
17195,2023-02-25,河南省考,
17196,2023-02-25,孟菲斯曾说丫丫毛发稀疏是家族遗传,
17197,2023-02-25,双北,
17198,2023-02-25,汶川地震幸存女孩戴义肢玩滑板,导语：四川女孩胡月被很多网友称为“闪光少女”。她曾在2008年汶川地震中失去了左腿，天生乐观和热爱运动的她努力地像正常人一样生活，还不断尝试自己喜爱的运动。如今的她，戴着义肢熟练玩滑板，脸上是自信的笑容。网友：我感受到生命的力量！
17199,2023-02-25,姐弟恋比例持续攀升,导语：多地结婚登记平均年龄超30岁，其中江苏常州结婚登记平均年龄为31.05岁，江苏扬州结婚登记平均年龄30.27岁，浙江杭州结婚登记男性平均年龄31.7岁、女性30岁。
17200,2023-02-25,刘耀文写给丁程鑫的信,导语：刘耀文写给丁程鑫的信~
17201,2023-02-25,下班跳舞为啥让人上头,导语：他们在音乐的节拍中尽情舞动，收获了快乐与自信；也通过跳舞，在陌生的城市找到了志同道合的朋友。
17202,2023-02-25,灌篮高手出场队员7号宫城良田,
17203,2023-02-25,习近平夫妇会见柬埔寨国王和太后,导语：2月24日，国家主席习近平和夫人彭丽媛在钓鱼台国宾馆养源斋亲切会见柬埔寨国王西哈莫尼和太后莫尼列。
17206,2023-02-25,蔡徐坤回国机场,导语：蔡徐坤回国机场
17207,2023-02-25,11个果冻242元价格离谱吗,导语：2月24日，黑龙江佳木斯。女子发视频称，和朋友去KTV唱歌，查看账单发现果冻每个售价22元，一小包11个花费242元。
17208,2023-02-25,扬科维奇规定体脂率超10%不能比赛,
17209,2023-02-25,孙悦说50岁开始的很有意义,导语：孙悦在时光音乐会舞台上给大家带来了很多精彩的表现。这次发文告别时光音乐会，一字一句都非常的真诚，她还说到50岁开始的很有意义。
17210,2023-02-25,吉林省考,
17211,2023-02-25,以爱为营 车内吻,
17212,2023-02-25,渊种的精神状态,导语：就问光渊更不更新，一键查询渊种的精神状态
17213,2023-02-25,考研找工作面试怎么准备,导语：一份面试攻略↓↓转发提醒准备面试的TA！ ​
17214,2023-02-25,浪漫手机,
17215,2023-02-25,水哥最强大脑5分钟答对15道题,
17218,2023-02-25,刘诗诗咖色风衣造型,导语：刘诗诗米兰时装周最新路透
17219,2023-02-25,多省份公务员扩招,导语：从招录增幅上看，甘肃省、云南省、广西壮族自治区、内蒙古自治区4地扩招超过50%，其中甘肃省扩招规模79.7%。具体来看，部分省份面向应届生扩大公务员的招录幅度。
17220,2023-02-25,森林进化论,
17221,2023-02-25,官方通报女子直播称被前夫家暴,
17223,2023-02-25,为什么火锅越来越贵,导语：近期巴奴火锅土豆18元只有5片的事件引发热议，近年来火锅的人均消费呈阶梯式的增长，火锅越来越贵，你多久没出去吃火锅了？
17224,2023-02-25,分辨大熊猫像在玩大家来找茬,导语：其实大熊猫和人一样，千熊千面。脸型、肩带、眼圈，还有一些不可名状的“气质”，都是它们自带的“认猫插件”。
17225,2023-02-25,红薯为何是优质碳水,导语：通过合理搭配，红薯可以成为健身减脂的优质食物。红薯营养丰富，而热量却只有同等分量的大米的三分之一，几乎不含脂肪和胆固醇，吃下去还有强烈的饱腹感。
17226,2023-02-25,你会选择单休的工作吗,导语：双休是最后的倔强
17227,2023-02-25,泰剧我的会长男友,
17228,2023-02-25,国内科幻名刊将拒收ChatGPT投稿,导语：美国科幻杂志《克拉克世界》在收到大量涉嫌暗中使用ChatGPT等AI创作的文章之后，于本周一宣布暂时停止短篇小说的投稿。据每日经济新闻报道，国内科幻杂志名刊《科幻世界》也将拒收AI投稿。
17230,2023-02-25,宋茜白衬衫自拍,
17232,2023-02-25,唐嫣描述数字71时的脑回路,导语：唐嫣在我们的客栈中描述数字71时说到白雪公主加7个小矮人
17233,2023-02-25,过敏性鼻炎还没有办法彻底治愈,导语：目前，过敏性鼻炎还没有办法彻底治愈，但可以通过提早干预减轻症状。
17234,2023-02-25,猫急得都快说人话了,
17235,2023-02-25,庞博像极了上课怕被点名的我,
