,Date,Title,Introduction
7045,2023-01-15,毛晓彤李一桐徐梦洁王楚然甜妹同台,
7056,2023-01-15,无名好听,
7057,2023-01-15,肖铎嘴破了,导语：家人们我看到了什么，肖铎嘴破了是我想的那个样子吗
7059,2023-01-15,杨紫小年四宫格随拍,导语：杨紫小年四宫格随拍，杨紫说小年快乐～迟到了一天的祝福！
7060,2023-01-15,RNG战胜OMG,导语：2023LPL春季赛RNG 战胜OMG，恭喜RNG
7062,2023-01-15,小怀 AG,
7063,2023-01-15,瓶子爆料挂牌细节,导语：1月15号晚19：00，关注瓶子KPL挂牌吃瓜大会！更多细节，敬请关注！
7064,2023-01-15,周雨彤染粉紫发,导语：周雨彤染粉紫发啦！快过年就是要捯饬头发！这个发色也太好看了吧！
7065,2023-01-15,王鹤棣抬头见喜原声台词,导语：王鹤棣抬头见喜原声
7067,2023-01-15,LPL,
7069,2023-01-15,被体重吓到的小猫,导语：被体重吓到的小猫也太可爱了，大家觉得小猫会在意自己的体重吗？
7070,2023-01-15,打7份工的70后大叔种桃成村CEO,导语：近日，贵州修文，47岁邓大海正在准备年夜饭，准备着三年来第一次大团聚。自种植猕猴桃以来，2022年是最让他开心的一年，这一年合作社的猕猴桃终于给国产品牌供货了。
7073,2023-01-15,AG 百兽,
7079,2023-01-15,60位台湾政商及文艺界名人资料疑遭外泄,
7085,2023-01-15,张艺兴逆应援给粉丝送奶茶,导语：张艺兴逆应援给粉丝送奶茶
7092,2023-01-15,李一桐精灵造型,导语：@李一桐Q #湖南卫视春晚# 造型释出，一身流苏飞飞袖连衣裙好像一个小精灵。
7093,2023-01-15,撒贝宁的鞋跟,
7095,2023-01-15,长生 AG,
7099,2023-01-15,DYG,
7102,2023-01-15,古装发带有多绝,导语：发带是古装中增添氛围感的法宝。飘逸的发带，优雅的仪态更是每一个古装美人的标配。谁是你心中的古装发带造型天花板，快来一起安利吧～
7103,2023-01-15,湖南卫视春晚节目单,导语：2023湖南卫视春晚节目单新鲜出炉！
7104,2023-01-15,许红豆说谢之遥你可真猛,导语：许红豆终于承认对谢之遥心动了！红豆遥遥冰太甜啦这碗我先干了！
7105,2023-01-15,OMG对战RNG,
7107,2023-01-15,王凯说顾南亭没有遗憾了,导语：顾南亭没有遗憾了，愿所有机长起落平安！
7108,2023-01-15,于和伟史强信念感,导语：电视剧版《三体》发布预告，史强@于和伟 信念感极强地不放过任何一丝线索，只为追查真相，但所有的线索似乎都指向同一个人[思考]？
7109,2023-01-15,狗子竟然被当成暖手宝,导语：震惊狗界一百年！一群刚打完雪仗的坏家伙，竟拿弱不禁风的我当暖手宝。
7113,2023-01-15,努力生活的人不会被生活亏待,导语：没有谁的生活真的容易 祝愿每个努力生活的人不会被生活辜负！
7116,2023-01-15,新娘结婚走红毯头顶被扣两盆麸子,导语：1月14日，山东临沂。一对新人结婚走红毯时，新娘头顶被直接扣两盆麸子。
7117,2023-01-15,全球首架C919国产大飞机首达青岛,导语：1月15日11:14，中国东航全球首架国产C919飞机，执行验证飞行航班MU7811，从上海虹桥国际机场飞抵青岛胶东国际机场，C919飞机100小时验证飞行再添新航点。
7118,2023-01-15,张大仙变身许愿池,
7129,2023-01-15,华晨宇粉丝线下合唱向阳而生,导语：华晨宇粉丝线下大合唱
7133,2023-01-15,毛晓彤湖南卫视春晚造型花絮,导语：毛晓彤湖南卫视春晚造型花絮~~
7138,2023-01-15,尼泊尔空难已造成至少45人死亡,
7139,2023-01-15,因为iKON才有中国有嘻哈,导语：中国有嘻哈制作人说因为iKON才决定做中国有嘻哈
7141,2023-01-15,杨迪家过年像极了我家,导语：杨迪家过年像极了我家，一家人总是闹出笑话真的太搞笑了，杨迪家庭氛围真不错～
7142,2023-01-15,TF家族四代最新营业照,导语：TF家族四代 官俊臣｜黄朔｜王浩｜张桂源｜张函瑞｜左奇函的营业照掉落，一起看看帅哥~
7143,2023-01-15,毕节3名幼童家门口玩耍时失踪,导语：1月14日下午3时许，贵州毕节三名幼童在家门口玩耍时失踪，家人、村民和民警对村子周边展开了彻夜搜寻。到15日早晨为止，尚未发现他们的踪迹。
7145,2023-01-15,KSG 今屿,
7147,2023-01-15,这是2只凤凰在打架吧,导语：近日，河南平顶山，摄影师拍到两只红腹锦鸡争斗的精彩画面。动静之间，剑拔弩张，刚柔并济。
7149,2023-01-15,黄海工作室致歉声明,
7151,2023-01-15,王楚然湖南春晚造型,导语：演员王楚然湖南卫视春晚造型曝光，一袭紫色流金短裙塑造浪漫，期待今晚的演出！
7152,2023-01-15,时代少年团波斯猫舞台彩排,导语：时代少年团《波斯猫》舞台彩排
7154,2023-01-15,王者兔限CG预告片,
7155,2023-01-15,红军吃有毒野草充饥眼睛全红,导语：老红军万曼琳哽咽回忆，长征路上最饿的时候，为充饥，老战士会嚼有毒的野草，却不忍心让她冒险……
7156,2023-01-15,独生女远嫁过年和老公决定各找各妈,导语：1月14日，湖南。一名90后女子远嫁后，与丈夫商量“各回各家各找各妈”。据了解，她和老公都是家里的独生子女，过年期间，纠结到底去男方家过年，还是去女方家过年？夫妻最终决定各回各家。
7157,2023-01-15,出生三年驾龄两年,导语：居然还有玩具拖拉机！三岁的小孩有两岁的驾龄
7158,2023-01-15,新华人寿原董事长万峰已经失联,
7159,2023-01-15,宋亚轩的笑从小到大都没变,导语：宋亚轩的笑从小到大都没变，心软软
7160,2023-01-15,KPL御三家接力合拍,导语：KPL帅哥们的接力合拍@AG一诺ovo @eStarPro花海 @陈正CatGod @狼队Fly @eStarPro坦然~
7161,2023-01-15,尼泊尔飞机坠毁找到30具遗体,导语：当地时间1月15日上午，尼泊尔雪人航空公司一架从加德满都飞往博克拉的客机突发坠机，机上或载有72人，目前已有至少30名遇难者遗体被找到，尚未确认有人生还。#尼泊尔坠毁飞机上含10名外国人# 搜救正在紧张进行中。 ​
7162,2023-01-15,多人因假冒王思聪行骗被判刑,导语：此前曾多人因假冒王思聪行骗被判刑。2017年2月11日王某将微信账号和昵称改成王思聪，行骗20160元。经审理王某犯诈骗罪，判处有期徒刑一年，缓刑一年六个月，并处罚金3万元。2021年10月，一男子因声音像王思聪，谎称要与一女网友处对象，骗取女网友3万元“彩礼费”，目前已被刑拘。
7163,2023-01-15,尼泊尔一客机坠毁机上载有68名乘客,
7164,2023-01-15,警察带走候车厅抽烟女子群众拍手称快,导语：1月14日，山西运城。一女子在候车厅抽烟，不顾劝阻，公然挑衅警察。乘客乞女士介绍，当天列车晚点大家都在等车，看到女子抽烟有人去制止，这名女子不但不改，反而变本加厉站在椅子上抽，警察实在无奈，将她强行带走。
7165,2023-01-15,阿尼亚是懂打亚索的,导语：小小安妮神似阿妮亚，风骚走位秀晕亚索，次男都归阿妮亚管！祝大家2023都有天胡开局～
7167,2023-01-15,这狗怎么欺负狗啊,导语：这狗小小年纪就会欺负别的狗，长大了怎么办啊
7168,2023-01-15,浙江队1比2山东泰山,导语：2022赛季中国足协杯决赛，浙江队1比2山东泰山！山东泰山完成足协杯三连冠！
7188,2023-01-15,张艺谋希望从春节档开始中国电影能有一个起飞,导语：张艺谋希望从春节档开始中国电影能有一个起飞！
7189,2023-01-15,NewJeans新歌OMG舞台ending,导语：NewJeans新歌OMG舞台ending，好可爱
7197,2023-01-15,三体电视剧今日开播,
7198,2023-01-15,陈奕迅演唱会尾场终极ENCORE,导语：陈奕迅香港演唱会27場在昨晚完美收官了[泪] 结束不是散场，我们内地见[爱你]
7199,2023-01-15,成毅说没有被家里催过婚,导语：工作室分享成毅采访小花絮，谈到催婚说家里是随缘派，没有被催过婚，一切顺其自然～
7200,2023-01-15,于和伟回复吕严来三体看大史,导语：于和伟回复吕严来《三体》看大史哈哈哈
7201,2023-01-15,尼泊尔就坠机事件召开紧急内阁会议,
7206,2023-01-15,盘锦一化工厂起火爆炸,导语：1月15日，辽宁盘锦盘山县一化工厂起火爆炸，事故现场浓烟冲天。
7207,2023-01-15,肖铎步音楼的爱都藏在细节里,导语：《浮图缘》你要说爱，就不能只说爱。肖步活了的爱都藏在细节里
7209,2023-01-15,足协杯,导语：2011中国足协杯开幕式将于今晚19:30在上海源深体育场举行，新浪网将对开幕式进行全程独家网络视频直播，以及微博互动直播、网民参与等方式进行全方位、多角度的互动式报道。据了解，足协杯开幕式将打造成一个球迷的嘉年华：“届时韦迪主任宣布赛事开幕，陈楚生、羽·泉等演艺界明星将现场献唱。”视频直播点击进入
7212,2023-01-15,豌豆尖在川渝的地位有多高,导语：只要你说吃豌豆尖，你川渝的朋友就允许你点鸳鸯锅了。
7214,2023-01-15,梓墨暖阳玫瑰挑染,导语：@北京WB暖阳@北京WB梓墨 《时尚COSMO》热血骑士大片上线啦！全新造型诠释电竞精神～
7215,2023-01-15,如何判断睡眠是否出现问题,导语：医生表示，睡眠不好的判断标准：躺在床上关灯后，如超过30分钟还睡不着，或为入睡困难。
7216,2023-01-15,刘诗诗何蓝逗同游迪士尼,导语：刘诗诗何蓝逗同游迪士尼 两人合作的电视剧《一念关山》刚杀青不久
7217,2023-01-15,八成大学生想生两娃,
7227,2023-01-15,黄仁俊,
7238,2023-01-15,时代少年团今晚唱有你的季节波斯猫,导语：时代少年团湖南卫视春晚唱《有你的季节》《波斯猫》 ​~
7240,2023-01-15,尼泊尔坠毁飞机上含10名外国人,导语：当地时间1月15日上午，尼泊尔雪人航空公司一架从加德满都飞往博克拉的客机突发坠机，机上或载有72人，目前已有至少30名遇难者遗体被找到，尚未确认有人生还。#尼泊尔坠毁飞机上含10名外国人# 搜救正在紧张进行中。 ​
7244,2023-01-15,看得出这猫咪真的很纠结,导语：这猫咪恨不得把自己分成两半，它真的好纠结啊
7245,2023-01-15,刘亦菲李现片场比谁更能吃酸,导语：刘亦菲李现新剧片场好欢乐，大家一起比谁更能吃酸，刘亦菲直接酸出痛苦面具了
7246,2023-01-15,郭晓婷男人装开年刊封面,导语：郭晓婷登《男人装》开年封面，半湿发清冷十足～
7247,2023-01-15,三体站内预约量破300万,导语：《三体》站内预约量破300万
7249,2023-01-15,许红豆自曝在家中地位最低,导语：真的没想到许红豆在家中地位最低，瞬间就有了共鸣了
7250,2023-01-15,女孩见男友父母被赠红手帕包10001元,导语：近日，安徽阜阳。女孩第一次被男朋友带回家见父母，收到一个系着红色蝴蝶结的布包，里面装着10001元。
7253,2023-01-15,多地多人围炉煮茶中毒,导语：在寒冷的冬日，“围炉煮茶”迅速成为时下的新晋“网红”，不过这炉暖茶香的温馨场景下其实也暗藏危险。
7255,2023-01-15,地铁的尽头原来长这样,导语：和蜘蛛侠2里的场景一模一样！
7256,2023-01-15,男子接诈骗电话试图拯救对方,
7257,2023-01-15,和许万森一起晒初雪,导语：和许万森一起晒2023年的初雪❄️
7259,2023-01-15,从今天开始不当讨好型人格,导语：今天开始对讨好型人格说NO！
7260,2023-01-15,当准女婿第一次去老丈人家,导语：近日，山东青岛。准女婿第一次去老丈人家，老丈人准备了准备了满桌的饭菜，并且下命令必须得吃完。
7261,2023-01-15,男子骑三轮拉16层水果称赔了算他的,导语：1月14日，河北保定。男子骑三轮在市场一车拉16层水果，称赔了算他的。拍摄者袁先生称：当时看着就觉得很吓人，不清楚总共装了多少箱，现在挣钱压力大，拉货的人都想多装点，自己很担心会发生危险，但劝阻无效也没有办法。
7262,2023-01-15,XBB可能缩短免疫保护期,导语：根据1月13日召开的国务院联防联控机制新闻发布会消息，从2022年12月1日到2023年1月12日，我国监测出1例本土奥密克戎变异株XBB病例。我国面临XBB及其亚分支持续输入的风险。
7263,2023-01-15,尼泊尔坠机现场已发现至少40具遗体,导语：当地时间15日上午，一架由尼泊尔首都加德满都飞往西部博克拉市的客机在降落前坠毁。机上共搭载72人，其中包括68名乘客和4名机组人员。
7273,2023-01-15,阿里嘎多美羊羊桑,导语：这是一种很新的阴阳语法：阿里嘎多_____桑。[doge]
7278,2023-01-15,七英俊 华九灯没有抄袭我的作品,
7291,2023-01-15,郑秀妍晒和姐姐们的合照,
7292,2023-01-15,王一博程耳湖南小年夜VCR,导语：程耳王一博湖南小年夜VCR，预祝大家新春大吉，万事如意！
7293,2023-01-15,张艺兴湖南卫视春晚彩排照,导语：张艺兴湖南卫视春晚彩排照，一身濯绛色，湘里寻面纱，期待艺兴今晚的演出！！
7296,2023-01-15,酒店回应保安深夜刷卡闯入女子房间,导语：1月15日，内蒙古呼和浩特。王女士称，她前些天入住全季酒店，半夜11点40左右，一保安大叔敲门称要送水果，她拒绝后对方刷卡闯入。据王女士提供录音，她后续联系酒店负责人时，对方已道歉。1月15日，该酒店另一名工作人员表示，王女士诉求为敲诈，希望她报警处理。
7298,2023-01-15,恋与制作人背头,
7301,2023-01-15,中国婆婆给俄罗斯儿媳买三金,导语：近日，黑龙江。男子第一次带俄罗斯媳妇回中国婆婆豪气送三金，女孩被感动到落泪。
7303,2023-01-15,2023北京将会这样变,导语：1月15日，北京市第十六届人民代表大会第一次会议开幕，北京市委副书记、代市长殷勇作《政府工作报告》。《报告》提到，2023年，北京将新增中小学学位2万个；GDP增长目标4.5%以上；筹建保障性租赁住房8万套，竣工各类保障性住房9万套等。2023年，北京这座城市将会这样变！
7304,2023-01-15,85岁老人被盗15只鸡2只鹅1条狗,导语：1月14日，山东菏泽。85岁老人养的15只鸡、2只鹅和一条狗一夜被盗。
7305,2023-01-15,足协杯决赛,导语：北京时间1月15日，足协杯决赛，山东泰山2比1战胜浙江队，完成足协杯三连冠！
7306,2023-01-15,中国足协免去刘奕足协秘书长职务,导语：1月15日，中国足球协会第十一届执委会第八次会议在苏州召开。会议决定，免去刘奕的中国足球协会秘书长职务。
7307,2023-01-15,许昕为三岁儿子自豪,导语：@许昕 发微博晒出儿子的照片，并配文：“三岁！我儿子！我自豪！”
7308,2023-01-15,女子凌晨回家12名亲人在路边等候,导语：1月14日，安徽淮南。张女士从上海回安徽老家过年，因堵车严重，到了凌晨1点多才赶回家，她也没有告诉家人，没想到汽车驶入村子时，发现自己的家人们全部在路边等候，包括公公婆婆叔叔婶婶姑姑等，大家都在自家门口默默等候。张女士称，当时她看到这么多家人没有休息，全在路边等她非常感动。
7309,2023-01-15,女儿过年不回家被妈妈千里投喂,导语：近日，上海一女生因为工作原因春节不能回家，妈妈便从小年开始给女儿投喂晚饭，让远在千里外的女儿感受到浓浓的过年氛围！
7310,2023-01-15,春节回家带上这9个健康锦囊,导语：平安过春节，送你9个“健康锦囊”↓↓
7317,2023-01-15,临摹10万张梵高的画见到真迹后却沉默,导语：他是《中国梵高》他初中没读完，速成画画只是为了活下去，廉价劳动力却又每天接触高雅艺术，大半辈子的反思迷茫痛苦追寻他不是中国梵高，现在的他是个努力画自己的画家
7319,2023-01-15,王一博的卫衣和帽子都是无名,导语：王一博是懂宣传的！今天的机场路透穿搭，都是新电影的周边
7323,2023-01-15,晚点,
7328,2023-01-15,迪丽热巴鞠婧祎解锁超话钻二,
7329,2023-01-15,黄晓明祝陈梦生日快乐,导语：黄晓明祝陈梦生日快乐， “ 追梦的道路上，也要劳逸结合休息休息啊。其他的咱俩春节回家当面说”，表兄妹过年要见面啦
7335,2023-01-15,离翻盘成功就差一个福星,导语：游戏里的翻盘局靠的就是心态！那你有没有听过:不听不听，就玩福星！
7337,2023-01-15,王鹤棣东方青苍开大新花絮,导语：王鹤棣《苍兰诀》东方青苍开大新花絮
7339,2023-01-15,七英俊再发文道歉,导语：七英俊再次发文道歉。
7342,2023-01-15,二胎妈妈下决心和家暴老公离婚,导语：1月13日，江西一位二胎宝妈收拾好行李与儿子分别，下定决心离婚即使再也见不到孩子/
7346,2023-01-15,贺峻霖说发现了丁程鑫的超级秘密张哥速来,导语：贺峻霖：我发现了丁程鑫 的超级秘密！张真源 张哥速来！
7347,2023-01-15,华晨宇专辑销量承包网易云冠亚军,导语：芜湖！华晨宇厉害！新专辑《希忘Hope》跟四专《新世界NEW WORLD》在网易云音乐销量总榜正式碰头，承包总榜第一第二真的绝了！
7349,2023-01-15,年轻人为何反感群发拜年短信,导语：以前人们所赋予拜年短信的，是真诚而有温度的祝福，寄予美好期望。但从决定群发一样的拜年短信开始，祝福就已经失去了本来人们所赋予的意义。
7350,2023-01-15,女子没阳不想带娃回老公家过年,导语：过年要不要回家？
7351,2023-01-15,华为2022年分红出炉,
7352,2023-01-15,B费说别用我的名字攻击C罗,导语：布鲁诺-费尔南德斯表示，自己在曼市德比后的发言被曲解了，自己并不是在攻击C罗。
7353,2023-01-15,美国一彩票头奖开出13.5亿美元,导语：综合美联社和美国广播公司报道，当地时间1月13日晚，美国“超级百万”彩票头奖获奖者诞生，奖金高达13.5亿美元。获奖者来自缅因州。依照规则，若开出头奖，中奖者只有选择在今后29年内逐年分期领取奖金，才能获得全部奖金。如果选择一次性领取，奖金则会减半。
7354,2023-01-15,上海下雪,导语：冷空气主体继续发力，上海下起了2023年的第一场雪，你拍到了吗？来晒图吧～
7355,2023-01-15,这份新春约定风雪无阻暖人心扉,导语：十年来，每到春节前夕，习近平总书记都会来到群众中间，问冷暖、听民声，与大家一起分享新春的幸福滋味。
7362,2023-01-15,尹烨称白肺可能不是新冠感染,导语：“白肺”并不是新冠肺炎特有的，很多别的病原体感染肺部，出现了“白肺”，那就说明病情重。“白肺“对于年轻人来说，死亡率也不高，但是对于那些有基础疾病（比如高血压、糖尿病、冠心病等）的老年人来说却可能是致命的。
7367,2023-01-15,许红豆一眼认出许红米,导语：许红豆许红米不愧是亲姐妹，只看背影就能一眼认出对方
7373,2023-01-15,刘大锤要曝全国人民都认识的喜剧演员,导语：刘大锤要曝全国人民都认识的喜剧演员
7376,2023-01-15,王一博无名首舞台,导语：王一博湖南卫视春晚《无名》首舞台，真是太期待了
7384,2023-01-15,管虎父亲管宗祥逝世,导语：记者从各方途径核实后获悉，著名演员管宗祥于1月13日凌晨不幸逝世，享年101岁。
7385,2023-01-15,谢之遥被安排相亲,导语：《去有风的地方》谢之遥被安排相亲！！
7386,2023-01-15,任嘉伦一年拍三部戏一个综艺一张专辑,导语：任嘉伦一年拍三部戏一个综艺一张专辑
7387,2023-01-15,尼泊尔一客机坠毁机上载有 68 名乘客,
7390,2023-01-15,因为怕失温都不敢休息太长时间,导语：云南哀牢山地处中越边境，南部战区陆军“老山旅”就驻守在这里。夏天遇暴雨，河水涨至腹部，借助绳索才能渡河；冬季，战士们要带着砍刀和干棉衣跋山涉水，以便生火换衣取暖。因为怕失温都不敢休息太长时间，戍边任务艰险，他们却无怨无悔！
7393,2023-01-15,李一桐两版黄蓉造型对比,导语：李一桐《无限超越班》再演黄蓉，来看两版造型对比
7394,2023-01-15,路人视角下的王俊凯状态,导语：路人视角下的王俊凯状态好好~
7395,2023-01-15,网红翻窗闯法拍别墅拍视频被罚3千,导语：近日，江苏一做地产类视频的网红和另一男子开着法拉利，翻窗闯入被查封的法拍房，拍摄视频并在网上发布。
7396,2023-01-15,韩滑冰教练协会狠批金善台安贤洙,导语：在安贤洙和金善台均参与竞聘韩国城南市政厅短道速滑队教练的新闻传出后，韩国滑冰教练协会表达了强烈关切，认为两人的过往经历均有污点，不适合担当韩国教练。
7397,2023-01-15,下雪,
7398,2023-01-15,一诺皇冠造型,
7399,2023-01-15,JackeyLove出道五周年,导语：今天是@滔搏电子竞技俱乐部 下路选手JackeyLove出道五周年的日子
7400,2023-01-15,莫兰特逆天隔扣,导语：莫兰特逆天隔扣惊艳全场！
7401,2023-01-15,恋与制作人,
7403,2023-01-15,现代化离不开农业农村现代化,
7413,2023-01-15,网传吴磊周雨彤爱情而已更名原来是爱情啊,导语：网传吴磊周雨彤《爱情而已》更名《原来是爱情啊》
7420,2023-01-15,张艺兴飞天登迪拜世博园春节大巡游舞台,导语：中国大使馆在迪拜世博园中国馆主办的2023春节大巡游上有张艺兴的《飞天》，飞天好厉害！
7421,2023-01-15,肖战王一博龚俊最新VCR状态,导语：肖战、王一博、龚俊为六公主录制的vcr状态
7427,2023-01-15,被中国非遗打铁花惊艳到了,导语：“铁水打花”又叫打铁花，起源于北宋，至今已有千余年历史，当地群众用这种方式祈求来年国泰民安、五谷丰登。
7431,2023-01-15,易烊千玺满江红戏里戏外反差,导语：易烊千玺新电影《满江红》戏里戏外反差好可爱！！！！
7432,2023-01-15,张杰 掰手腕,
7435,2023-01-15,这张嘴是开过光吗,导语：这张嘴是开过光吗
7436,2023-01-15,粉笔模考,
7437,2023-01-15,重庆下雪,导语：14日晚，受寒潮影响，多地气温急剧下降飘雪，你家下雪了吗？
7438,2023-01-15,唐九洲问艾热你不是很喜欢underground吗,导语：唐九洲在万里走单骑中问艾热你不是很喜欢underground吗
7439,2023-01-15,时代少年团湖南小年夜VCR,导语：时代少年团湖南小年夜VCR视频来啦！期待今晚的节目！
7440,2023-01-15,这个玩具看起来很不服气,导语：好生动的体现了不服气的样子！！
7441,2023-01-15,奶奶去世爸爸吹奏世上只有妈妈好,
7442,2023-01-15,南方小年,
7443,2023-01-15,女生哭诉化妆品被6岁表妹全抠碎,导语：1月13日，陕西西安。王女士发视频哭诉小姨小姨带表妹来家里做客，自己心爱的化妆品全被表妹抠碎，用手指按得满是手印。
7444,2023-01-15,88岁老人临终为老伴擦泪不舍告别,导语：近日，内蒙古。一位88岁老人临终和老伴告别，现场一幕让人破防。老爷爷不放心留下老伴一个人，不停交代着后事回忆着从前。
7445,2023-01-15,B费谈争议进球,导语：曼联2-1逆转曼城！B费赛后谈争议球：“我面对着球门，拉什福德看到我的位置更好，我不知道我们中的谁是否越位，拉什福德对后卫没有任何影响，就是这样。”
7446,2023-01-15,把烘焙做出了油画的感觉,导语：这烘焙画风也太舒适治愈了！
7458,2023-01-15,陈奕迅被自己演唱会门票震惊到,导语：陈奕迅自己也没想到，票价会这么高！
7465,2023-01-15,流浪地球2里的宇宙级高速公路,导语：“太空电梯”特辑揭秘它的成长之路，和小破球乘坐“纵向的宇宙级高速公路”版太空电梯，一起前往我们的科幻世界！预售已经开啦！你们准备好了嘛～
7469,2023-01-15,绘旅人新春版,导语：温故而知，遍历百态，点点萤火聚炬成光，新春版本活动「录异记」将于1月17日更新后开启。
7471,2023-01-15,桂林一酒吧卫生间疑装双面镜,
7473,2023-01-15,李诞说不要再造新词制造焦虑,导语：在2023年《答案奇遇夜》中李诞谈论松弛感金句频出，“我觉得大家没有必要再发明新词制造焦虑了，有时候根本没有新问题，但我们非要给旧问题起个新名字。”
7474,2023-01-15,吴镇宇没鼓掌,导语：《无限超越班》当尔冬升让赵樱子重新介绍自己之后，尔冬升给予了肯定并鼓掌，在场的都鼓掌了，只有吴镇宇没有鼓掌～
7475,2023-01-15,赵樱子李一桐同演黄蓉,导语：李一桐赵樱子同演黄蓉 两种不同的风格 都好美！
7481,2023-01-15,王者兔年限定山海有灵,
7482,2023-01-15,就要这个新年味,
7483,2023-01-15,王源练习室版客厅狂欢,
7484,2023-01-15,一口气炫完五集狂飙,导语：张译、张颂文新剧《狂飙》昨晚首播
