,Date,Title,Introduction
13656,2023-01-14,网传陈飞宇张婧仪二搭出演结婚而已,
13664,2023-01-14,某幻连续5年获百大UP主,导语：某幻连续5年站上百大领奖台，五年来持续产出高质量实况和二创视频，把游戏玩出故事，用音乐表达自我，让生活充满幻想，某幻君未来可期！
13666,2023-01-14,女子展示神操作橘子复原术,导语：1月8日，吉林榆树。一位小姐姐给网友们展示了自己的“神”操作..
13667,2023-01-14,杨超越方向吃错瓜了,导语：方向怕不是个假瓜主吧，杨超越吃到大瓜的表情简直演我！
13688,2023-01-14,没见过这么好笑的粤语教学,导语：黄冠亨的粤语教学也太搞笑了哈哈哈哈哈哈
13701,2023-01-14,朴宰范HoshiDino舞蹈挑战,"导语：SEVENTEEN Hoshi,Dino x 朴宰范《bluecheck》challenge视频"
13703,2023-01-14,手艺人做的翻糖,导语：被手艺人做的翻糖治愈了
13732,2023-01-14,龚俊湿发造型大片花絮,导语：龚俊《时尚先生》湿发造型大片~花絮影浮动，率性而行~
13739,2023-01-14,严浩翔说马哥捡到了你的纸飞机,导语：马嘉祺严浩翔新歌《若想念飞行》合拍，严浩翔：马哥捡到了你的纸飞机。浩翔这个头发简直帅不活了，看到了动的新发色怼脸老公[awsl]你们也太帅了吧[彩虹屁]
13742,2023-01-14,你与李泽言的第六年,导语：往昔历历，今而遇你。与@恋与制作人 李泽言 的第六年即将开启~
13745,2023-01-14,EDG上野ID,导语：EDG上野改国服id：我今年16岁，擅长锤石和娜美。这句话是队长Meiko曾经的个人简介。
13746,2023-01-14,第一次从猫猫脸上看见了委屈,
13768,2023-01-14,胡夏从那些年唱到这些人,导语：天，@胡夏 2023第一首情歌《我们这一些人啊》上线，从“那些年”到“这些人”，胡夏的歌声依然充满惊喜，给我们带来熟悉的治愈感和故事感。
13781,2023-01-14,新年美甲,
13791,2023-01-14,FIRSTFRAME第一帧,导语：FIRST联合香奈儿发起“FIRST FRAME第一帧”单元，关注华语新生代电影人作品中的多元女性形象，鼓励女性主题影像书写。2023年FIRST FRAME独立评审团由惠英红、马英力、许娜(La Frances Hui)组成；张钧甯、张子枫担任年度推介人，戴锦华担任学术推介人。
13793,2023-01-14,孙悦爱得起唱出了放得下,
13814,2023-01-14,丈夫偷送万元包妻子大哭10分钟,导语：1月10日，北京。丁先生给妻子下单了一个名牌包，妻子得知后情绪失控哭了十分钟。丁先生称，妻子从结婚就对包包心心念念，但一个包至少一万，她舍不得，平时自己送她一些贵的礼物就会被退掉，这次刚好想起就在网上下单了，没想到妻子会这么感动。
13830,2023-01-14,这是真的浪漫过敏吧,
13832,2023-01-14,周深说花火唱给愿意成为海岸的人,
13835,2023-01-14,金钟仁米兰时装周红毯,导语：金钟仁出席米兰时装周，不愧是人间古驰！
13840,2023-01-14,最强大脑这期像开了20倍速,
13843,2023-01-14,苏州新年氛围感有多浓,导语：苏州新年氛围感有多浓，爆鱼摊门口排起的长队告诉你答案……人间烟火处，年味渐浓时，你记忆中的年味是什么味道？
13847,2023-01-14,河南女子遭暴力逼亲警方妇联介入,
13858,2023-01-14,姚晨爸妈坚持养鸡,导语：《我们的客栈》中，姚晨谈到自己父母坚持养鸡的原因：姚晨很小去北舞学习，父母担心孩子在远方吃不惯，就自己养鸡养鹅给孩子补充营养。
13860,2023-01-14,陈鸿宇淘汰,导语：#我们民谣2022# 迎来首轮淘汰，陈鸿宇 @众乐纪陈鸿宇 排名第十遗憾离开。
13861,2023-01-14,水哥王昱珩希望杨英豪再拿第一,导语：《最强大脑》10新一期，水哥王昱珩称希望曾经的队员在项目中能够拿第一，两人五年后在大脑舞台上再相聚，水哥对杨英豪充满了厚望！
13867,2023-01-14,司机车内挂满糖果免费送乘客,导语：1月11日，湖北荆门，一司机为乘客免费提供糖果零食挂满车。据乘客高同学称:当时路边拦车上车后发现车内挂了很多糖果、零食还有水和玩偶什么的，当时看到后就觉得很有爱，很温暖。高同学还表示：司机四十多岁了，开始以为要钱没忍住吃了个糖果，下次付钱时候得知不需要。得知是给晕车、醉酒的人准备的，觉得司机好浪漫。
13871,2023-01-14,鸳鸯锅泡面一脸win号,导语：你们最喜欢吃的速食是什么？来分享一下！看看我有没有吃过~
13872,2023-01-12,健全全面从严治党体系,导语：永远保持赶考的清醒和谨慎，驰而不息推进全面从严治党，不断健全全面从严治党体系，把党的伟大自我革命进行到底，以党的自我革命引领社会革命，我们就一定能向历史和人民交出新的优异答卷、创造新的更大奇迹。
13873,2023-01-12,22岁女生熟睡时从学校宿舍上铺坠亡,导语：近日，有苏州网友爆料其女儿在苏州托普信息职业技术学院宿舍上铺坠落死亡，令人吃惊的是，其床架护栏高度仅15厘米左右，铺上被褥护栏几乎“隐形”。
13874,2023-01-12,扬州通报干部作风问题,
13875,2023-01-12,2023年第一场雪,导语：气象部门预计，本周我国将出现一次大范围雨雪天气过程，北方大部地区将有小到中雪或雨夹雪、局地大到暴雪。
13876,2023-01-12,黑莲花,
13877,2023-01-12,蓝正龙被问到大S的反应,导语：蓝正龙被记者问到有没有关心“前女友”大S的事，反应亮了。
13878,2023-01-12,去世爷爷手机每页都空出孙子的脸,导语：1月11日，浙江，一条“去世爷爷手机每页都空出孙子的脸”的视频引发网友关注。爷爷去世后留下生前用过的手机，女子查看后发现，手机的每一页APP排版都非常讲究，没有一个APP挡住了孙子的正脸。
13879,2023-01-12,王思聪疑因打人被拘提请行政复议,
13880,2023-01-12,45岁女子带5个孩子嫁给初恋,导语：1月12日，河南周口。45岁新娘带着5个孩子嫁给了爱情，在亲朋的祝福和见证下步入婚姻的殿堂。
13881,2023-01-12,大叔做高跟鞋脚模试穿狂奔月入600万,导语：1月11日，四川。41岁大叔靠卖高跟鞋火遍全网，视频中，他留着一撮小胡子，亲自穿高跟鞋测评，在短视频圈“出道”了，粉丝破120万，每月带来600万成交。在此之前，他卖过蛋糕，卖过窗帘，曾创业过三次，屡败屡战，最后才迎来了今天。
13882,2023-01-12,安贤洙迈出回韩国执教第一步,导语：1月12日，安贤洙出现在了城南短道速滑教练面试现场。
13883,2023-01-12,内娱唱演俱佳的明星,导语：他们能够同时驾驭演戏和唱跳，以积极的态度提升业务能力，清醒又自信的样子好迷人！快来参与讨论你心中那些唱演俱佳的明星，和我们一起安利吧～
13884,2023-01-12,天津一烧烤店结账只收现金,导语：近日，天津。网友称一烧烤店结账只收现金，不接受其他支付方式，引发讨论。烧烤店商家回应结账只收现金：一直就只收现金，不支持其他任何方式，如果没有现金可以去附近兑换，但100块需收1元的手续费，这里最低标准是两个人来，不接受单人。
13885,2023-01-12,印度16岁少女枪击性侵者母亲,导语：据NDTV报道，近日，印度新德里一名16岁少女向50岁杂货店老板娘hursheeda开了多枪。两年前，老板娘未成年的儿子曾性侵过该少女，后已坐牢。
13886,2023-01-12,郑钧说没有陆毅那么体贴细微,
13887,2023-01-12,英日两国将允许相互驻军,导语：据英国《泰晤士报》网站1月11日报道，英国首相里希·苏纳克11日说，英国和日本的关系“比以往任何时候都要牢固”。据报道，在日本首相岸田文雄访问伦敦期间，两国签署了《互惠准入协定》，将允许英国和日本在对方国家部署军队。
13888,2023-01-12,赵露思白色小香风造型拍摄花絮,导语：赵露思白色小香风造型拍摄花絮
13889,2023-01-12,大叔医院扔下10万元转身就走,导语：一名大叔来到医院挂号处，扔下一个黑色袋子后，转身就走。袋子里面是10万元现金还有一封信，信中写道“请帮医生们的伙食增加点营养，望医生们健康快乐。”
13890,2023-01-12,研究显示25万年来爸爸总比妈妈大,导语：近日，来自美国印第安纳大学的一项新研究显示，在过去25万年中，人类生育孩子的平均年龄是26.9岁，但父亲的平均生育年龄为30.7岁，而母亲的平均生育年龄则为23.2岁，总体而言爸爸总比妈妈要大。
13891,2023-01-12,女子就餐花40多块点肥肠发现有粪便,导语：1月11日，上海。女子餐厅就餐发现肥肠包裹整段便便。
13892,2023-01-12,女子回应前夫只接走2儿子独留女儿,导语：1月10日，河南洛阳。前夫接孩子带走2儿子独留女儿的视频引发关注，孩子妈妈吴女士回应称：家里3个孩子，大儿子是前夫上一段感情生的，自己和前夫离婚3年，2个儿子判给了前夫，但一直是自己照顾。
13893,2023-01-12,谭松韵手机壳美女的事你少管,导语：谭松韵《向风而行》自拍，手机壳美女的事你少管，好可爱
13894,2023-01-12,苗苗跳舞时的眼睛,导语：苗苗跳舞时的眼睛都在发着光 真的好爱美女跳舞💃🏻
13896,2023-01-12,TheShy多个韩服号被永封,导语：近期TheShy多个账号疑似被永久封禁。（Permaban=永久封禁）
13897,2023-01-12,过年就别再催婚了,导语：希望今年过年不要再催婚了！！！求求了！
13898,2023-01-12,AG菲菲,
13899,2023-01-12,尹锡悦要求韩外交部向中方解释,
13900,2023-01-12,前巴萨高层辱骂梅西,导语：多家西班牙媒体今天爆料，前巴萨CEO格拉乌和前法务主管庞蒂涉嫌泄露梅西、皮克合同，而庞蒂更是对梅西进行了言词恶毒的辱骂。
13901,2023-01-12,去世母亲的每件财物都标注儿女名字,导语：1月11日，江苏徐州。魏女士收拾去世母亲衣物时发现，母亲把每一件首饰、钱物等都标注上了儿女们的名字，要分给孩子们。
13902,2023-01-12,韦峰,
13903,2023-01-12,有风小院全员中毒后的精神状态,导语：有风小院全员中毒后的精神状态
13904,2023-01-12,少年歌行杀疯了,导语：《少年歌行》确定不是少年刀行嘛，真的太会刀了。少年歌行杀疯了！
13905,2023-01-12,骗TangoZ萧逸是我男朋友,导语：Tangoz直播这段笑死我了啊啊啊《关于骗Tangoz萧逸是我男朋友这件事》
13906,2023-01-12,爱奇艺回应上海市消保委点名不厚道,导语：1月12日，有媒体报道，上海市消保委针对视频平台限制消费者投屏使用发声。上海市消保委称，投屏是移动端用户正常的使用场景，平台用限制投屏加收费用不合理，想用这种方法加收费用更不厚道。对此，爱奇艺人工客服表示，会员等级不同权益不同，黄金会员可以投屏，但只能享受480P的清晰度，若想获得更高的清晰度，需充值成白金会员，而成为白金会员后不需要投屏。
13907,2023-01-12,泰国旅游业为什么喜欢中国人,导语：2023年1月9日下午，首批269名中国游客抵达万那普机场，接受采访的中国游客表示，当时就像明星走红毯一样，泰国旅游业为什么喜欢中国人？韩国和泰国态度为何天差地别？
13908,2023-01-12,捡大米的喻言,导语：有被喻言捡米这段可爱到！！忙碌认真的笨蛋美女一枚～
13909,2023-01-12,这居然不是狗,
13910,2023-01-12,缅甸枭龙战机越境空袭印度,导语：据英国《卫报》报道报道，当地时间1月10日下午四点左右，印度米佐拉姆邦境内的一个钦民族军据点维多利亚营遭到了来自缅甸空军战斗机的空袭，11日，该营地又遭到一次来自缅甸空军的越境空袭。
13911,2023-01-12,爱奇艺上线远程为父母付款功能,导语：有用户发现，爱奇艺的TV版客户端奇异果，上线了一项名为“亲情助”的新功能。据介绍，这一功能能够让儿女远程帮助父母完成代登陆、充值续费、账户管理等一系列操作。
13912,2023-01-12,红军报名时的身高标线看着心疼,导语：福建长汀的红军桥，前桥4根木柱上有一道道清晰的刻痕。这些刻痕，是当年报名参加红军的身高标线。
13913,2023-01-12,许红豆对谢之遥吐露心声,导语：许红豆对谢之遥吐露心声 ，小院野外聚会，许红豆谢之遥一起捡柴，小情侣氛围看的人想谈恋爱～
13914,2023-01-12,韩国总统称未来可能部署核武器,导语：尹锡悦提到了韩国拥核的可能性：“如果朝鲜的挑衅加剧，韩国有可能部署战术核武器或拥有自己的核武器。”
13915,2023-01-12,许红豆吃菌中毒,导语：《去有风的地方》许红豆吃菌中毒出现幻觉，满眼都是粉红泡泡
13916,2023-01-12,官方称1888万天价彩礼初步判断系杜撰,导语：近日，一上海网友发文吐槽被江西萍乡前女友提1888万元彩礼引发关注。参与该事件调查的一位人士表示，根据出入境情况核查，初步判断该文章内容系杜撰，当地彩礼上百万都极少。
13917,2023-01-12,狗子被放车厢迎风随主人返乡,导语：1月10日，安徽池州。狗子被放车厢迎风随主人返乡。
13918,2023-01-12,73岁保安徒手接住4楼坠落女子,导语：常州溧阳一个小区内发生了惊险一幕，一名女子悬空在四楼，眼看就要坠楼，危急时刻，73岁的小区保安伏国林冲了上去，在楼下张开双臂，化解了险情。
13919,2023-01-12,兔年茅台生肖酒上市一周价格腰斩,导语：1月12日，杭州网消息，兔年茅台酒上市一周就大降价，价格从6000降到3000多一点，被茅台经销商吐槽为“流氓兔”。
13920,2023-01-12,这么看地球确实很小,
13921,2023-01-12,路边小摊的称都准吗,
13922,2023-01-12,男子情绪崩溃在医院走廊连扇耳光,导语：1月11日，河南新乡，一男子在医院走廊内情绪崩溃，连扇自己耳光引周围患者及家属围观。
13923,2023-01-12,2023年纪检监察工作八大任务,导语：2023年1月10日，二十届中央纪委二次全会公报发布。就做好2023年纪检监察工作，公报提出8方面具体任务，并作出细化部署。
13926,2023-01-12,我国海水稻种植面积突破百万亩,导语：曾经寸草不生的海滨滩涂，或是直泛盐花的盐碱地上，竟然能长出香喷喷的稻米。这是我国农业科技工作者创造的奇迹！最新统计显示，截至2022年年底，我国耐盐碱水稻种植面积已突破100万亩！
13934,2023-01-12,郭碧婷ins取关向佐,导语：有网友发现郭碧婷的ins账号没有关注向佐，而向佐目前关注着郭碧婷
13939,2023-01-12,江西萍乡民政局回应网传1888万彩礼,
13944,2023-01-12,时代少年团小分队合作曲试听,
13946,2023-01-12,择君记沈妙怀孕,导语：《择君记》中，沈妙成功与裴衍祯和离，刚和宋席远成婚不久，就被诊断出身怀有孕！
13949,2023-01-12,王一博李沁光明之路更名金色征途,导语：王一博李沁主演的电视剧《光明之路》更名《金色征途》
13953,2023-01-12,超6成东北人想去三亚过年,导语：数据显示，超6成东北人想去三亚过年，12月至今，哈尔滨前往三亚的机票订单量环比上月增长了182%。同样，东北人也把家乡味搬到了海南。
13954,2023-01-12,刘芸不让郑钧唱灰姑娘,
13959,2023-01-12,00后女生3年手写信件超1000封,
13961,2023-01-12,故宫长城雍和宫雪花浪漫纷飞,导语：1月12日，北京迎来2023年第一场雪。截至12日下午，北京城区、郊区均已开始降雪，雪中的京城古意盎然，故宫、雍和宫、长城等地雪花纷飞，氛围感十足。
13963,2023-01-12,张昊21分,导语：小将张昊今天拿到21分，破个人得分新高！
13964,2023-01-12,权威人士称上海打人者王某某系王思聪,
13965,2023-01-12,陈飞宇周也倒数说爱你看初雪,导语：陈飞宇周也倒数说爱你看初雪视频，有爱的日子，有爱的人出现
13966,2023-01-12,平台回应女子买牛肋排全是骨头,导语：1月11日，河南新乡。高女士反映，她在直播间购买的精选牛肋排，到货发现全是骨头。高女士称，商家做的活动是拍3斤送2斤，共计5斤99元，但到货后她发现轻飘飘的，打开一看全是骨头，连骨髓都没有，她将视频发到网上后，有工作人员联系她说可以退款，但她觉得商家的行为非常过分，希望提醒大家置办年货要注意甄选。12日，平台客服回应称，目前已经对该商家进行停业整顿。
13967,2023-01-12,菲姐说花落没来AG,导语：AG菲菲回应：花落没有入职AG。
13968,2023-01-12,这是小狗该有的坐姿吗,导语：作为一只合格的大黄，不学点坐姿都混不下去了
13969,2023-01-12,驻韩大使回应中国公民入境韩国问题,导语：当地时间1月12日下午，中国驻韩国大使邢海明在首尔接受中新社记者采访，就当前有关中国公民入境韩国所遭受不公正待遇作出回应。
13971,2023-01-12,Faker认为LCK整体比LPL强,
13972,2023-01-12,喜欢把猫咪藏起来的狗狗,导语：狗狗对于猫咪的爱是否太过沉重……
13973,2023-01-12,大多数人用不到辅酶Q10,导语：一直以来，辅酶Q10被认为具有保护心脏及心血管的作用。近期，“阳康”者因担忧新冠病毒损伤心肌，于是将辅酶Q10一举推上了抢购名单。然而，多位专家均表示，大多数人都用不到它，真没必要跟风抢购。
13976,2023-01-12,胡鑫宇舅舅称如果他存在就该有痕迹,导语：胡鑫宇失踪90天，失踪前胡鑫宇的异常表现有哪些？他的性格曾发生哪些变化？家人后续将如何寻找？凤凰网《正面FACE》独家对话胡鑫宇舅舅，讲述胡鑫宇失踪前后的诸多细节。
13992,2023-01-12,蔡亨源BeautifulLiar直拍,导语：蔡亨源《Beautiful Liar》直拍公开！
14000,2023-01-12,张若昀话说早了,导语：《令人心动的offer4》张若昀说怕在剧组过生日，会有种社死现场的感觉，结果转头就给张杰过起了生日哈哈哈哈哈！
14001,2023-01-12,2022尖叫之夜阵容官宣,导语：2022尖叫之夜阵容官宣来了！1月14日18:00爱奇艺与你不见不散！
14002,2023-01-12,王鹤棣看到都得愣一下,导语：王鹤棣本人来了看到这张照片都得愣一下吧哈哈哈哈
14003,2023-01-12,李现谢之遥大忽悠,导语：谢之遥别把我笑死，带队前进的样子真以为是团建出游呢！
14004,2023-01-12,白鹿张凌赫加盟尖叫之夜,导语：白鹿张凌赫加盟《尖叫之夜》
14005,2023-01-12,泰国优惠酒店一房难求,导语：据携程数据显示，1月以来，目的地为泰国的酒店预订量同比增长480%，其中来自中国内地游客的预订占比超过三成。
14007,2023-01-12,这个世界好离谱,导语：有时候我真的不懂这个世界...
14010,2023-01-12,向风而行有第二部吗,导语：王凯、谭松韵新剧今晚大结局了，根本没看够吧，还会有第二部吗？
14011,2023-01-12,北控男篮vs广东男篮,
14013,2023-01-12,韩媒称中国游客不来韩国商家认栽,导语：】“中国游客不来，韩国商家认栽。”《韩国经济》11日以此为题报道称，位于首尔市区的大型奥特莱斯商场“W购物中心”将于今年9月关门停业。该商场近两年受疫情影响，失去了作为“消费主力”的中国游客，导致经营不善，难以为继，最终宣布倒闭。
14014,2023-01-12,律师称达成和解王某某将免于处罚,导语：1月12日，律师解读上海王某某打人事件，称如若双方和解，王某某将可能免于处罚。 河北驰舟律师事务所侯士朝律师称，通常司法机关会把和解作为解决方式之一，和解产生一般基于被告人的谅解，如果被告人对王某某进行谅解，达成和解协议，在进行处罚的时候很有可能免于处罚。
14015,2023-01-12,傻子瓜子创始人年广九逝世,导语：1月12日，著名民营企业家、“傻子瓜子”创始人年广九先生，因病医治无效，于2023年1月11日14时在芜湖逝世，享年84岁。
14016,2023-01-12,两个动作提升腰背力量,
14017,2023-01-12,女子带娃上户口网逃丈夫当场被抓,导语：近日，湖北襄阳，一女子到派出所为孩子上户口时，民警发现其丈夫汪某系在逃人员。民警以办理户口需要当面核实父亲身份为由，让她把丈夫叫过来，并悄悄呼叫增援人员守在大厅，其丈夫汪某刚进门就被抓获。经查，汪某涉嫌电信诈骗，已被河北警方带走。
14018,2023-01-12,经济学家称给百姓直接发钱弊大于利,导语：#经济学家称给百姓直接发钱弊大于利# ：发钱不能救一个国家的经济
14048,2023-01-12,郑嘉颖三胎得子,导语：据港媒，郑嘉颖老婆陈凯琳昨天入院，生下三胎儿子。
14051,2023-01-12,苏醒又做错了什么,导语：王栎鑫回应采访发言，苏醒又何其无辜啊哈哈哈
14054,2023-01-12,小时候真的好想要这个,导语：对不起钱钱，真的需要一个HelloKitty小夜灯
14056,2023-01-12,狂飙定档1月14日,导语：有伞必打，有网必破。电视剧《狂飙》定档1月14日，敬请期待！
14057,2023-01-12,涂松岩说刘亦菲李现很好很可爱,导语：《去有风的地方》热播中，涂松岩谈和刘亦菲李现合作，可以有啊，简直了，哈哈哈哈，涂松岩说刘亦菲李现很好很可爱，你觉得呢？
14059,2023-01-12,地铁跑酷,导语：地铁跑酷（Subway Surfers）是一款冒险类游戏，游戏的背景设定在地铁铁轨上，玩家要帮助Jake和伙伴躲避警察的追捕同时往来的地铁给游戏增加了挑战难度。游戏采用3D立体视角每天都会即时刷新三项任务供玩家去挑战。一起来晒晒你的分数吧~
14060,2023-01-12,为什么要和喜欢的人看初雪,导语：要和喜欢的人一起看初雪呀～
14061,2023-01-12,师父粤语配音即将上线,导语：Sloclap工作室公开了《师父SIFU》的粤语配音宣传片，同时官方还宣布游戏的竞技场模式和粤语配音即将上线。
14063,2023-01-12,50岁外公抱2个月外孙女村里炫耀,导语：1月11日，江西上饶。50岁外公抱2个月大外孙女四处炫耀。女儿丁女士称，当天吃饭的时候没看到父亲和自己的女儿，结果发现父亲带着女儿去和村里的其他人炫耀了，父亲之前一直催婚，今年终于如愿抱上了孩子，父亲平时和她说话都不耐烦，但是带外孙女却这么尽心，只要父亲抱着自己的女儿，别人就抢不到抱，感觉隔辈亲很神奇。
14064,2023-01-12,33岁女子生3女儿后4胎得子,导语：1月11日，山东。一33岁女子晒出婆婆将自己刚出生没多久的4胎儿子抱在怀中，爱不释手的温馨场面，婆婆迎来小孙子十分开心。
14065,2023-01-12,湖南省考,
14085,2023-01-12,宋亚轩刘耀文合作新歌试听预告,导语：宋亚轩刘耀文合作新歌《烟花升停在星夜》试听预告
14086,2023-01-12,00后会消灭酒桌文化吗,导语：根据此前艾瑞咨询所发布的《酒精饮料用户洞察报告》发现，除去年轻人对酒桌文化的厌恶外，白酒口感难以接受、喝完会头疼也是年轻人不喜白酒的主要原因之一，你喝白酒吗？
14090,2023-01-12,奶奶带孙子盐蒸宝妈担心娃受不了,导语：1月10日，湖南永州。前婆婆带11个月宝宝盐蒸，女子心疼孩子找前夫沟通反被怼。
14091,2023-01-12,印尼已为中国游客准备好红毯,导语：中国近期不断优化调整防疫政策、有序恢复公民出境旅游以来，东南亚多国陆续加入“抢客”行列。在旅游业发达的印度尼西亚，旅游和创意经济部长桑迪亚加·乌诺隔空“喊话”，印尼“已为中国游客准备好红毯”。
14092,2023-01-12,爱奇艺客服回应APP限制投屏,导语：#爱奇艺客服回应App限制投屏#：480P以上清晰度需开通白金会员
14093,2023-01-12,肖战压箱底第一波大片,导语：肖战压箱底——第一波 ​​​
14095,2023-01-12,郑恺苗苗相敬如宾的相处方式,导语：郑恺苗苗相敬如宾的相处方式 好可爱呀！两人
14096,2023-01-12,程霄完成国产大飞机首航,导语：《向风而行》大结局，程霄顺利完成国产大飞机首航，笑容自信。
14097,2023-01-12,原来猫也不是全都聪明,导语：原来不是所有猫咪都很聪明～
14098,2023-01-12,严浩翔参与新歌孤独怪物词曲制作,导语：严浩翔参与新歌词曲制作
14102,2023-01-12,许佳琪想约迪丽热巴蒸桑拿,导语：新浪娱乐独家探班@CCTV网络春晚 后台，@许佳琪kiki 羞涩邀约@Dear-迪丽热巴 蒸桑拿！
14103,2023-01-12,Ming回应缺席RNG大名单,导语：史森明缺席RNG春季赛大名单引发热议，RNG工作人员称他出去旅游了，年后就回来，小明则表示：我目前还是自由人（没有签约），一直在和RNG沟通中，感谢大家关心。
14107,2023-01-12,建议将春节假期延长至9天,导语：四川省人大代表，甘孜州文化广播电视和旅游局党组书记、局长刘洪建议：将春节假期延长至9天。
