,Date,Title,Introduction
5529,2023-10-15,叶童提名金鸡奖最佳女配,
5530,2023-10-15,杨皓宇值得,
5531,2023-10-15,大连马拉松,
5532,2023-10-15,田嘉瑞泼林一 一击即中,
5533,2023-10-15,赵丽颖品牌晚宴视频,
5534,2023-10-15,马来西亚36岁演员帮子女洗澡时猝逝,
5535,2023-10-15,秋婉G,
5536,2023-10-15,螺蛳粉的热量真的很高吗,导语：螺蛳粉的热量真的很高吗
5537,2023-10-15,李雪健提名金鸡最佳男配角,
5538,2023-10-15,陈哲远我那运动风男友,导语：陈哲远我那运动风男友，简直就是新一代卷王
5539,2023-10-15,王毅同沙特外交大臣费萨尔通电话,导语：王毅同沙特外交大臣费萨尔通电话
5540,2023-10-15,在法国上中文课有种学霸的感觉,
5541,2023-10-15,闫妮提名金鸡奖最佳女主角,
5542,2023-10-15,封神金鸡奖9项提名,导语：电影封神第一部拿下共计9项金鸡奖提名！
5543,2023-10-15,丞磊骑行plog,
5544,2023-10-15,严屹宽 建模脸,
5545,2023-10-15,国考岗位专业目录使用指南,
5546,2023-10-15,万茜提名金鸡奖最佳女配角,导语：祝贺演员万茜凭借《学爸》“火嫂”一角提名第36届金鸡奖最佳女配角！
5547,2023-10-15,丈夫为救坠崖昏迷妻子自己也被困,导语：近日，云南大理，两名群众失足坠入山崖，情况紧急。消防员赶赴，经询问得知被困二人为夫妻俩，妻子不慎失足坠入山崖昏迷，丈夫为营救妻子也被困。救援人员做好防护后立即分三组展开营救，一小时后将夫妻二人带回安全地带。
5548,2023-10-15,以色列同意加沙地带的外国人离开,导语：埃及、以色列和美国已达成一致意见，同意位于加沙地带的外国人通过拉法边境口岸进入埃及
5551,2023-10-15,韩庚在减了,导语：韩庚晒健身照
5553,2023-10-15,X玖R1SE齐聚赵磊北京巡演,导语：X玖R1SE齐聚赵磊北京巡演
5554,2023-10-15,当我把柚子皮盖头上扎丸子头,导语：当我学网上把柚子皮盖头上扎丸子头时
5555,2023-10-15,杨紫关智斌同框,导语：#杨紫关智斌同框#
5556,2023-10-15,吴磊的狗晒锦旗,导语：吴磊的狗晒锦旗
5557,2023-10-15,女子乔迁新房70人吃席家里蹲,导语：女子搬新房办乔迁宴，在家宴请70位亲友吃席，从客厅到房间地上都摆上火锅，人多到只能就地坐。
5558,2023-10-15,张朝阳的物理课重庆开讲,
5559,2023-10-15,张凌赫金靖合照,导语：《你好星期六》张凌赫金靖合照
5560,2023-10-15,原来还可以健康熬夜,导语：专家介绍：不良的生活方式可能会导致白头发提前出现，例如染发、烫发、精神紧张、熬夜、睡眠不足、营养不均衡等，我们该如何预防白头发的发生呢？戳视频，一起来看看👇如果你也有相关问题，可以在评论区留言，小圈会带着你的问题替你问专家哦～
5561,2023-10-15,田耕纪爱奇艺热度值破6000,导语：《田耕纪》开播5小时爱奇艺热度值破6000！快来田里一起撒欢搞钱～
5562,2023-10-15,四川人连早饭都是重油重辣吗,导语：四川人连早饭都是重油重辣吗
5563,2023-10-15,不管说什么男朋友都会用反问句来接话,
5564,2023-10-15,你准备参加今年国考吗,导语：据国家公务员局消息，2024年“国考”10月15日起报名，11月26日笔试，计划招录3.96万人。
5565,2023-10-15,周口一玉米种植地被五百余人哄抢,
5566,2023-10-15,苏醒演唱会偶遇吴莫愁,导语：有网友在苏醒上海站演唱会偶遇到吴莫愁了，内娱果然是个圈
5569,2023-10-15,丁真肺活量惊呆罗一舟,导语：本期《向山海出发》中丁真用嘴吹床垫，肺活量惊呆罗一舟～
5570,2023-10-15,王一博去看大张伟演唱会,
5571,2023-10-15,赵丽颖闪钻礼服,导语：赵丽颖闪钻礼服
5573,2023-10-15,张靓颖穿18cm靴子唱跳不带喘,导语：张靓颖成都演唱会真的好顶，穿18cm靴子唱跳都不带喘的！
5575,2023-10-15,王心凌上海演唱会演绎黄昏晓,
5576,2023-10-15,从不拆家的金毛拆了自己的窝,导语：在“云吞”的Vlog中，它给大家分享刚刚过去的中秋国庆长假里，“小狗警官们”都干了些什么工作。
5577,2023-10-15,苏醒好会唱英文歌,
5579,2023-10-15,民国剧十有九悲,导语：《梅花红桃》开虐，如果信仰的对立面是爱人，只能选择对不起你
5580,2023-10-15,现在问题不是车银优,
5581,2023-10-15,同学说我的工位像保安室,
5582,2023-10-15,女子集200多个硬币拼囍字庆闺蜜结婚,导语：近日，湖南长沙。女子为庆祝闺蜜结婚，收集了200多个金色的5角硬币拼成“囍”字相框作为礼物。
5583,2023-10-15,英语老师为不同成绩准备了meme贴纸,
5584,2023-10-15,张杰杨和苏合作一千公里,导语：张杰陪杨和苏一起唱《一千公里》，两人年少的模样在歌声里重合！
5585,2023-10-15,2024年国考公告,导语：考生可于10月15日8:00至10月24日18:00期间登录“中央机关及其直属机构2024年度考试录用公务员专题网站”（网页链接）进行网上报名，公共科目笔试将于11月26日在全国各直辖市、省会城市、自治区首府和部分较大的城市同时举行。
5587,2023-10-15,400余年古村落家家有泉水和竹林,导语：你知道吗？临沂有个拥有400余年历史的古村落，因家家有泉水，户户有竹林而得名，“竹泉村”，这是中国北方难得一见的桃花源式的自然环境村
5589,2023-10-15,苏醒巡演终于唱跳了,
5590,2023-10-15,普京称现阶段最重要的是制止流血事件,导语：一旦以色列在加沙地带展开地面行动，将导致“绝对不可接受”的平民伤亡。
5591,2023-10-15,丁程鑫把黄子韬泼倒了,导语：@时代少年团-丁程鑫 一杯水泼倒黄子韬@ACE-YOUNGKINGYOUNGBOSS
5593,2023-10-15,长大后才发现过来人的经验是真的,
5596,2023-10-15,我的执刃大人来到现代当少爷了,
5598,2023-10-15,章若楠秋冬穿搭好实用,导语：章若楠分享日常随拍，黑色毛衣叠穿+牛仔裤，穿搭简单又实用[哇]
5599,2023-10-15,一群小猫和一群小狗首次见面,
5602,2023-10-15,新铁锅煮螺蛳粉汤底黑亮似芝麻糊,导语：近日，山东济南。一名男子用未开铁锅煮螺蛳粉汤底发黑似芝麻糊色。
5603,2023-10-15,华浅提出和离,导语：#华浅提出和离
5604,2023-10-15,全国小狗听见出去玩的统一反应,
5609,2023-10-15,杨玏吻白马梦回伯邑考,导语：杨玏今日吻白马图梦回《封神》伯邑考
5612,2023-10-15,黄晓明林述巍评价尹正,导语：看到黄晓明和林述巍对尹正评价，不得不说尹正是一个特别贴心的人呀！
5614,2023-10-15,周杰伦上海1943,
5617,2023-10-15,六旬大爷跳江勇救落水女子,
5618,2023-10-15,王子异包上恩对手戏好疯批,导语：王子异包上恩你俩好疯！！！
5620,2023-10-15,如何用iPhone拍出好看的美食照片,
5623,2023-10-15,熬夜等级表,导语：有研究表明：连续两星期每天少睡2个小时和连续48小时不睡觉，所造成的危害是一样大的，都会降低大脑的认知功能；并且长期睡眠不足需要的恢复时间，比偶尔通宵要多得多，下面熬夜等级表，你都熬到什么级别了？
5626,2023-10-15,成韩彬洗娃直播,
5628,2023-10-15,梁静茹 宁波,
5630,2023-10-15,田柾国TXT舞蹈挑战,
5632,2023-10-15,张艺兴武汉CityWalk,导语：张艺兴武汉citywalk
5639,2023-10-16,一带一路十年之约,导语：有一条路，能够跨越无边山脉的阻隔，闯过千万颗地雷的险阻，穿越弥漫硝烟、惊涛骇浪，用爱照见希望的曙光，见证心与心的相连。《#山海同心#》，共赴十年之约。
5640,2023-10-16,周筱风官宣恋情,导语：《问心》周筱风高调官宣和陈玥的恋情，周主任以后再也不是一个人啦！
5641,2023-10-16,朱一龙 北大,
5642,2023-10-16,旧风力发电叶片变草场栅栏能用30年,导语：现在，退役风机叶片可以加工为栅栏，寿命长达30年。
5643,2023-10-16,警方已发现咬人黑狗行踪,"导语：10月16日，成都崇州，一女童在小区内遭大狗扑咬，致右肾挫裂伤,右侧肋骨骨折，引发网友热议。"
5644,2023-10-16,为什么粉色要贵这么多,导语：抵制粉红税，坚决不做女韭菜
5645,2023-10-16,中国政府向巴勒斯坦提供紧急人道主义援助,
5646,2023-10-16,曾舜晞这辈子没干的活儿全在娱乐圈干了,导语：曾舜晞这辈子没干的活儿全在娱乐圈干了
5647,2023-10-16,白鹿带闺蜜看五月天演唱会,导语：不好的是敌咪 好的是闺蜜 比闺蜜还好的是白鹿！
5648,2023-10-16,檀健次 北海蛊王,
5649,2023-10-16,中国移动采购120万台华为手机,
5650,2023-10-16,成都咬伤女童大黑狗有主人,导语：民警告诉红星新闻记者，根据目前掌握的情况，涉事犬只是一条罗威纳犬，是一条有主人的狗。据悉，罗威纳犬身体强壮，动作迅猛，气势强悍，已被多座城市列为禁养犬。
5651,2023-10-16,赵本山给徒弟补近亿税额,
5652,2023-10-16,被大型犬撕咬女童母亲发声,
5653,2023-10-16,魏大勋已经不敢抓脚踝了,导语：魏大勋这无处安放的手，一定是看到下蹲抓脚踝了吧 ​​​
5654,2023-10-16,拉布拉多,导语：可爱暖心又聪明的拉布拉多~
5655,2023-10-16,美籍犹太裔学者称应为巴勒斯坦人哭泣,导语：女学生含泪“控诉”美籍犹太裔学者无视犹太人的悲惨遭遇，后者怒怼：如果你还有一点怜悯之心，就应该为巴勒斯坦人哭泣！
5656,2023-10-16,狗主人责任,
5657,2023-10-16,街道办已动员数百人寻找肇事烈犬,导语：10月16日，四川成都崇州一小区一幼童遭未栓绳大型犬撕咬，伤情严重。河北广播电视台记者致电当地街道办获悉：幼童已被送医救治，街道办已动员了数百人在寻找咬人黑色烈犬。 ​
5658,2023-10-16,国足1比2乌兹别克斯坦,导语：比赛结束，国足1-2乌兹别克斯。上半场韦世豪为国足取得领先，下半场乌兹别克斯坦8分钟内连入两球。
5659,2023-10-16,陈楚生不教儿子吉他的原因,导语：综艺《披荆斩棘》陈楚生说不教儿子弹吉他的原因是为了维持父子关系
5660,2023-10-16,MiuMiu钻石内裤,
5661,2023-10-16,宋仲基说儿子嘴唇最像自己,
5662,2023-10-16,再聊下去该网恋了,
5663,2023-10-16,乃万走秀,导语：乃万走秀！
5664,2023-10-16,小伙租123平房子花4万改造成理想的家,导语：杭州网友九十六今年27岁，目前是一位护肤品包装设计师。在杭州5年，搬了10次家，他很讨厌这种长期漂泊的孤独感。于是在工作稳定后，租了一个123平的三室一厅，签了2年长约，每月房租2800元。
5665,2023-10-16,谢娜废土风,导语：谢娜废土风穿搭🈶️
5666,2023-10-16,周雨彤回复韩火火,导语：周雨彤回复韩火火
5667,2023-10-16,警方辟谣大型犬主人被孩子家长砍了,导语：警方辟谣大型犬主人被孩子家长砍了：那是假的，是谣言
5668,2023-10-16,脾胃虚吃这八种食物,
5669,2023-10-16,明天秋裤备好,导语：小伙伴们，秋裤可以备上了！
5670,2023-10-16,毕业五年了辅导员突然叫我干活,导语：毕业五年了辅导员突然叫我干活……
5671,2023-10-16,孟子义问范丞丞是不是创造营第一,导语：《现在就出发》当然了游戏孟子义问范丞丞觉得自己是当年创造营第一名吗
5672,2023-10-16,手滑帮导师上午门诊放了60个号,
5673,2023-10-16,家里这些东西正在偷偷伤害你,
5674,2023-10-16,两大型犬撕咬2岁半女童致严重受伤,导语：10月16日，四川崇州一小区两只狗撕咬一2岁半女孩，孩子受伤严重。涉事小区物业工作人员称，狗咬伤人后逃走，警方等部门正在全力寻找。
5675,2023-10-16,封神编剧新剧透,
5676,2023-10-16,范丞丞喊白敬亭顾九思,
5677,2023-10-16,王鹤棣蓝色挑染,导语：王鹤棣蓝色挑染
5678,2023-10-16,朱一龙河边的错误夺平遥最高奖,导语：第七届平遥国际电影展费穆荣誉最佳影片：《河边的错误》（导演：魏书钧，编剧：康春雷、魏书钧，领衔主演：朱一龙）。 ​
5679,2023-10-16,刘诗诗谢娜同框看秀,导语：刘诗诗谢娜同框看秀
5680,2023-10-16,周也李昀锐cp感,导语：《为有暗香来》周也李昀锐cp感十足！
5681,2023-10-16,国足8分钟连丢两球,导语：国足8分钟连丢两球，乌兹别克斯坦断球反击得手，国足1-2乌兹别克斯坦
5682,2023-10-16,周雨彤下台走错方向,导语：周雨彤大笨蛋！！！！
5683,2023-10-16,双胞胎满100天爱宝出外场了,
5685,2023-10-16,小胖 努力三年只为和你顶峰相见,
5686,2023-10-16,特斯拉车主高速多次别车被刑拘,导语：10月14日，群众报警称在高速公路上被一特斯拉轿车多次别停。经查，臧某宏驾车进入收费站时插队未果，后在高速公路上多次采取紧急刹车、连续变道等方式别停他人车辆，目前已被刑拘。
5687,2023-10-16,被田耕纪气死,
5688,2023-10-16,两句话让对方军师干懵了,
5689,2023-10-16,成都禁养犬名单,导语：有网友表示：“要遛狗的话，牵绳、嘴套、粪袋一个都不能少！”
5690,2023-10-16,一带一路走合作共赢之路带来发展和繁荣,导语：中国人行胜于言、稳扎稳打。“一带一路”带来的是发展和繁荣，走的是合作共赢之路。
5691,2023-10-16,一带一路国际合作高峰论坛开幕式,导语：第三届“一带一路”国际合作高峰论坛于10月17日至18日在北京举行，主题为“高质量共建‘一带一路’，携手实现共同发展繁荣”。
5692,2023-10-16,范丞丞唱了魏大勋他只是经过,导语：《现在就出发》范丞丞唱了魏大勋《他只是经过》，真的是太好听了 ​
5693,2023-10-16,母亲讲述女童被大型犬撕咬致肾破裂,导语：10月16日，四川崇州一小区有大型犬撕咬幼童致其皮肤受伤及肾破裂伤。女孩母亲告诉记者，带女儿出单元时，遭到两只狗扑上来撕咬，后来邻居上前帮忙，众人合力将狗赶走。
5694,2023-10-16,双十一,
5695,2023-10-16,国足vs乌兹别克斯坦,导语：为国足加油，等待奇迹！
5696,2023-10-16,肯豆为什么痘痘没了,
5697,2023-10-16,TTG战胜AG,导语：TTG战胜AG，继续保持
5698,2023-10-16,学网红拍粉底把自己拍流鼻血,导语：#学网红拍粉底把自己拍流鼻血# 学网上用力拍粉底 把鼻子拍流鼻血了 ​
5699,2023-10-16,我们四个把日子过好比什么都强,
5700,2023-10-16,韩国10代爱豆理想型TOP10,
5701,2023-10-16,彭楚粤直播,
5702,2023-10-16,AG 韧性,
5703,2023-10-16,杨千嬅 笑中有泪的是这首歌,
5704,2023-10-16,赵丽颖工作室换头像,导语：赵丽颖工作室换头像
5705,2023-10-16,钟楚曦曾在七夕被分手,
5706,2023-10-16,死掉的大闸蟹有多毒,导语：死掉的大闸蟹还能吃吗？
5707,2023-10-16,迪丽热巴秦岚周也美女贴贴,导语：迪丽热巴秦岚周也美女贴贴
5708,2023-10-16,杭州亚残运村今天开村了,导语：中国代表团所在的公寓外挂满了五星红旗。
5709,2023-10-16,韦世豪破门,导语：国足vs乌兹别克斯坦友谊赛，韦世豪第41分钟精巧远射破门，帮助国足上半场1球领先！
5710,2023-10-16,淄博民警腾出宿舍让游客母子过夜,导语：游客淄博游玩酒店爆满，民警腾出值班宿舍让母子安稳过夜： “大老远来，就是我们的客人！”
5711,2023-10-16,演唱会大合唱真的很好哭,导语：氛围很好的演唱会大合唱真的很难不哭吧！
5712,2023-10-16,赵今麦在穿,
5713,2023-10-16,麻酱拿铁,
5714,2023-10-16,徐穗珍与BRD公司签约,
5715,2023-10-16,韩火火大秀集齐顶流综艺,导语：韩火火在圈内人缘真的强，《青》《创》《快本》《浪姐》在他的大秀都集齐了！谢娜、刘诗诗、周雨彤、蔡文静、孟佳、吴宣仪、许佳琪、利路修等等明星好友都来助阵。
5716,2023-10-16,蔡文静美拉德穿搭,
5717,2023-10-16,问心集集刀,导语：《问心》这两天的剧情全是刀，每一集都让人泪目，太好看了！
5718,2023-10-16,莲花楼台词中的治愈感,导语：《莲花楼》中你印象最深刻的台词是哪句？
5719,2023-10-16,博主100元吃遍东北早市被指造假,导语：近日，某平台400万网红博主在黑龙江挑战100元吃遍东北早市引发关注。当地网友在该早市发现，多数食物与博主视频中的价格不一样。该网友表示不理解博主降低真实价格来欺骗观众，希望大家不要被误导。目前，该博主的原视频在多平台已自行删除。
5720,2023-10-16,外交部建议在以中国公民尽快回国,导语：“当前中国和以色列之间的商业航班仍在运行”，外交部毛宁表示，建议当地的中国公民搭乘商业航班尽快回国。我们将继续认真研判巴以的安全形势，密切跟踪当地空路、陆路的开放情况和安全条件，尽全力为中国公民提供协助。
5721,2023-10-16,AG对战TTG,导语：2023年王者荣耀挑战者杯瑞士轮R2D2，成都AG超玩会对战广州TTG。
5722,2023-10-16,爸妈一次性给了四年的生活费,
5724,2023-10-16,塞尔维亚总统武契奇抵华,导语：10月16日下午，塞尔维亚总统武契奇乘飞机抵达北京首都国际机场。武契奇总统将出席第三届“一带一路”国际合作高峰论坛并参加相关活动。
5725,2023-10-16,胖胖的李,
5726,2023-10-16,被狗咬伤女童生命体征平稳,"导语：经调查，10月16日8时许，邓某与女儿唐某在小区楼下行走时，遇一黑色犬只和一白色犬只，黑色犬只对唐某发起攻击，将其咬伤。8时30分，邓某、唐某被送至医院。经诊断，唐某全身多处咬伤，右肾挫裂伤,右侧肋骨骨折。经全力救治，已完成伤口清创手术，生命体征平稳。"
5727,2023-10-16,自建房造的丑 关我入住后什么事,
5728,2023-10-16,街道办回应女童被大黑狗撕咬,
5729,2023-10-16,仲溪午男狐狸,
5730,2023-10-16,华为 谢霆锋,
5731,2023-10-16,尊重式分手,
5732,2023-10-16,这才是面试官爱听的离职原因,
5733,2023-10-16,拜登回应巴勒斯坦裔男孩被刺死,导语：外媒：美71岁男子刺死6岁巴勒斯坦裔男孩被控仇恨犯罪，拜登谴责
5734,2023-10-16,关智斌找徐良为容祖儿写歌,导语：@關智斌 突击@徐良L 办公室vlog来啦！
5735,2023-10-16,情久唯爱AG,导语：陌冷：想挑战成都AG，主要挑战一诺（徐必成），因为巅峰赛碰到过，我打不过他
5736,2023-10-16,打滴时看到了司机师傅的群名,
5737,2023-10-16,被确诊为纸吸管,
5738,2023-10-16,今天是A股6124点16周年,导语：历史上的今天，2007年10月16日，A股沪指创下6124.04的高点。
5739,2023-10-16,迪丽热巴鎏金长裙梦回乔晶晶,导语：迪丽热巴鎏金长裙梦回乔晶晶
5740,2023-10-16,一起开启丝路奇旅,
5741,2023-10-16,少年欲跳桥轻生被无数双手紧抓救回,导语：近日，四川绵阳。一市民找到正在巡逻的@江油公安交警 称桥边一少年翻越护栏欲跳桥轻生。
5742,2023-10-16,牡丹与玫瑰的丝路流芳,导语：共建“一带一路”倡议提出10年来，国产牡丹畅销海外，进口玫瑰飘香而来。牡丹和玫瑰，穿越地理与时间的界限，搭建民心相通的桥梁，见证“一带一路”助力花卉进出口贸易，造福各国人民。
5743,2023-10-16,深圳一大楼贴膜防止鸟撞,导语：近期深圳一大厦为玻璃贴膜防止“鸟撞”引发关注。
5744,2023-10-16,警方通报女童被狗咬伤,"导语：经调查，10月16日8时许，邓某与女儿唐某在小区楼下行走时，遇一黑色犬只和一白色犬只，黑色犬只对唐某发起攻击，将其咬伤。8时30分，邓某、唐某被送至医院。经诊断，唐某全身多处咬伤，右肾挫裂伤,右侧肋骨骨折。经全力救治，已完成伤口清创手术，生命体征平稳。"
5745,2023-10-16,赵露思 唤醒沉睡银天鹅,
5746,2023-10-16,中国在欧洲的铁杆朋友来了,导语：10月16日下午，塞尔维亚总统武契奇乘飞机抵达北京首都国际机场。武契奇总统将出席第三届“一带一路”国际合作高峰论坛并参加相关活动。
5747,2023-10-16,学生将军训服洗干净后赠给环卫工人,导语：10月15日，河南开封。一高校老师带学生组团收集全校军训后捐赠的闲置军训服，同学们将军训服洗净晾干后免费送给校内外有需要的劳动者。
5748,2023-10-16,重庆震感,导语：09月05日，四川甘孜州泸定县发生6.8级地震，据网友反馈，成都重庆等地震感强烈，愿平安！
5749,2023-10-16,主降临 主认可,导语：魏书钧说最近学了个新词 主降临 主认可
5751,2023-10-16,肖战同路人音源全网上线,
5752,2023-10-16,孟美岐甜妹风,导语：孟美岐生日晒照 是甜妹呀
5753,2023-10-16,小米王化否认新系统命名CNMiOS,导语：今日下午，小米集团公关部总经理王化进行了回应，表示 MIOS、MiOS、CNMiOS 都是错的，这些命名都面临法律诉讼风险。
5754,2023-10-16,DNTSS24大秀,
5755,2023-10-16,余华真的超爱,导语：余华真的超爱
5756,2023-10-16,8旬老人手握竹竿十余年救下数百人,导语：海南琼海，8旬老人手握竹竿十余年救下数百人。
5757,2023-10-16,陈都灵这套可以代所有小说,
5758,2023-10-16,派出所回应一幼儿小区内遭未拴绳大狗撕咬,导语：10月16日，网曝四川成都崇州恒大西辰绿洲小区，一幼儿被未拴绳大狗撕咬。
5759,2023-10-16,国足vs乌兹别克斯坦首发,导语：国足vs乌兹别克斯坦首发出炉，比赛将在19点35分开始！
5760,2023-10-16,国足 预测,
5762,2023-10-16,援藏组15年戈壁滩上种200万棵苗木,导语：接续奋斗10余年，山东潍坊援藏组在海拔4000米的戈壁滩上种植苗木200万棵。
5763,2023-10-16,为何找对象要看脸,
5764,2023-10-16,海底捞回应拒绝给棉花娃娃过生日争议,导语：10月15日，有#网友吐槽海底捞拒绝给棉花娃娃过生日#。对于给玩偶能否坐婴儿椅，海底捞客服表示，公司没有相关的规定，需要咨询一下门店。对于能否为玩偶过生日，客服则表示，也需要咨询门店，因为我们一般情况下都是给顾客过生日的。
5765,2023-10-16,田耕纪的女导演女编剧们,
5766,2023-10-16,拜登称以色列不应占领加沙,导语：拜登日前接受哥伦比亚广播公司CBS的专访，表示认同以色列必须有所回应，摧毁哈马斯。只是当地仍然需要由巴勒斯坦的权力机构所管控，需要一个通往建立巴勒斯坦国的道路。
5767,2023-10-16,罗威纳,
5768,2023-10-16,母亲参加女儿婚礼弄丢10万嫁妆,导语：近日，上海。徐女士从武汉来上海参加女儿的婚礼，抵沪后不慎将包遗失在网约车上，内有价值10万元的金饰嫁妆，她立即报警求助。
5769,2023-10-16,王俊凯是这样使用吗,导语：哈哈哈哈哈哈哈哈哈哈凯哥：请不要过于关注我小时候
5770,2023-10-16,朱一龙和余华撞发色了,导语：朱一龙新发色出席《河边的错误》北大专场放映映后交流，和同场的原作者余华撞发色了。
5772,2023-10-16,吴雅婷问王栎鑫你嗓子还好吗,导语：吴雅婷见到王栎鑫说的第一句话是“你嗓子还好吗” 真的还挺感动的
5773,2023-10-16,周也无处安放的手,
5774,2023-10-16,平遥国际电影展红毯,导语：平遥国际电影展平遥之夜红毯，青年评审荣誉评审团以及众多导演演员亮相！
5775,2023-10-16,李玟二姐称将按遗嘱分配遗产,
5776,2023-10-16,王者周年庆新皮肤首曝,
5777,2023-10-16,迪丽热巴候场小彩蛋,导语：迪丽热巴候场小彩蛋
5778,2023-10-16,以军和哈马斯加沙南部临时停火5小时,导语：【更新】以媒：以总理办公室发表声明，否认停火以允许援助进入加沙有关报道
5779,2023-10-16,陶勇发长文聊问心,导语：陶勇医生发长文聊《问心》观后感，这部剧在医学场景、医疗细节、展现医生生活和呈现医患关系等方面都很真实，代入感很强。
5780,2023-10-16,亚残运村中国队公寓楼挂满国旗,导语：中国代表团所在的公寓外挂满了五星红旗。
5781,2023-10-16,长期处于消极思维更易患老年痴呆,
5782,2023-10-16,双胞胎先出来的那个不一定是老大,
5783,2023-10-16,雷军 别着急这次产品很很很强,
5784,2023-10-16,麦迪出演鹅厂NBA宣传片,导语：NBA新赛季倒计时10天，麦迪@麦蒂Tracy_McGrady 为大家细数联盟新赛季格局，新赛季看NBA，就在腾讯！
5785,2023-10-16,谷村新司去世,
5786,2023-10-16,香港顶流姜涛跑步健身,导语：香港顶流姜涛被网友偶遇跑步健身
5787,2023-10-16,田耕纪空镜,导语：《田耕纪》空镜真的超级漂亮，速来围观！
5788,2023-10-16,白衣大侠李莲花,导语：白衣大侠李莲花
5789,2023-10-16,狗神,
5790,2023-10-16,直接问到沈月本人了,导语：直接问到沈月本人了
5791,2023-10-16,男子去世后妻子发现其微信有暧昧对象,导语：近日，内蒙古赤峰。原告梁某与丈夫黄某（已去世）于1990年登记结婚，2016年起黄某在双方婚姻关系存续期间曾多次私自向与其保持暧昧关系的被告关某通过移动支付方式进行转账。
